tweetId,UserScreenName,UserName,Timestamp,Text,Embedded_text,Emojis,Comments,Likes,Retweets,Image link,Tweet URL
1902872243950301371,@CastilloTrading,Castillo Trading,2025-03-20T23:57:51.000Z,Give me a relief bounce on$TRUMPNot looking for this to happen right away but looking for that $0.20-$0.25 re-test.,Give me a relief bounce on$TRUMPNot looking for this to happen right away but looking for that $0.20-$0.25 re-test.,,21,102,8,https://pbs.twimg.com/media/Gmhb9EVaIAAGN63?format=jpg&name=small,/CastilloTrading/status/1902872243950301371
1902872566089269270,@white_lenka,Lenka White,2025-03-20T23:59:08.000Z,"**Ukraine forces attack multiple targets, including an oil refinery in Russia!

If confirmed, this would mean violation ofTrump-proposed truce ONE DAY laterAccording to media information, the Ukrainian Armed Forces struck the Sudzha gas transmission system on the border","**Ukraine forces attack multiple targets, including an oil refinery in Russia!

If confirmed, this would mean violation ofTrump-proposed truce ONE DAY laterAccording to media information, the Ukrainian Armed Forces struck the Sudzha gas transmission system on the borderShow more",😬,5,16,8,https://pbs.twimg.com/amplify_video_thumb/1902872398401245187/img/lrMDSh7-pF8JNfMy.jpg https://pbs.twimg.com/amplify_video_thumb/1902872398447382529/img/UiLFgrYaI2jhEHDB.jpg https://pbs.twimg.com/amplify_video_thumb/1902872398254202880/img/qK0MGQbJKcUpTncC.jpg,/white_lenka/status/1902872566089269270
1902872670753935870,@iGhostNY,Ghost 𝕏,2025-03-20T23:59:33.000Z,"Costco, like Walmart, pushes Chinese suppliers to absorbTrump’s 20% tariffs, squeezing thin margins. Target cuts China reliance (60% to 30%).#TradeWars#Trump","Costco, like Walmart, pushes Chinese suppliers to absorbTrump’s 20% tariffs, squeezing thin margins. Target cuts China reliance (60% to 30%).#TradeWars#Trump",🔗,1,0,0,,/iGhostNY/status/1902872670753935870
1902723832068354534,@MrBeast,MrBeast,2025-03-20T14:08:07.000Z,I just spent 5 days in Africa at the school meal programs.,Replying to@real_trump_trol,,204,2537,25,,/MrBeast/status/1902723832068354534
1902872281954549843,@NewsForrest,David Forrest,2025-03-20T23:58:00.000Z,"If a legislator from Nacogdoches has her way, a lot of Central Texans would be commuting every day on the President Donald J.TrumpHighway through the middle of#Austin.#TxLege#TxPolitics#ATXtraffic#odd","If a legislator from Nacogdoches has her way, a lot of Central Texans would be commuting every day on the President Donald J.TrumpHighway through the middle of#Austin.#TxLege#TxPolitics#ATXtraffic#odd",,0,0,0,https://pbs.twimg.com/card_img/1965877173052747776/KsjmYAuY?format=jpg&name=small,/NewsForrest/status/1902872281954549843
1902872577036653006,@Cassian_Andor_1,Cassian Andor of Rebel Alliance vs Emperor Trump,2025-03-20T23:59:10.000Z,"Hey Secretary of State ⁦@marcorubio⁩, since you’re deporting immigrants for anti-Semitic speech, deport this Holocaust denier who also throws Nazi salutes!

Deeply disturbing': Musk's 'Hitler didn't murder millions' repost draws outrage - USA TODAY","Hey Secretary of State ⁦@marcorubio⁩, since you’re deporting immigrants for anti-Semitic speech, deport this Holocaust denier who also throws Nazi salutes!

Deeply disturbing': Musk's 'Hitler didn't murder millions' repost draws outrage - USA TODAY",,0,0,0,,/Cassian_Andor_1/status/1902872577036653006
1902872462787760301,@nonchalantnix,biggie shorty,2025-03-20T23:58:43.000Z,How or why are they lettingTrumpdo half this shit. Congress holds too much power for this BS to be going on,How or why are they lettingTrumpdo half this shit. Congress holds too much power for this BS to be going on,,0,0,0,,/nonchalantnix/status/1902872462787760301
1902872505204818270,@iglesias_gabby,Gabriela Iglesias,2025-03-20T23:58:53.000Z,"PresidentTrumpannounces that 50% of DoE bureaucrats have accepted buyout, cutting agency in half","PresidentTrumpannounces that 50% of DoE bureaucrats have accepted buyout, cutting agency in half",,0,3,4,https://pbs.twimg.com/ext_tw_video_thumb/1902872279932923904/pu/img/oV2KnY4zEgozw4s0.jpg,/iglesias_gabby/status/1902872505204818270
1902872689368354994,@stillgray,Ian Miles Cheong,2025-03-20T23:59:37.000Z,Sarah Silverman tells other libs to stop getting triggered byTrump. It sounds like a whole lot of cope. Keep owning the libs.,Sarah Silverman tells other libs to stop getting triggered byTrump. It sounds like a whole lot of cope. Keep owning the libs.,,37,149,21,https://pbs.twimg.com/profile_images/1930649359856848896/y2Czqjrj_bigger.jpg https://pbs.twimg.com/amplify_video_thumb/1902718780792573952/img/ol-5tybHpbZbS-kN.jpg https://pbs.twimg.com/profile_images/1726722240748662784/2BjaL8mX_bigger.jpg,/stillgray/status/1902872689368354994
1902872278582333576,@WajahatAli,Wajahat Ali,2025-03-20T23:57:59.000Z,"A brand spanking new episode of AMERICA UNHINGED with me and@franifiotonight at 8 pm ET.

We're talking to @JamaalBowmanNYTrump's attack on the Department of Education, his racist policies, & the targeting of students and activists.","A brand spanking new episode of AMERICA UNHINGED with me and@franifiotonight at 8 pm ET.

We're talking to @JamaalBowmanNYTrump's attack on the Department of Education, his racist policies, & the targeting of students and activists.",,0,12,2,https://pbs.twimg.com/card_img/1967084577832275968/AxnmfyQ7?format=jpg&name=240x240,/WajahatAli/status/1902872278582333576
1902872155404083340,@bcheliyah_iixv,,2025-03-20T23:57:30.000Z,Out of all the shittrumpshould & could  be worried about ….wtf,Out of all the shittrumpshould & could  be worried about ….wtf,🐝,0,0,0,,/bcheliyah_iixv/status/1902872155404083340
1902872359054315552,@zakisolja,Zaki Solja,2025-03-20T23:58:18.000Z,PresidentTrumpSigns Executive Order to Eliminate the Department of Education,PresidentTrumpSigns Executive Order to Eliminate the Department of Education,,0,0,1,https://pbs.twimg.com/ext_tw_video_thumb/1902826316514332672/pu/img/mK8Zggi8VrxsChga.jpg,/zakisolja/status/1902872359054315552
1902872603154362375,@BeyondWars,Beyond Wars,2025-03-20T23:59:16.000Z,"#Trumpwarns#Yemen’s#Houthisof ""total annihilation."" Meanwhile, the US carried out additional#airstrikeson the#Yemenicapital,#Sanaa, leaving seven women and two children injured.","#Trumpwarns#Yemen’s#Houthisof ""total annihilation."" Meanwhile, the US carried out additional#airstrikeson the#Yemenicapital,#Sanaa, leaving seven women and two children injured.",,0,2,1,https://pbs.twimg.com/media/Gmhce3JbIAAqmvZ?format=jpg&name=small,/BeyondWars/status/1902872603154362375
1902872535160476061,@ozturkh7x,Halil,2025-03-20T23:59:00.000Z,"Turkey —-
The Erdogan regime had its biggest political rival, Istanbul Mayor Ekrem Imamoglu, have his university degree revoked, had him detained on terror charges, and had a phone call withTrumpjust 2 days before#Saraçhane#imamoğlumilleteemanet","Turkey —-
The Erdogan regime had its biggest political rival, Istanbul Mayor Ekrem Imamoglu, have his university degree revoked, had him detained on terror charges, and had a phone call withTrumpjust 2 days before#Saraçhane#imamoğlumilleteemanet",,0,2,2,https://pbs.twimg.com/media/GmhceUNXYAA8S33?format=jpg&name=small,/ozturkh7x/status/1902872535160476061
1902872701359845594,@kathy_gass95502,Kathy g,2025-03-20T23:59:40.000Z,Judge callsTrump administration’s details on Venezuelan deportations ‘woefully inadequate’https://politi.co/4bHatdjvia@politico,Judge callsTrump administration’s details on Venezuelan deportations ‘woefully inadequate’https://politi.co/4bHatdjvia@politico,,0,3,0,https://pbs.twimg.com/card_img/1966632050217414656/QEPmjxs0?format=jpg&name=small,/kathy_gass95502/status/1902872701359845594
1902872648532533643,@newdemocratnow,Ederik Schneider,2025-03-20T23:59:27.000Z,"Sometimes I wish I were a lawyer, especially a constitutional lawyer. I would like to think that POTUS can't eliminate an executive department all by himself and that Congress would have to approve that. But I'm not seeing anywhere where POTUS has that...https://thenewdemocrat1975.com/2025/03/20/meet-the-press-with-kristen-welker-president-trump-cant-unilaterally-dismantle-department-of-education-without-congress/…","Sometimes I wish I were a lawyer, especially a constitutional lawyer. I would like to think that POTUS can't eliminate an executive department all by himself and that Congress would have to approve that. But I'm not seeing anywhere where POTUS has that...https://thenewdemocrat1975.com/2025/03/20/meet-the-press-with-kristen-welker-president-trump-cant-unilaterally-dismantle-department-of-education-without-congress/…",,0,5,0,https://pbs.twimg.com/media/GmhcXBtXQAAC9gb?format=jpg&name=small,/newdemocratnow/status/1902872648532533643
1902872603322384611,@honey__dippa,kunta kimchi,2025-03-20T23:59:16.000Z,Trumpgotta be the dumbest man in America,Trumpgotta be the dumbest man in America,🥢,0,1,0,,/honey__dippa/status/1902872603322384611
1902872368038445170,@numberonepal,Numberonepal,2025-03-20T23:58:20.000Z,"JFK assassination files show 'conspiracy theory' pushed byTrumpis TRUE, journalist says

The JFK assassination files prove that the 'deep state' is real and not just a conspiracy theory pushed by PresidentTrumpand others, a famed journalist says.","JFK assassination files show 'conspiracy theory' pushed byTrumpis TRUE, journalist says

The JFK assassination files prove that the 'deep state' is real and not just a conspiracy theory pushed by PresidentTrumpand others, a famed journalist says.",🐝,1,8,6,https://pbs.twimg.com/media/GmhcFd9aEAIywAQ?format=png&name=small,/numberonepal/status/1902872368038445170
1902872635429568928,@BrexitBin,Brexit Bin#BrexitHasFailed,2025-03-20T23:59:24.000Z,"In case you're wondering whereTrumpgot the idea to close down the Department of Education, it was from Hitler again.#MAGAmerica",Replying to@patriottakes,🕊,2,28,19,https://pbs.twimg.com/media/Gmhck4yWoAAC7im?format=jpg&name=small,/BrexitBin/status/1902872635429568928
1902872545113637045,@MarkStoneLTIR,Trump 2028,2025-03-20T23:59:03.000Z,"Who is a bigger threat to Canada, Danielle Smith orDonald Trump? 

Wondering if it's time for the@RCMPAlbertato investigate Premier Smith for treason?","Who is a bigger threat to Canada, Danielle Smith orDonald Trump? 

Wondering if it's time for the@RCMPAlbertato investigate Premier Smith for treason?",,0,0,0,,/MarkStoneLTIR/status/1902872545113637045
1902872368130785668,@GeorgePlasterer,George Plasterer,2025-03-20T23:58:20.000Z,"We did put 235 judges, progressive judges, judges not under the control ofTrump, last year on the bench, and they are ruling againstTrumptime after time after time.""Schumer 2025","We did put 235 judges, progressive judges, judges not under the control ofTrump, last year on the bench, and they are ruling againstTrumptime after time after time.""Schumer 2025",,0,0,0,,/GeorgePlasterer/status/1902872368130785668
1902872577237815695,@jamesnorth7,James North,2025-03-20T23:59:10.000Z,"Wrong. The real headline:
""TrumpSeizes Partial Control of Paul, Weiss, the Big New York Big Law Firm, After His Threats Force It to Surrender""@FAIRmediawatch@froomkin@protecttruth_","Wrong. The real headline:
""TrumpSeizes Partial Control of Paul, Weiss, the Big New York Big Law Firm, After His Threats Force It to Surrender""@FAIRmediawatch@froomkin@protecttruth_",,2,18,14,https://pbs.twimg.com/media/GmhbnX8X0AA95ez?format=png&name=small,/jamesnorth7/status/1902872577237815695
1902872309809217606,@TrumpGal1776,TrumpGal17,2025-03-20T23:58:06.000Z,Best ever present from a friend with the same sense of humour,Best ever present from a friend with the same sense of humour,🤣 🤣,0,0,0,https://pbs.twimg.com/media/GmhcQcJaEAE-N8C?format=jpg&name=360x360 https://pbs.twimg.com/media/GmhcQcDaEAQ30Qi?format=jpg&name=360x360 https://pbs.twimg.com/media/GmhcQcDaEAMfeCZ?format=jpg&name=360x360,/TrumpGal1776/status/1902872309809217606
1902872382643245348,@DalePearce3,Dale Pearce,2025-03-20T23:58:24.000Z,"Exactly.Trump's claims of returning US wealth to 1900 levels based on the imposition of tariffs ignores the reality that in 2025, unlike 1900, there are other suppliers and markets for his 'competitors'","Exactly.Trump's claims of returning US wealth to 1900 levels based on the imposition of tariffs ignores the reality that in 2025, unlike 1900, there are other suppliers and markets for his 'competitors'",,1,2,2,,/DalePearce3/status/1902872382643245348
1902872570375856324,@tcmassie,Tim Massie,2025-03-20T23:59:09.000Z,"I'm just here for the ratio.@RepMikeLawleris trying to blame this on@JoeBiden. What he fails to mention is the office was closed because of a lease issue, but#Trumpand#Musk, whom Lawler supports, don't want that office to open. Stop gaslighting! This is all on the@GOP.","I'm just here for the ratio.@RepMikeLawleris trying to blame this on@JoeBiden. What he fails to mention is the office was closed because of a lease issue, but#Trumpand#Musk, whom Lawler supports, don't want that office to open. Stop gaslighting! This is all on the@GOP.",,0,2,0,https://pbs.twimg.com/profile_images/1625187685227761664/r-LNjKpP_mini.jpg https://pbs.twimg.com/profile_images/1877085039948668928/f4AibqzY_bigger.jpg https://pbs.twimg.com/media/Gmgl8ruacAAam8N?format=jpg&name=small,/tcmassie/status/1902872570375856324
1902872685211685195,@KarenIrwin44786,Karebear,2025-03-20T23:59:36.000Z,Trumpsigns executive order to begin closing Education Departmenthttps://justthenews.com/politics-policy/holdtrump-signs-executive-order-begin-closing-education-department?utm_medium=social_media&utm_source=twitter_social_icon&utm_campaign=social_icons…via@JustTheNews,Trumpsigns executive order to begin closing Education Departmenthttps://justthenews.com/politics-policy/holdtrump-signs-executive-order-begin-closing-education-department?utm_medium=social_media&utm_source=twitter_social_icon&utm_campaign=social_icons…via@JustTheNews,,0,0,0,https://pbs.twimg.com/card_img/1966494678770941952/4D2LLb37?format=jpg&name=small,/KarenIrwin44786/status/1902872685211685195
1902872635911934261,@primeviewnews,Prime View News,2025-03-20T23:59:24.000Z,"JUST IN - Georgetown researcher arrest escalatesTrumpspeech crackdown, scholars say 

Source - Al Jazeera","JUST IN - Georgetown researcher arrest escalatesTrumpspeech crackdown, scholars say 

Source - Al Jazeera",,0,0,0,,/primeviewnews/status/1902872635911934261
1902872656296484931,@possumbrisbane,Possum 'Cave Proll' Trump - Armchair Expert,2025-03-20T23:59:29.000Z,"Some of us deal with people so extreme, ignorant and bullying they would have you executed as a counter revolutionary if they could.  Defamers too to go with their stupid extremist ignorance","Some of us deal with people so extreme, ignorant and bullying they would have you executed as a counter revolutionary if they could.  Defamers too to go with their stupid extremist ignorance",🌊 🍹 🍸,0,0,0,,/possumbrisbane/status/1902872656296484931
1902872564902539612,@Believeindogs1,Alwaysdogs,2025-03-20T23:59:07.000Z,"Horsford, Sanders and Ocasio-Cortez rally supporters in North Las Vegashttps://news3lv.com/news/local/bernie-sanders-alexandria-ocasio-cortez-aoc-speech-supporters-north-las-vegas-fighting-oligarchy-tour-southern-nevada-nlv-elon-musk-donald-trump…Not a single one of these nutcases voted for NO tax on tips or to prevent men in women’s sports. Bringing radical socialists to Las Vegas is the wrong message for Nevadans.","Horsford, Sanders and Ocasio-Cortez rally supporters in North Las Vegashttps://news3lv.com/news/local/bernie-sanders-alexandria-ocasio-cortez-aoc-speech-supporters-north-las-vegas-fighting-oligarchy-tour-southern-nevada-nlv-elon-musk-donald-trump…Not a single one of these nutcases voted for NO tax on tips or to prevent men in women’s sports. Bringing radical socialists to Las Vegas is the wrong message for Nevadans.Show more",,0,1,0,https://pbs.twimg.com/card_img/1967504628427177984/H_J3yPoh?format=jpg&name=small,/Believeindogs1/status/1902872564902539612
1902872409570443640,@OhNoMo6,OhNo,2025-03-20T23:58:30.000Z,"""Department of Education significantly dismantled in newTrump executive order""
""...White House press secretary Karoline Leavitt told reporters... the executive order would not entirely shutter the agency but  would 'greatly minimize' it.""",Replying to@IsraelandUSA@Odelia_Tooand 11 others,,2,7,7,https://pbs.twimg.com/card_img/1967382108248080384/m8cDP9-8?format=jpg&name=small,/OhNoMo6/status/1902872409570443640
1902872344214765778,@AlanJacobyJr,Alan Jacoby,2025-03-20T23:58:15.000Z,Is Chief Justice Roberts leading the Judicial Insurrection against PresidentTrump's presidency?,Is Chief Justice Roberts leading the Judicial Insurrection against PresidentTrump's presidency?,,9,31,5,,/AlanJacobyJr/status/1902872344214765778
1902872553154023735,@FascistMusk,MuskIsAPutz,2025-03-20T23:59:04.000Z,"""‘Destroys privacy’: Experts panic asTrumpeyes letting Feds raid homes without warrants""https://l.smartnews.com/p-jIftjfO/0hLsW0…#SmartNews","""‘Destroys privacy’: Experts panic asTrumpeyes letting Feds raid homes without warrants""https://l.smartnews.com/p-jIftjfO/0hLsW0…#SmartNews",🌮,0,0,0,,/FascistMusk/status/1902872553154023735
1902872717914689571,@njchamp722_,Nell,2025-03-20T23:59:44.000Z,Pretty sure Hunter Dickinson's been in college since the firstTrump administration,Pretty sure Hunter Dickinson's been in college since the firstTrump administration,,0,0,0,,/njchamp722_/status/1902872717914689571
1902872079453634975,@JennyJenny1958,JennyJenny8675309,2025-03-20T23:57:12.000Z,"Trumppost Truth Social:
Great Article by the wonderful Miranda Devine of The New York Post – A MUST READ on one, of many, out of control, Radical Left Judges!http://nypost.com/2025/03/19/opinion/…","Trumppost Truth Social:
Great Article by the wonderful Miranda Devine of The New York Post – A MUST READ on one, of many, out of control, Radical Left Judges!http://nypost.com/2025/03/19/opinion/…",,0,0,0,https://pbs.twimg.com/media/Gmhb8uCbAAAtBKZ?format=jpg&name=small,/JennyJenny1958/status/1902872079453634975
1902872581700481180,@AesPolitics1,Aes,2025-03-20T23:59:11.000Z,ThankDonald Trumpfor ruining their lives.,ThankDonald Trumpfor ruining their lives.,💯 💯,2,30,8,https://pbs.twimg.com/profile_images/1958956094769770496/OrPXmmSZ_mini.jpg,/AesPolitics1/status/1902872581700481180
1902872450549141957,@joebrooks,Joe Brooks,2025-03-20T23:58:40.000Z,"A DOJ prosecutor has resigned, stating, ""you serve no man,"" highlighting concerns over integrity amidTrump's influence. After years of dedicated service, they felt disconnected from the agency’s values. This reflects the rising tensio… #Resignationhttp://","A DOJ prosecutor has resigned, stating, ""you serve no man,"" highlighting concerns over integrity amidTrump's influence. After years of dedicated service, they felt disconnected from the agency’s values. This reflects the rising tensio… #Resignationhttp://",,0,0,0,,/joebrooks/status/1902872450549141957
1902872337424454093,@MorganEarp12,Morgan Earp,2025-03-20T23:58:13.000Z,"We have no business bombing any nation in the Middle East. This is the result of having too many Jews in theTrump administration! 
Just bring our military forces home!@realDonaldTrump",Replying to@RT_com,,0,5,0,,/MorganEarp12/status/1902872337424454093
1902872498904891883,@TheRifleman11,TheRifleman,2025-03-20T23:58:52.000Z,"TheTrump Administrationmust keep the full court press on!

We have the Deep State on the run!

We must all be relentless!!! Unstoppable!!! Determined!!! Focused!!!","TheTrump Administrationmust keep the full court press on!

We have the Deep State on the run!

We must all be relentless!!! Unstoppable!!! Determined!!! Focused!!!",,0,4,0,,/TheRifleman11/status/1902872498904891883
1902872091591950338,@NatalieDWagner1,Natalie D,2025-03-20T23:57:14.000Z,Trump administrationsent innocent people to a torture prison inEl Salvador because of TATOOS,Trump administrationsent innocent people to a torture prison inEl Salvador because of TATOOS,,0,0,0,https://pbs.twimg.com/profile_images/1088981389960196097/Sw1CTkQx_mini.jpg https://pbs.twimg.com/media/GmgeJOTa0AAS0CK?format=jpg&name=small,/NatalieDWagner1/status/1902872091591950338
1902872754942067020,@EarlSmoothie,NF,2025-03-20T23:59:53.000Z,"All jokes aside, Tim Walz has to do this. How can he say he’d beat anyTrumpsupporter in a *specifically* WWE match, but not do it when offered? 

Our President is in the WWE HOF, our SecDOE is the First Lady of the WWE, and Glenn Jacob’s (Kane) is an elected official. C’mon!!!","All jokes aside, Tim Walz has to do this. How can he say he’d beat anyTrumpsupporter in a *specifically* WWE match, but not do it when offered? 

Our President is in the WWE HOF, our SecDOE is the First Lady of the WWE, and Glenn Jacob’s (Kane) is an elected official. C’mon!!!",,0,4,0,https://pbs.twimg.com/profile_images/1452021521631821824/f23a8LV8_mini.jpg https://pbs.twimg.com/media/GmhEcdYaEAI1WdQ?format=jpg&name=small,/EarlSmoothie/status/1902872754942067020
1902872679558025235,@H_Heather84,MyThoughts&Option's,2025-03-20T23:59:35.000Z,These judges have no Authority.Trumpshould just ignore it seeing how these judges are going against the law!,These judges have no Authority.Trumpshould just ignore it seeing how these judges are going against the law!,,0,2,2,https://pbs.twimg.com/media/GmhcnlDaAAA2uJ1?format=jpg&name=small,/H_Heather84/status/1902872679558025235
1902872251323883745,@TheSierraTree,A Giant Sequoia,2025-03-20T23:57:53.000Z,"I’m sure education never did you any good, ⁦@POTUS⁩ — and I’m sure your grades reflect it.
Why don’t you release them?TrumpSigns Executive Order to 'Eliminate' Education Department - Rolling Stone","I’m sure education never did you any good, ⁦@POTUS⁩ — and I’m sure your grades reflect it.
Why don’t you release them?TrumpSigns Executive Order to 'Eliminate' Education Department - Rolling Stone",,0,0,0,,/TheSierraTree/status/1902872251323883745
1902872570497548513,@TheTrumpGawd,.,2025-03-20T23:59:09.000Z,"if the dept of ed gets gutted, they can take those student loans too.","if the dept of ed gets gutted, they can take those student loans too.",🙃,0,0,0,,/TheTrumpGawd/status/1902872570497548513
1902872695693348903,@ConserLibrarian,ConservativeLibrarian,2025-03-20T23:59:38.000Z,NY Times:TrumpAdmin Sends New Group of Migrants to Gitmohttps://newsmax.com/politics/trump-administration-migrants-gitmo/2025/03/20/id/1203719…,NY Times:TrumpAdmin Sends New Group of Migrants to Gitmohttps://newsmax.com/politics/trump-administration-migrants-gitmo/2025/03/20/id/1203719…,,0,0,0,,/ConserLibrarian/status/1902872695693348903
1902872683517202894,@LucasDBrow71015,Lucas D. Brown,2025-03-20T23:59:36.000Z,Kid Begged Parents for aTrumpBirthday Partyhttps://youtube.com/shorts/tl2HcknSBHo?si=Ecmt4RfHIY4edDHL…via@YouTubeAmazing!!!!! This is another reason why I voted for DJT!,Kid Begged Parents for aTrumpBirthday Partyhttps://youtube.com/shorts/tl2HcknSBHo?si=Ecmt4RfHIY4edDHL…via@YouTubeAmazing!!!!! This is another reason why I voted for DJT!,🤣 ✝ 🙏 🫡 🤣,0,0,0,,/LucasDBrow71015/status/1902872683517202894
1902872228221554739,@edgarrmcgregor,Edgar McGregor,2025-03-20T23:57:47.000Z,"Www.... what?

Limiting to 1.5C? 

In 2025? UnderTrump?","Www.... what?

Limiting to 1.5C? 

In 2025? UnderTrump?",,4,67,12,https://pbs.twimg.com/profile_images/815358035505905664/snuVhCJS_mini.jpg https://pbs.twimg.com/media/GmbxFO1WcAA2ABJ?format=jpg&name=small,/edgarrmcgregor/status/1902872228221554739
1902872605402730821,@YUNGMARC2,YUNG MARC,2025-03-20T23:59:17.000Z,"WithTrump's latest firings, Elon Musk and Jeff Bezos get their wish","WithTrump's latest firings, Elon Musk and Jeff Bezos get their wish",,0,0,0,https://pbs.twimg.com/card_img/1965871933364305921/ZSbkjsS6?format=jpg&name=small,/YUNGMARC2/status/1902872605402730821
1902872358827835894,@Lin5051,Lin505,2025-03-20T23:58:18.000Z,This is exactly why I voted for PresidentTrump. Now maybe our NM children will not be 50th in education.,Replying to@RepTeresaLF,,2,32,1,https://pbs.twimg.com/media/GmhcUuNaEAIquDT?format=jpg&name=small,/Lin5051/status/1902872358827835894
1902872058184568906,@max_associates,MaxAssociates | Patriotic Apparel & Gifts,2025-03-20T23:57:06.000Z,"If you don't likeTrumpBlack Mug (11oz and 15oz) by MaxAssociates 
$16.00-$17.00#MAGA#Trumphttps://etsy.me/3QJQm4tvia@Etsy","If you don't likeTrumpBlack Mug (11oz and 15oz) by MaxAssociates 
$16.00-$17.00#MAGA#Trumphttps://etsy.me/3QJQm4tvia@Etsy",,0,2,2,https://pbs.twimg.com/media/GmhcCdeXQAAXa3-?format=jpg&name=small,/max_associates/status/1902872058184568906
1902872437580239174,@jahangirbutt06,"Jahangir/acc (Ø,G) .ink 1 .gm jahangirr1.base.eth",2025-03-20T23:58:37.000Z,BREAKING: PresidentTrumpdeclares that the US will be the#Bitcoinsuperpower & the Crypto capital of the world!,BREAKING: PresidentTrumpdeclares that the US will be the#Bitcoinsuperpower & the Crypto capital of the world!,🔥,0,0,0,https://pbs.twimg.com/media/GmhcY0nawAAsBFl?format=jpg&name=900x900,/jahangirbutt06/status/1902872437580239174
1902872777163415869,@Poxous1413,Todd Freedom,2025-03-20T23:59:58.000Z,"TrumpSigns Order ENDING The Department Of Education, Woke IS OVER w/Tif...https://youtube.com/live/PQXre3SDzpM?si=hM3ITGD9VtiF7hUx…via@YouTube","TrumpSigns Order ENDING The Department Of Education, Woke IS OVER w/Tif...https://youtube.com/live/PQXre3SDzpM?si=hM3ITGD9VtiF7hUx…via@YouTube",,0,1,1,,/Poxous1413/status/1902872777163415869
1902872047299998004,@MLive,MLive,2025-03-20T23:57:04.000Z,Trump’s plan to dismantle Education Department keeps some core functions,Trump’s plan to dismantle Education Department keeps some core functions,,22,20,2,https://pbs.twimg.com/card_img/1964861741117878272/cELFbIdl?format=jpg&name=small,/MLive/status/1902872047299998004
