tweetId,UserScreenName,UserName,Timestamp,Text,Embedded_text,Emojis,Comments,Likes,Retweets,Image link,Tweet URL
1920991803345354825,@Pdaug44,Otto Palindrome,2025-05-09T23:58:30.000Z,TrumpWants to Make Alcatraz Great Again!,TrumpWants to Make Alcatraz Great Again!,,0,0,0,,/Pdaug44/status/1920991803345354825
1920992152223367303,@Wildharv,Spazty McSperg,2025-05-09T23:59:54.000Z,IfTrumpboycotts Israel will Greg Abbot throw him in Texas jail?,IfTrumpboycotts Israel will Greg Abbot throw him in Texas jail?,,4,17,3,,/Wildharv/status/1920992152223367303
1920991722965725575,@deenie7940,Deenie,2025-05-09T23:58:11.000Z,Trumpdefends idea of raising taxes on wealthiest Americans: 'It's good politics' - Fox News,Trumpdefends idea of raising taxes on wealthiest Americans: 'It's good politics' - Fox News,,0,4,1,,/deenie7940/status/1920991722965725575
1920992145600647391,@ConcreteGoat,Concrete Goat,2025-05-09T23:59:52.000Z,"#MogShotlooks like a sendoooorr

bdFc9azbbpKy6ELTHduV2VZZDEk53r8X1LBnMfApump$trump$mog","#MogShotlooks like a sendoooorr

bdFc9azbbpKy6ELTHduV2VZZDEk53r8X1LBnMfApump$trump$mog",👀 👀 👀,1,11,4,https://pbs.twimg.com/media/Gqi8LDiWgAINfoa?format=jpg&name=small,/ConcreteGoat/status/1920992145600647391
1920991643206926533,@bonebornillness,moose,2025-05-09T23:57:52.000Z,What if instead of president of the United StatesDonald Trumpwas pregnant with the United states,What if instead of president of the United StatesDonald Trumpwas pregnant with the United states,,0,0,0,,/bonebornillness/status/1920991643206926533
1920991752418169174,@therayban,God BlessUSA(TRB),2025-05-09T23:58:18.000Z,"Watch ""WATCH: Pres.TrumpSigns EOs Undoing Biden’s Restrictions on Gas Water Heaters, and More - 5/9/25"" on YouTube","Watch ""WATCH: Pres.TrumpSigns EOs Undoing Biden’s Restrictions on Gas Water Heaters, and More - 5/9/25"" on YouTube",,0,0,0,https://pbs.twimg.com/card_img/1967405955458666496/gh86eeNU?format=jpg&name=240x240,/therayban/status/1920991752418169174
1920991593944785241,@Ken4uandme,Ken Engledow,2025-05-09T23:57:40.000Z,"Leavitt: ""It’s Frankly Ridiculous to SuggestTrumpActs for His Own Benefit"" Amid Ethics Scrutinyhttps://msn.com/en-us/news/other/leavitt-it-s-frankly-ridiculous-to-suggest-trump-acts-for-his-own-benefit-amid-ethics-scrutiny/vi-AA1Eus4k?ocid=socialshare#comments…how many billions of dollars do you think thetrumpand his son in law will personally get after this trip like in his  first term","Leavitt: ""It’s Frankly Ridiculous to SuggestTrumpActs for His Own Benefit"" Amid Ethics Scrutinyhttps://msn.com/en-us/news/other/leavitt-it-s-frankly-ridiculous-to-suggest-trump-acts-for-his-own-benefit-amid-ethics-scrutiny/vi-AA1Eus4k?ocid=socialshare#comments…how many billions of dollars do you think thetrumpand his son in law will personally get after this trip like in his  first term",,0,0,0,,/Ken4uandme/status/1920991593944785241
1920992115112214643,@CathyMcInturff,DARK BLUE,2025-05-09T23:59:45.000Z,"#DONTBeLikeDonald#TrumpIsUnfitForOfficeI'm not Catholic but was moved to tearshearing the COMFORTING HOPEFUL HEALING words from#PopeLeoXIVyesterday, whenTrumphas filledwith LIES, FEAR and HATE...#LOVETrumpsHATE","#DONTBeLikeDonald#TrumpIsUnfitForOfficeI'm not Catholic but was moved to tearshearing the COMFORTING HOPEFUL HEALING words from#PopeLeoXIVyesterday, whenTrumphas filledwith LIES, FEAR and HATE...#LOVETrumpsHATE",🤪 🤳 🤥 🤳 🤡 🤳 🤬 ❌ 🥹 🙏 🥰 🤬,0,2,2,https://pbs.twimg.com/profile_images/1390018317864296450/bk21WUAT_mini.png https://pbs.twimg.com/media/GqhsRicXIAA73XB?format=jpg&name=small,/CathyMcInturff/status/1920992115112214643
1920992025165324562,@profdwb1,Dan Baggs,2025-05-09T23:59:23.000Z,Fact Sheet: President Donald J.TrumpEstablishes Project Homecoming,Fact Sheet: President Donald J.TrumpEstablishes Project Homecoming,,0,0,0,https://pbs.twimg.com/card_img/1967288684446978048/BTLwx7Qy?format=jpg&name=small,/profdwb1/status/1920992025165324562
1920992054013829254,@Realscotterritt,Scott Ritteer,2025-05-09T23:59:30.000Z,"May 2025: An American Pope rises. Sources point toTrump-linked operations recovering Vatican gold and shifting global power. Barr and Jones were right — it was never just politics.

POWER IS SHIFTING, AND THE GOLD TELLS THE STORY","May 2025: An American Pope rises. Sources point toTrump-linked operations recovering Vatican gold and shifting global power. Barr and Jones were right — it was never just politics.

POWER IS SHIFTING, AND THE GOLD TELLS THE STORY",,0,1,1,https://pbs.twimg.com/media/Gqi8FnRXEAE4VQq?format=jpg&name=small,/Realscotterritt/status/1920992054013829254
1920992060552950054,@Amalgamyte_VT,Amalgamyte,2025-05-09T23:59:32.000Z,TrumpDrops Israel and We Have A New Pope! Interesting Times Ahead...,TrumpDrops Israel and We Have A New Pope! Interesting Times Ahead...,🐺 ♨,0,18,3,,/Amalgamyte_VT/status/1920992060552950054
1920991868503961728,@sofian_athawre,sofian-الثوري Tabi,2025-05-09T23:58:46.000Z,"TrumpDROPS Netanyahu, Fuentes v Withers Reaction, EmilyGRIFTSAmerica An...https://youtube.com/live/lMoOeRvBCog?si=myvNLsq_6_84WsAy…via@YouTube","TrumpDROPS Netanyahu, Fuentes v Withers Reaction, EmilyGRIFTSAmerica An...https://youtube.com/live/lMoOeRvBCog?si=myvNLsq_6_84WsAy…via@YouTube",,0,0,0,,/sofian_athawre/status/1920991868503961728
1920991785628684598,@ArlenWms,Arlen Williams,2025-05-09T23:58:26.000Z,"We demand theTrump Administrationend all genetic manipulation, especially the phony mRNA that you invited, Dr. Malone.

That is a good start.",Replying to@RWMaloneMD,,0,4,2,,/ArlenWms/status/1920991785628684598
1920991254092914743,@BFosberg9929,Buddyfoz,2025-05-09T23:56:19.000Z,So ice arrests the mayor of Newark outside an immigrant detention center. ButTrumpis ok leading an insurrection on the capital and all the J6 traitors were given due process and trials.  A guilty as fuk.Trumppardons and has Ice violating the constitution. PatheticTrump,So ice arrests the mayor of Newark outside an immigrant detention center. ButTrumpis ok leading an insurrection on the capital and all the J6 traitors were given due process and trials.  A guilty as fuk.Trumppardons and has Ice violating the constitution. PatheticTrump,,0,3,0,,/BFosberg9929/status/1920991254092914743
1920991878381457495,@Brasher46,noproblem,2025-05-09T23:58:48.000Z,This is aDonald Trumpnightmare that will end his presidency if the Jeffrey Epstein files are released undoctored . Bondi and Patel are cooking the books no matters how photos are on file.,Replying to@BreakingNews4X,,0,0,0,,/Brasher46/status/1920991878381457495
1920646830985007307,@slashdot,Slashdot,2025-05-09T01:07:43.000Z,TrumpTo End Biden-Era High-Speed Internet Program,TrumpTo End Biden-Era High-Speed Internet Program,,2,10,2,,/slashdot/status/1920646830985007307
1920991791311917129,@NatalieK36182,Natalie,2025-05-09T23:58:28.000Z,Mothers Day withTrump& Melania,Mothers Day withTrump& Melania,💐 🥂,2,27,2,https://pbs.twimg.com/media/Gqi71N8bcAIdiKZ?format=jpg&name=small,/NatalieK36182/status/1920991791311917129
1920991466475708425,@MariaGibso30609,Maria Gibson,2025-05-09T23:57:10.000Z,"Federal judge appears likely to temporarily
Halttrump's sweeping gov. Overhaul#npr","Federal judge appears likely to temporarily
Halttrump's sweeping gov. Overhaul#npr",,0,0,0,,/MariaGibso30609/status/1920991466475708425
1920947413381943711,@TheOnion,The Onion,2025-05-09T21:02:07.000Z,Supreme Court RulesTrumpHas Immunity For Any Crime Committed Between 9 And 5,Replying to@TheOnion,,2,74,9,https://pbs.twimg.com/card_img/1967610826421846016/IViduCFW?format=jpg&name=small,/TheOnion/status/1920947413381943711
1920932711058780614,@engadget,Engadget,2025-05-09T20:03:42.000Z,TheTrump administrationwants to photograph everyone leaving the US by car,TheTrump administrationwants to photograph everyone leaving the US by car,,1,11,5,,/engadget/status/1920932711058780614
1920991924003238237,@ekulide23259,Inon'E,2025-05-09T23:58:59.000Z,"My congratulations to presidentTrumpwho prophesied about a possible U S Pope through his AI picture. While ignorant and naive people kept on ranting about death of Pope Francis who was opposed toTrumpduring Nov election,Trumpkept on working. Today, U. S has won the victory","My congratulations to presidentTrumpwho prophesied about a possible U S Pope through his AI picture. While ignorant and naive people kept on ranting about death of Pope Francis who was opposed toTrumpduring Nov election,Trumpkept on working. Today, U. S has won the victoryShow more",,0,0,0,,/ekulide23259/status/1920991924003238237
1920991991954821386,@rhonda_harbison,Rhonda Harbison,2025-05-09T23:59:15.000Z,"@amuse@elonmuskhttps://x.com/kyledcheney/status/1920924839684305032…Kyle Cheney on X: ""JUST IN: A judge in Md. saysDonald Trump's pardon ...",Replying to@JustaskCB1@CalltoActivismand@StephenM,,0,0,0,https://pbs.twimg.com/profile_images/1857862961831809024/1_VjJzLk_mini.jpg https://pbs.twimg.com/media/Gqh-5yiWUAA5nRu?format=jpg&name=small https://pbs.twimg.com/media/Gqh-6aBWMAAOicR?format=jpg&name=360x360,/rhonda_harbison/status/1920991991954821386
1920992043939361276,@ausstockchick,that stock chick,2025-05-09T23:59:28.000Z,"The China tariffs implemented by#Trumpare pretty steep!

The first wave of Chinese goods hit LA and Long Beach ports underTrump’s new 145%+ tariffs…

12,000 containers headed to the likes of Amazon and Ikea.

Yesterday,Trumpsaid he might cut tariffs to 80%.#US","The China tariffs implemented by#Trumpare pretty steep!

The first wave of Chinese goods hit LA and Long Beach ports underTrump’s new 145%+ tariffs…

12,000 containers headed to the likes of Amazon and Ikea.

Yesterday,Trumpsaid he might cut tariffs to 80%.#US",,2,13,0,,/ausstockchick/status/1920992043939361276
1920992072737185794,@NoraCla29317347,the world hates trump,2025-05-09T23:59:35.000Z,"Those who violate civil rights under the guise of ""just following orders"" are just as guilty of the crime as those who order it.#ImpeachTrumpNOW","Those who violate civil rights under the guise of ""just following orders"" are just as guilty of the crime as those who order it.#ImpeachTrumpNOW",,0,0,0,https://pbs.twimg.com/profile_images/1835627994687131648/aDjlZSK0_mini.jpg,/NoraCla29317347/status/1920992072737185794
1920991990147084738,@AB_OK_SOONER,Sooner Trump,2025-05-09T23:59:15.000Z,First season in the SEC. Not bad Sooners!#BOOMER,First season in the SEC. Not bad Sooners!#BOOMER,✨,0,1,0,https://pbs.twimg.com/profile_images/1962622107617013760/MNx0Mipk_mini.jpg https://pbs.twimg.com/profile_images/1604932826780016642/NOO7E9ig_bigger.png https://pbs.twimg.com/media/Gqi7v34WMAAUYXj?format=jpg&name=small,/AB_OK_SOONER/status/1920991990147084738
1920992016344735807,@Christop1Moquin,Moquin Christopher,2025-05-09T23:59:21.000Z,"IfTrumpkeeps this up, he’ll end up with one  of Mexico’s hottest chillis up his arse.","IfTrumpkeeps this up, he’ll end up with one  of Mexico’s hottest chillis up his arse.",,0,0,0,https://pbs.twimg.com/card_img/1965977904040353792/prPN_bUs?format=jpg&name=small,/Christop1Moquin/status/1920992016344735807
1920991632989487161,@david_arcano,David Arcano,2025-05-09T23:57:50.000Z,Soros-Linked Groups Sue to StopTrump‘s Migrant Child Trafficking Crackdownhttps://breitbart.com/politics/2025/05/09/soros-linked-groups-sue-to-stop-trump-migrant-child-trafficking-crackdown/…via@BreitbartNews/ Sounds like Soro might be a pedophile with this action!,Soros-Linked Groups Sue to StopTrump‘s Migrant Child Trafficking Crackdownhttps://breitbart.com/politics/2025/05/09/soros-linked-groups-sue-to-stop-trump-migrant-child-trafficking-crackdown/…via@BreitbartNews/ Sounds like Soro might be a pedophile with this action!,,0,1,1,https://pbs.twimg.com/card_img/1967396899784216576/ja4U713u?format=jpg&name=small,/david_arcano/status/1920991632989487161
1920991423354024332,@Richard28353205,Richard {Most Pleased For Second Trump Adm. MAGA},2025-05-09T23:57:00.000Z,Please leave as we are ashamed of you!,Please leave as we are ashamed of you!,🦅,0,0,0,https://pbs.twimg.com/profile_images/1541200919618011137/Yzl0b3x2_mini.jpg https://pbs.twimg.com/media/GqeM2yqXoAEE0Lf?format=jpg&name=small,/Richard28353205/status/1920991423354024332
1920991689143185854,@MAGATimesLive,MAGA Times,2025-05-09T23:58:03.000Z,Kremlin official says he’s meetingTrumpadmin in first Russian visit to US since Ukraine warhttps://magatimes.com/kremlin-official-says-hes-meeting-trump-admin-in-first-russian-visit-to-us-since-ukraine-war/?utm_source=twitter&utm_medium=social&utm_campaign=ReviveOldPost…,Kremlin official says he’s meetingTrumpadmin in first Russian visit to US since Ukraine warhttps://magatimes.com/kremlin-official-says-hes-meeting-trump-admin-in-first-russian-visit-to-us-since-ukraine-war/?utm_source=twitter&utm_medium=social&utm_campaign=ReviveOldPost…,,0,0,0,,/MAGATimesLive/status/1920991689143185854
1920992003099087023,@sboulette,I'm an American,2025-05-09T23:59:18.000Z,"With the lack of Transparency from the Biden transportation sec@PeteButtigiegHow many times do you think we’ve had outages in the airports that were not reported?

Many people trusted their lives to incompetent pothole Pete.

NOW:

Thank God forTrumpand@SecDuffy","With the lack of Transparency from the Biden transportation sec@PeteButtigiegHow many times do you think we’ve had outages in the airports that were not reported?

Many people trusted their lives to incompetent pothole Pete.

NOW:

Thank God forTrumpand@SecDuffy",,0,0,0,,/sboulette/status/1920992003099087023
1920991906890231870,@FASTMOVER1,Trump Crime Family #BoycottTesla,2025-05-09T23:58:55.000Z,"#DrunkSecDefcan't pick his new Chief of StaffWhite House to take choice of Pentagon chief of staff out of Hegseth’s hands
-The Guardian","#DrunkSecDefcan't pick his new Chief of StaffWhite House to take choice of Pentagon chief of staff out of Hegseth’s hands
-The Guardian",😅,0,2,1,https://pbs.twimg.com/card_img/1966611588158550017/lH1b7M41?format=jpg&name=small,/FASTMOVER1/status/1920991906890231870
1920992159546712175,@CleaveSonny,Sonny Van Cleave,2025-05-09T23:59:55.000Z,Gavin Newsom tweaksTrump’s tariffs in new Fox News adhttps://politi.co/4jHT9b6via@politicoGavin Newsom is a worthless piece of shit who needs to keep his mouth shut,Gavin Newsom tweaksTrump’s tariffs in new Fox News adhttps://politi.co/4jHT9b6via@politicoGavin Newsom is a worthless piece of shit who needs to keep his mouth shut,,0,0,0,,/CleaveSonny/status/1920992159546712175
1920991712123465914,@RenaFan343666,Rererere,2025-05-09T23:58:09.000Z,"Hey Barbie, what’s your comment onTrump’s 100% tariff on Mattel?@Mattel@Barbie","Hey Barbie, what’s your comment onTrump’s 100% tariff on Mattel?@Mattel@Barbie",,0,0,0,,/RenaFan343666/status/1920991712123465914
1920991288620708026,@websterkaroon,Alireza Talakoubnejad,2025-05-09T23:56:28.000Z,I'm going to emphasize a point I've made again & again - you will drive yourself mad trying to understand US-Iran nuclear negotiations by focusing only on media games by both sides.Trumpis very good at making loud statements that freak everyone out & then suddenly making,I'm going to emphasize a point I've made again & again - you will drive yourself mad trying to understand US-Iran nuclear negotiations by focusing only on media games by both sides.Trumpis very good at making loud statements that freak everyone out & then suddenly makingShow more,,3,22,3,,/websterkaroon/status/1920991288620708026
1920992019553366471,@JennyHaines19,Jenny Haines,2025-05-09T23:59:22.000Z,The Catholic Church had always resisted a North American pope. Is Leo XIV the anti-Trump?#immigration,The Catholic Church had always resisted a North American pope. Is Leo XIV the anti-Trump?#immigration,,0,0,0,,/JennyHaines19/status/1920992019553366471
1920992010023907788,@mage__t,Barron Trump jr,2025-05-09T23:59:20.000Z,IT HAS STARTED !!!,IT HAS STARTED !!!,🚨 🚨 🚨 🚨 🚨 🚨,1,2,2,https://pbs.twimg.com/media/Gqi8DNGWEAA-EnG?format=jpg&name=small,/mage__t/status/1920992010023907788
1920991476843978797,@GuntherEagleman,Gunther Eagleman™,2025-05-09T23:57:13.000Z,"IfTrumpfired a Librarian, then she deserved to be fired.  

Next.","IfTrumpfired a Librarian, then she deserved to be fired.  

Next.",,75,728,73,,/GuntherEagleman/status/1920991476843978797
1920991649003401552,@EarthoOS,Earthy,2025-05-09T23:57:54.000Z,How many votes wouldTrumpreceive if Biden never withdrew?,How many votes wouldTrumpreceive if Biden never withdrew?,🌎 🦆,2,6,0,,/EarthoOS/status/1920991649003401552
1920992111333089492,@RebeccaBow84,Rebecca Bowers,2025-05-09T23:59:44.000Z,YEAH AND HIS NAME ISDONALD TRUMP,Replying to@catturd2,👍 👍,0,7,0,,/RebeccaBow84/status/1920992111333089492
1920992045071585659,@TsnycTsnyc22,steve 456,2025-05-09T23:59:28.000Z,"I’m atrumpsupporter but his tariff policy is one of the dumbest things I’ve ever seen.  In addition, tariffs are an extremely regressive tax.  When the poor and middle class realize their spending power has decreased the republicans are gonna get crushed.",Replying to@DeItaone,,14,104,7,,/TsnycTsnyc22/status/1920992045071585659
1920991846337016110,@MediasetTgcom24,Tgcom24,2025-05-09T23:58:41.000Z,"Media,Trumpblocca Hegseth per la scelta del chief of staff#trump#usa#9maggio","Media,Trumpblocca Hegseth per la scelta del chief of staff#trump#usa#9maggio",,1,2,2,,/MediasetTgcom24/status/1920991846337016110
1920991557697622528,@hollybRN07,Hollly,2025-05-09T23:57:32.000Z,Donald Trumpis the antichrist,Replying to@SykesCharlieand@Alva5915George,,0,2,0,,/hollybRN07/status/1920991557697622528
1920991486956409004,@MelissaMunro1,Melissa Munro,2025-05-09T23:57:15.000Z,"The Mayor of Newark, New Jersey has been arrested byTrumpGestapo. This is now the US. -- Canada - this is the trajectory the CPC party and their supporters want for our country. America - we weep for you.","The Mayor of Newark, New Jersey has been arrested byTrumpGestapo. This is now the US. -- Canada - this is the trajectory the CPC party and their supporters want for our country. America - we weep for you.",🤓,1,2,0,https://pbs.twimg.com/profile_images/1910893766136705024/DyjEWQh__mini.jpg https://pbs.twimg.com/amplify_video_thumb/1920938708179550208/img/HaXO-_vl0u8xHOln.jpg,/MelissaMunro1/status/1920991486956409004
1920991560340066517,@BostonFren_88,Wholesome™ Dave,2025-05-09T23:57:32.000Z,"Trumpshould remove that commie woman from the 250th American Anniversary Committee and make@HulkHoganthe head of it, brother.","Trumpshould remove that commie woman from the 250th American Anniversary Committee and make@HulkHoganthe head of it, brother.",🦄 🧃,0,9,0,,/BostonFren_88/status/1920991560340066517
1920991827093844293,@BrazenDaily,Brazen Daily,2025-05-09T23:58:36.000Z,"News for the Left: Pelosi hopes Pope Leo will speak out againstTrump's deportations...

News for the Right: Christian Foster Family narrowly avoided the gender insanity under Tim Walz's Minnesota leadership...

For the full news:http://brazendaily.com","News for the Left: Pelosi hopes Pope Leo will speak out againstTrump's deportations...

News for the Right: Christian Foster Family narrowly avoided the gender insanity under Tim Walz's Minnesota leadership...

For the full news:http://brazendaily.com",,0,0,0,,/BrazenDaily/status/1920991827093844293
1920991657090077068,@Blaze1826,北京多囊卵巢综合症试管代孕技术哪里做的最好,2025-05-09T23:57:56.000Z,"I appreciate fact thatTrumpdoesn't kiss your f'n a'sses, for your votes, bc that's what you dirtbags .#Tillis","I appreciate fact thatTrumpdoesn't kiss your f'n a'sses, for your votes, bc that's what you dirtbags .#Tillis",,0,0,0,,/Blaze1826/status/1920991657090077068
1920991654799978826,@JenniferEValent,Jennifer Erin Valent,2025-05-09T23:57:55.000Z,"I want to know the same thing. Are we that country now? The one where masked men can manhandle or snatch people off the street? Are we now the country where law enforcement is unaccountable, where they act first and ask questions later... if at all? Is thatTrump's America?","I want to know the same thing. Are we that country now? The one where masked men can manhandle or snatch people off the street? Are we now the country where law enforcement is unaccountable, where they act first and ask questions later... if at all? Is thatTrump's America?",,8,129,47,https://pbs.twimg.com/profile_images/1967733916674011136/AQB43nrA_mini.jpg https://pbs.twimg.com/amplify_video_thumb/1920927036190662656/img/cFKeC2Zw5CvA7Y83.jpg,/JenniferEValent/status/1920991654799978826
1920991604988338249,@Yalabetit14,Yalabetit,2025-05-09T23:57:43.000Z,"@FoxNewsLaura Ingraham on Friday May 9th at 6:35pm:
“No one is above the law”@StephenMDonald Trump’s
Senior White House adviser on Friday May 9th at 5:01 pm:
“we're actively looking at suspending the [constitutionally protected] writ of habeas corpus”",Replying to@StephenM,,0,1,0,,/Yalabetit14/status/1920991604988338249
1920991982937088437,@essenviews,EssenViews,2025-05-09T23:59:13.000Z,_trump_we_already_made_a_great_deal_were_not_doing-tb5kchw9ptze1 (1),_trump_we_already_made_a_great_deal_were_not_doing-tb5kchw9ptze1 (1),,0,0,1,,/essenviews/status/1920991982937088437
1920991947444859361,@eg1701,Dr. G.,2025-05-09T23:59:05.000Z,"It’s a significant tax burden on small businesses and individuals. In the coming weeks, many small businesses will close down, and people will feel the impact. It’s all self-inflicted and the result of poor planning.Trumpis to blame for the consequences and the negative impact",Replying to@RpsAgainstTrump,,2,21,6,,/eg1701/status/1920991947444859361
1920671835948999166,@JDaIey,Jordan Daley,2025-05-09T02:47:04.000Z,We gotDonald Trumpand an American Pope before GTA VI.,Replying to@dom_lucre,,0,1,0,https://pbs.twimg.com/profile_images/1912594135925575680/bBuGllwu_bigger.jpg,/JDaIey/status/1920671835948999166
1920991606426964200,@jebocanegra1,rainmaker #Resist #SlavaUkraini,2025-05-09T23:57:43.000Z,Did you noticeTrump’s flattened shoes?#shortvideo#shorts#celebrity#u...https://youtube.com/shorts/AreejHmbay0?feature=shared…via@YouTube,Did you noticeTrump’s flattened shoes?#shortvideo#shorts#celebrity#u...https://youtube.com/shorts/AreejHmbay0?feature=shared…via@YouTube,,0,0,0,,/jebocanegra1/status/1920991606426964200
1920991365598519483,@AlvaRachel64,Rachel,2025-05-09T23:56:46.000Z,"Trumpis trying to pick people who will make him look better. Unfortunately, you can't make a sack of shit look better.","Trumpis trying to pick people who will make him look better. Unfortunately, you can't make a sack of shit look better.",💙 💙,2,30,6,,/AlvaRachel64/status/1920991365598519483
1920991287345320096,@Susan57148,Susan Gray,2025-05-09T23:56:27.000Z,"PresidentTrump's Middle East Stakes | Faith Nation - May 9, 2025https://youtu.be/AaJpdRtTpR0?si=sPaYRkEvcp6QZqE7…via@YouTube","PresidentTrump's Middle East Stakes | Faith Nation - May 9, 2025https://youtu.be/AaJpdRtTpR0?si=sPaYRkEvcp6QZqE7…via@YouTube",,2,4,0,,/Susan57148/status/1920991287345320096
1920991324410454068,@BboyMaestro,Maestrodyne,2025-05-09T23:56:36.000Z,Ocean’s Thirteen was a warning aboutTrump.,Ocean’s Thirteen was a warning aboutTrump.,,0,0,0,,/BboyMaestro/status/1920991324410454068
1920991696008949991,@hateGOP,Resist hateful GOP policies,2025-05-09T23:58:05.000Z,"After a hint of independence, the FBI’s Kash Patel falls back in line withTrump’s agenda.
Given Patel’s ridiculous record, he should at least try to bolster his credibility. The unqualified FBI director appears to be doing the opposite.","After a hint of independence, the FBI’s Kash Patel falls back in line withTrump’s agenda.
Given Patel’s ridiculous record, he should at least try to bolster his credibility. The unqualified FBI director appears to be doing the opposite.",,0,1,0,,/hateGOP/status/1920991696008949991
1920992000876146787,@drinksterjoe,Wait what,2025-05-09T23:59:17.000Z,People watched the Joe RoganTrumpepisode and realized he was really just a regular fucking guy and not schizo turbo orange napoleon hitler,People watched the Joe RoganTrumpepisode and realized he was really just a regular fucking guy and not schizo turbo orange napoleon hitler,,0,1,0,https://pbs.twimg.com/profile_images/1879703641382330368/n-2uyAGU_mini.jpg,/drinksterjoe/status/1920992000876146787
1920991906567159985,@jeffscott845,Popeye,2025-05-09T23:58:55.000Z,This is exactly right. PresidentTrumpis a good man.,This is exactly right. PresidentTrumpis a good man.,,0,1,1,https://pbs.twimg.com/profile_images/1325087660428447746/4DL2iq76_mini.jpg https://pbs.twimg.com/amplify_video_thumb/1920977029002129410/img/gRfhQTpkZTOC6-rO.jpg,/jeffscott845/status/1920991906567159985
1920991839592587432,@GraceGotYou,America Loves President Trump,2025-05-09T23:58:39.000Z,"NO. ONE. IS. ABOVE. THE. LAW.
NO. ONE.","NO. ONE. IS. ABOVE. THE. LAW.
NO. ONE.",✊,0,1,2,https://pbs.twimg.com/profile_images/1918001055465345024/OuAWhsKU_mini.jpg https://pbs.twimg.com/profile_images/1712135718326161408/Y7rGc_uj_bigger.jpg,/GraceGotYou/status/1920991839592587432
1920991146223833433,@OneXOneY,Make Men Great Again,2025-05-09T23:55:54.000Z,"Boom. That’s how you do it.Trump’s not handing out free passes like the left does. he’s delivering reality with a side of consequences. If you want to come to America, you better do it legally",Replying to@WhiteHouse,,4,32,5,,/OneXOneY/status/1920991146223833433
