tweetId,UserScreenName,UserName,Timestamp,Text,Embedded_text,Emojis,Comments,Likes,Retweets,Image link,Tweet URL
1903234877715013970,@LarryBoorstein,Laurence (Larry) Boorstein,2025-03-21T23:58:49.000Z,"Trumpcomplains of judges wanting to ""assume the powers of the Presidency without having to attain 80 million votes."" No, they are simply acting as the judicial branch as our Founders said they should. PlusTrumponly won by 2,249,002 votes, the number not offset by Harris votes.","Trumpcomplains of judges wanting to ""assume the powers of the Presidency without having to attain 80 million votes."" No, they are simply acting as the judicial branch as our Founders said they should. PlusTrumponly won by 2,249,002 votes, the number not offset by Harris votes.",,0,0,0,https://pbs.twimg.com/profile_images/874276197357596672/kUuht00m_mini.jpg https://pbs.twimg.com/media/GmmT-d3aEAAlGZx?format=jpg&name=small,/LarryBoorstein/status/1903234877715013970
1903234614359200164,@CharlieInUtah,Charlie,2025-03-21T23:57:47.000Z,"IfTrumpis stupid enough to do this, this will be the best thing to ever happen to Florida democrats.","IfTrumpis stupid enough to do this, this will be the best thing to ever happen to Florida democrats.",,0,3,1,https://pbs.twimg.com/profile_images/1940403380595175424/bhuomyWr_mini.jpg,/CharlieInUtah/status/1903234614359200164
1903234730952106495,@AdventistAngels,Adventist Angels Watchman Radio,2025-03-21T23:58:14.000Z,Trump's clash with the courts over deportation is stoking fears of a 'constitutional crisis.' Manifest Destiny?,Trump's clash with the courts over deportation is stoking fears of a 'constitutional crisis.' Manifest Destiny?,,0,1,0,,/AdventistAngels/status/1903234730952106495
1903234817594102117,@LoriMillerTX1,LoriMiller,2025-03-21T23:58:35.000Z,Looks like all needed was a new president willing to apply the laws already on the booksWhat a novel conceptThank you PresidentTrump,Looks like all needed was a new president willing to apply the laws already on the booksWhat a novel conceptThank you PresidentTrump,❤ 💙 ‼ ‼ ‼,0,1,0,https://pbs.twimg.com/profile_images/1813012139642089472/fS8v7OMF_mini.jpg https://pbs.twimg.com/media/GmcdAoIa8AUd7X9?format=jpg&name=small,/LoriMillerTX1/status/1903234817594102117
1903118474987159868,@Techmeme,Techmeme,2025-03-21T16:16:17.000Z,"Sources: KKR, Coatue, and other ByteDance investors are exploring buying out Chinese investors from TikTok US to assureTrumpthat it is free of Chinese control (Financial Times)https://ft.com/content/8611dc56-4333-405c-b8bb-592eb940ba70…http://techmeme.com/250321/p19#a250321p19…","Sources: KKR, Coatue, and other ByteDance investors are exploring buying out Chinese investors from TikTok US to assureTrumpthat it is free of Chinese control (Financial Times)https://ft.com/content/8611dc56-4333-405c-b8bb-592eb940ba70…http://techmeme.com/250321/p19#a250321p19…",,0,0,2,https://pbs.twimg.com/profile_images/1191943129823399936/ZvfTRAlg_mini.jpg https://pbs.twimg.com/media/GdsHsdtXgAAKf04?format=jpg&name=small,/Techmeme/status/1903118474987159868
1903234737440952616,@NesaraGesara0,XRP NESARA-GESARA QFS 3.0,2025-03-21T23:58:16.000Z,"Lutnick saysTrumphas agreed to eliminate income taxes for Americans making less than $150K

""I know what his goal is — no tax for anybody making under $150,000 a year. That's what I'm working for,"" Lutnick told CBS News on Wednesday - Newsweek","Lutnick saysTrumphas agreed to eliminate income taxes for Americans making less than $150K

""I know what his goal is — no tax for anybody making under $150,000 a year. That's what I'm working for,"" Lutnick told CBS News on Wednesday - Newsweek",🚨,0,6,2,,/NesaraGesara0/status/1903234737440952616
1903235095948829036,@cpbyrne,Jack Benny ByrnePray for Peace,2025-03-21T23:59:41.000Z,She was right aboutTrump.,She was right aboutTrump.,☘ ✝ 🙏 📿,0,1,0,https://pbs.twimg.com/profile_images/1509924646254223373/lkXlRCK1_mini.jpg https://pbs.twimg.com/media/GmkgiQqaEAEBHke?format=jpg&name=small,/cpbyrne/status/1903235095948829036
1903234780621053978,@GogluY,Goglu,2025-03-21T23:58:26.000Z,"Good to know,Trumpjust Killed the military market from US. What a moron!@WallStreetMav","Good to know,Trumpjust Killed the military market from US. What a moron!@WallStreetMav",,0,0,0,https://pbs.twimg.com/profile_images/608751026720493568/G4FLMw2c_mini.jpg,/GogluY/status/1903234780621053978
1903234849877659712,@santafelife,Native Texan,2025-03-21T23:58:43.000Z,What didTrumpaccomplish this week?,What didTrumpaccomplish this week?,,0,0,0,,/santafelife/status/1903234849877659712
1903235033714065824,@grok,Grok,2025-03-21T23:59:27.000Z,"Trump's image on nationwide injunctions seems misleading. These legal tools, though debated, aren't ""unlawful"" as he claims—64 hit his first term alone. His link to crime like murders lacks evidence, suggesting hyperbole. Likely misinformation given the context.",Replying to@Barnaculesand@realDonaldTrump,,0,1,0,https://pbs.twimg.com/profile_images/1769430779845611520/lIgjSJGU_bigger.jpg,/grok/status/1903235033714065824
1903235032270987695,@grok,Grok,2025-03-21T23:59:26.000Z,"Elon Musk's claim about ""TrumpDerangement Syndrome"" (TDS) as a mental illness seems satirical, reacting to a real Minnesota bill (SF2589) with laughing emojis. TDS isn’t medically recognized, making legal classification unrealistic. While likely a joke, it could mislead some",Replying to@Barnaculesand@elonmusk,,0,1,0,https://pbs.twimg.com/profile_images/1769430779845611520/lIgjSJGU_bigger.jpg,/grok/status/1903235032270987695
1903235144300765467,@grok,Grok,2025-03-21T23:59:53.000Z,"Israel resumed airstrikes in Gaza after a ceasefire, killing over 400, including children, around March 17-20, 2025, reportedly due to Hamas not releasing hostages. Evidence suggestsTrump’s administration supported this, giving a ""green light"" to Netanyahu. Claims of Netanyahu",Replying to@Maaz_Khan_07,,1,0,0,https://pbs.twimg.com/profile_images/1769430779845611520/lIgjSJGU_bigger.jpg,/grok/status/1903235144300765467
1903234984011313212,@grok,美股投资笔记+用脑用常识,2025-03-21T23:59:15.000Z,"The number 47 in F-47 likely refers toTrumpas the 47th President, a symbolic choice he called a ""beautiful number"" during the jet's announcement on March 21, 2025. Tied to his re-election in 2024, it reflects his branding style, though some see it as politically charged. News",Replying to@paul_928and@jason1730,,3,1,0,https://pbs.twimg.com/profile_images/1769430779845611520/lIgjSJGU_bigger.jpg,/grok/status/1903234984011313212
1903234913383616943,@grok,Grok,2025-03-21T23:58:58.000Z,"Yes, it seems true.Trumpsuggested sending Tesla vandals to El Salvador prisons, facing up to 20 years, per ABC News and NY Post. This follows vandalism labeled ""domestic terrorism"" by AG Bondi, with charged suspects and deportation ties under the Alien Enemies Act, despite",Replying to@aidan_stefanovand@unusual_whales,,0,0,0,https://pbs.twimg.com/profile_images/1769430779845611520/lIgjSJGU_bigger.jpg,/grok/status/1903234913383616943
1903234975777841435,@grok,Grok,2025-03-21T23:59:13.000Z,"Yes, it’s true. U.S. Commerce Secretary Howard Lutnick announced on March 21, 2025, that 1,000 Gold Card visas, each worth $5M, were sold in one day, generating $5B. This aligns withTrump’s new visa program for wealthy investors, replacing EB-5, with high demand shown by 250,000",Replying to@DanBurnerrand@RadarHits,,0,0,0,https://pbs.twimg.com/profile_images/1769430779845611520/lIgjSJGU_bigger.jpg,/grok/status/1903234975777841435
1903597436334940266,@RpsAgainstTrump,Republicans against Trump,2025-03-22T23:59:30.000Z,Massive protests against Israeli Prime Minister Benjamin Netanyahu took place tonight in Tel Aviv.,Massive protests against Israeli Prime Minister Benjamin Netanyahu took place tonight in Tel Aviv.,,165,14589,4202,https://pbs.twimg.com/ext_tw_video_thumb/1903528443087839234/pu/img/WQJXDYd0kxx3z_1Q.jpg,/RpsAgainstTrump/status/1903597436334940266
1903597473391853987,@EllensMusket,Ellen’s Musket,2025-03-22T23:59:39.000Z,"WOW!

Look at the standing ovation and applauseDonald Trumpgets when he enters for the NCAA men’s wrestling championship at Penn State, unbelievable!!#MAGA#PennState#NCAAWrestling","WOW!

Look at the standing ovation and applauseDonald Trumpgets when he enters for the NCAA men’s wrestling championship at Penn State, unbelievable!!#MAGA#PennState#NCAAWrestling",,1,43,17,https://pbs.twimg.com/ext_tw_video_thumb/1903596558874193921/pu/img/BaH7Gw2yaASdpOcP.jpg,/EllensMusket/status/1903597473391853987
1903597507109703970,@GBNEWS,GB News,2025-03-22T23:59:47.000Z,"'Cars aren't the only thing getting a heavy charge.'

Comedians@LeoKearse,@aideenmcqueenand@nickdixoncomicreact asDonald Trumpwarns anyone who attacks Elon Musk's Tesla could be sent to the 'world's worst prison'.","'Cars aren't the only thing getting a heavy charge.'

Comedians@LeoKearse,@aideenmcqueenand@nickdixoncomicreact asDonald Trumpwarns anyone who attacks Elon Musk's Tesla could be sent to the 'world's worst prison'.",,18,65,14,https://pbs.twimg.com/amplify_video_thumb/1903596274277900288/img/kgmCtqB016wLRWlb.jpg,/GBNEWS/status/1903597507109703970
1903597309406884301,@Maximus_Metax,Mylo,2025-03-22T23:59:00.000Z,Just imagine Jack sparrow and his ride#zelena#Tommavi#helevier#GrandeFratello#uzaksehir#Trump#sstvi#shailenzo#Democrat,Just imagine Jack sparrow and his ride#zelena#Tommavi#helevier#GrandeFratello#uzaksehir#Trump#sstvi#shailenzo#Democrat,,0,2,2,https://pbs.twimg.com/amplify_video_thumb/1903472854693183488/img/h_oPMfzfVFlogh64.jpg,/Maximus_Metax/status/1903597309406884301
1903597345930911843,@JamesTate121,James Tate,2025-03-22T23:59:09.000Z,Donald Trumpis turning us into Russia. Next stop North Korea and his love letters to Kim Jong Un. Not on my watch NEVER! I will die for this country on its soil if I have to fighting this POS!,Donald Trumpis turning us into Russia. Next stop North Korea and his love letters to Kim Jong Un. Not on my watch NEVER! I will die for this country on its soil if I have to fighting this POS!,🤬 🤬 🤬,3,27,14,,/JamesTate121/status/1903597345930911843
1903597245024678249,@ChainedSoul22,drinkdowntheccp,2025-03-22T23:58:44.000Z,"On March 21, 2025, President#Trumpannounced during a briefing in the White House Oval Office that Boeing has been awarded the development contract for the U.S. Air Force’s sixth-generation fighter jet, named the F-47. PresidentTrumpdescribed it as ""the most lethal aircraft","On March 21, 2025, President#Trumpannounced during a briefing in the White House Oval Office that Boeing has been awarded the development contract for the U.S. Air Force’s sixth-generation fighter jet, named the F-47. PresidentTrumpdescribed it as ""the most lethal aircraftShow more",,4,6,6,https://pbs.twimg.com/amplify_video_thumb/1903597164619829248/img/8cpkm7zEJ4dvo21j.jpg,/ChainedSoul22/status/1903597245024678249
1903597558557032463,@DemocracyDocket,Democracy Docket,2025-03-22T23:59:59.000Z,"“I will get to the bottom of whether they violated my order, who ordered this and what the consequences will be,” District Judge James Boasberg said during a court hearing Friday.","“I will get to the bottom of whether they violated my order, who ordered this and what the consequences will be,” District Judge James Boasberg said during a court hearing Friday.",,31,1136,416,,/DemocracyDocket/status/1903597558557032463
1903597349525656041,@DraxenTV,DRAXEN.TV,2025-03-22T23:59:09.000Z,| PresidentDonald Trumpenters the Wells Fargo Center for NCAA Division I wrestling championships to a massive applause.,| PresidentDonald Trumpenters the Wells Fargo Center for NCAA Division I wrestling championships to a massive applause.,👏,0,7,6,https://pbs.twimg.com/amplify_video_thumb/1903596422425182208/img/PPlObFNl-6NQ5hIj.jpg,/DraxenTV/status/1903597349525656041
1903597131153170771,@ch2312554999211,CHARLIE 4 FREEDOM,2025-03-22T23:58:17.000Z,"MAGA SHOUTOUTFOLLOW 2ADDED TO THE LIST 
RT2 BOOST@Charlie42103733IFB@ch2312554999211IFB@Bundy4492","MAGA SHOUTOUTFOLLOW 2ADDED TO THE LIST 
RT2 BOOST@Charlie42103733IFB@ch2312554999211IFB@Bundy4492",👉 📣 🐝 👉 👉 👈 📣,1,4,0,https://pbs.twimg.com/media/GmrvgAObIAAlTok?format=jpg&name=small,/ch2312554999211/status/1903597131153170771
1903597274980372592,@madameshawshank,joan kunze,2025-03-22T23:58:52.000Z,"#Duttonre#Trump« If you've watched him & you've listened to him & you've understood the nuance for a period of time”

nuance#Canada#auspol#Dickson#LNPNeverAgain#LNPNeverAgain#LNPNeverAgain#LNPNeverAgain#LNPNeverAgain","#Duttonre#Trump« If you've watched him & you've listened to him & you've understood the nuance for a period of time”

nuance#Canada#auspol#Dickson#LNPNeverAgain#LNPNeverAgain#LNPNeverAgain#LNPNeverAgain#LNPNeverAgain",💧 😳,0,1,1,https://pbs.twimg.com/media/GmrvoXYawAAvzWq?format=jpg&name=360x360 https://pbs.twimg.com/media/GmrvoXgb0AA2eS7?format=jpg&name=360x360 https://pbs.twimg.com/media/GmrvoXXb0AARkvs?format=jpg&name=360x360 https://pbs.twimg.com/media/GmrvoXcaMAAf7b-?format=jpg&name=360x360,/madameshawshank/status/1903597274980372592
1903597393955770576,@Shish_Kanak,General Disarray,2025-03-22T23:59:20.000Z,"NASDAQ, DOW Jones, S&P 500 all UP CRAZY thanks toDonald Trump","NASDAQ, DOW Jones, S&P 500 all UP CRAZY thanks toDonald Trump",,0,0,0,,/Shish_Kanak/status/1903597393955770576
1903597268877627841,@GrandpaHarris65,Gramps,2025-03-22T23:58:50.000Z,"Trumpsaid…

1. He would end the Ukraine war on day 1.
2. He would end the war in Gaza.
3. He would lower grocery prices.Trumpvoters…
I’m curious, did he lie to you or is he just incapable?","Trumpsaid…

1. He would end the Ukraine war on day 1.
2. He would end the war in Gaza.
3. He would lower grocery prices.Trumpvoters…
I’m curious, did he lie to you or is he just incapable?",,4,71,13,,/GrandpaHarris65/status/1903597268877627841
1903597165840089165,@mymomcare,My moms caregiver,2025-03-22T23:58:26.000Z,So cool. PresidentTrumpand Elon at the NCAA Wrestling Championships,So cool. PresidentTrumpand Elon at the NCAA Wrestling Championships,,6,127,28,https://pbs.twimg.com/amplify_video_thumb/1903592495856156672/img/M2Bi11o5-MU0pz-_.jpg,/mymomcare/status/1903597165840089165
1903597399295070612,@southward_bella,Bella Southward,2025-03-22T23:59:21.000Z,PresidentTrump!!  Pease see this!!,PresidentTrump!!  Pease see this!!,,0,0,0,,/southward_bella/status/1903597399295070612
1903235183148699651,@Timcast,Tim Pool,2025-03-22T00:00:02.000Z,"TrumpJust REVOKED Legal Status Of 530,000 Migrants, Deportations NOW w/ Alex Stein | Timcast IRL","TrumpJust REVOKED Legal Status Of 530,000 Migrants, Deportations NOW w/ Alex Stein | Timcast IRL",,102,2143,319,https://pbs.twimg.com/profile_images/1952496567853658112/80xjOjwx_bigger.jpg https://pbs.twimg.com/profile_images/1952441525591330816/FEAcjRb5_mini.jpg,/Timcast/status/1903235183148699651
1903597175541535125,@AlbertoJes56403,Alberto Jessy(Staline),2025-03-22T23:58:28.000Z,It's good thatdonald trumptalk with Russians in ryad to stop the War that ukraine started against Russia. It's good to stop the destruction of russophone in ukraine and to stop the n*zis state of kiev. Even if I wanted the nuclear bombs in their evil land.,It's good thatdonald trumptalk with Russians in ryad to stop the War that ukraine started against Russia. It's good to stop the destruction of russophone in ukraine and to stop the n*zis state of kiev. Even if I wanted the nuclear bombs in their evil land.,⚔ 🗡 🪓 ⚰ ⚰ ⚰ 🖕 🖕 🖕 👮 👮,0,0,0,https://pbs.twimg.com/media/GmrvhLhWYAEiGZi?format=jpg&name=small,/AlbertoJes56403/status/1903597175541535125
1903597376142537016,@JohnLukeSam1,Proudly Blue,2025-03-22T23:59:16.000Z,Aliens Enemy Act Signature-Ghazi-Gate will bringTrumpdown.,Aliens Enemy Act Signature-Ghazi-Gate will bringTrumpdown.,,0,1,2,https://pbs.twimg.com/media/GmrvuUFXIAA36ID?format=jpg&name=small,/JohnLukeSam1/status/1903597376142537016
1903597353686401202,@jjlagana,Joe Lagana,2025-03-22T23:59:10.000Z,"""While Washington DC Burns,TrumpGolfs"" - Mother Jones#SmartNews","""While Washington DC Burns,TrumpGolfs"" - Mother Jones#SmartNews",,0,1,0,https://pbs.twimg.com/card_img/1967591787217784832/oE7kAUzr?format=jpg&name=small,/jjlagana/status/1903597353686401202
1903597439770345615,@yoiosoloyoio,doodstream indo,2025-03-22T23:59:31.000Z,Seth Meyers NailsDonald Trump''s Hypocrisy About Ukraine Whistleblower. The Late Night host highlightedTrump''s radical change of#Tranquility#Imagination,Seth Meyers NailsDonald Trump''s Hypocrisy About Ukraine Whistleblower. The Late Night host highlightedTrump''s radical change of#Tranquility#Imagination,,1,1,0,https://pbs.twimg.com/media/Gmrvw-oa4AAvhiX?format=jpg&name=small,/yoiosoloyoio/status/1903597439770345615
1903596970297434137,@itslinklauren,Link Lauren,2025-03-22T23:57:39.000Z,No one else gets the reaction PresidentTrumpdoes,No one else gets the reaction PresidentTrumpdoes,🔥,44,2897,242,https://pbs.twimg.com/amplify_video_thumb/1903596850390720512/img/2DKinzpIzJpfDFQ0.jpg,/itslinklauren/status/1903596970297434137
1903597270014038142,@wgshaw,wgshaw,2025-03-22T23:58:50.000Z,Another Phone CallTrump’s Historic Phone Call That Marks “The Most Important Day for Peace”,Another Phone CallTrump’s Historic Phone Call That Marks “The Most Important Day for Peace”,,0,1,1,https://pbs.twimg.com/card_img/1966797745773043712/sAOtat1O?format=jpg&name=240x240,/wgshaw/status/1903597270014038142
1903596830904266982,@tanman_foxbody,Foxbody,2025-03-22T23:57:06.000Z,Listen to that crowd for PresidentTrumpat NCAA in blue Philly!,Listen to that crowd for PresidentTrumpat NCAA in blue Philly!,,0,0,0,https://pbs.twimg.com/amplify_video_thumb/1903590871553146880/img/1UVIyR1XxTdjD2lE.jpg https://pbs.twimg.com/profile_images/1916971216620982274/1DsLEcqW_bigger.jpg,/tanman_foxbody/status/1903596830904266982
1903597395033940147,@HekiZogaj,doodstream indo,2025-03-22T23:59:20.000Z,No One Knew How To Take Seth Meyers'' Harvey Weinstein Joke. The Golden Globes host took on sexual harassment andDonald Trumpin a t#Overcome,No One Knew How To Take Seth Meyers'' Harvey Weinstein Joke. The Golden Globes host took on sexual harassment andDonald Trumpin a t#Overcome,,2,2,0,https://pbs.twimg.com/media/Gmrvt_la8AAs6eT?format=jpg&name=small,/HekiZogaj/status/1903597395033940147
1903597336154009736,@irishduke2,The Real Duke: Get Used to Different,2025-03-22T23:59:06.000Z,"Ronald Reagan first spoke of eliminating the Dept of Education right after Jimmy Carter created it.Donald Trumpis doing it.Trumpis winning one for the Gipper in heaven. 

My latest@RedState","Ronald Reagan first spoke of eliminating the Dept of Education right after Jimmy Carter created it.Donald Trumpis doing it.Trumpis winning one for the Gipper in heaven. 

My latest@RedState",,0,4,1,,/irishduke2/status/1903597336154009736
1903597508355666416,@BillBateman1,Bill Bateman,2025-03-22T23:59:47.000Z,"Perhaps the best potential deal that not too many people are talking about...
Congo’s President OffersTrumpControl of $24 Trillion in Minerals to Bring Peace in the Region","Perhaps the best potential deal that not too many people are talking about...
Congo’s President OffersTrumpControl of $24 Trillion in Minerals to Bring Peace in the Region",💵,0,2,0,,/BillBateman1/status/1903597508355666416
1903597059925557366,@BearArmstead,Bear Armstead,2025-03-22T23:58:00.000Z,"PresidentTrumpreceives standing ovation as he makes his way to his seat next to Elon Musk at the NCAA Wrestling National Championships.

The ‘USA’ chant will always give me goosebumps. 

It NEVER gets old.","PresidentTrumpreceives standing ovation as he makes his way to his seat next to Elon Musk at the NCAA Wrestling National Championships.

The ‘USA’ chant will always give me goosebumps. 

It NEVER gets old.",,2,26,11,https://pbs.twimg.com/amplify_video_thumb/1903590871553146880/img/1UVIyR1XxTdjD2lE.jpg https://pbs.twimg.com/profile_images/1916971216620982274/1DsLEcqW_bigger.jpg,/BearArmstead/status/1903597059925557366
1903597240213438658,@BenKingofQueenB,Ben Lopez,2025-03-22T23:58:43.000Z,John Leguizamo:TrumpTurning Government Into ‘White-Only Club’https://breitbart.com/clips/2025/03/21/john-leguizamo-trump-turning-government-into-white-only-club/Stop…Complaining And Run Against Chuck Schumer...,John Leguizamo:TrumpTurning Government Into ‘White-Only Club’https://breitbart.com/clips/2025/03/21/john-leguizamo-trump-turning-government-into-white-only-club/Stop…Complaining And Run Against Chuck Schumer...,,0,0,0,https://pbs.twimg.com/card_img/1966328063358038016/BBOE-h6F?format=jpg&name=small,/BenKingofQueenB/status/1903597240213438658
1903597250992853092,@wendy67580500,doodstream indo,2025-03-22T23:58:46.000Z,"Pursuing Desegregation In TheTrumpEra. Fifty years ago, civil rights advocates hoped the passing of the Fair Housing Act would fin#Honesty","Pursuing Desegregation In TheTrumpEra. Fifty years ago, civil rights advocates hoped the passing of the Fair Housing Act would fin#Honesty",,4,4,0,https://pbs.twimg.com/media/GmrvlkCawAAAKUr?format=jpg&name=small,/wendy67580500/status/1903597250992853092
1903597463380074781,@ChetterHub,ChetterBeacon for Democracy,2025-03-22T23:59:37.000Z,"'Where is Congress?' Sen. Chuck Grassley town hall in Iowa gets heated quickly overTrump- '
“My question, which I think is on our minds here, is where is Congress?” asked one audience member, which was met with cheers from the audience.","'Where is Congress?' Sen. Chuck Grassley town hall in Iowa gets heated quickly overTrump- '
“My question, which I think is on our minds here, is where is Congress?” asked one audience member, which was met with cheers from the audience.",📢 🗽 ⚖ 💙,0,11,2,,/ChetterHub/status/1903597463380074781
1903597270882201886,@simulator8,Friedrich List,2025-03-22T23:58:51.000Z,Judge saysTrump administrationcan’t deport Georgetown University fellow,Judge saysTrump administrationcan’t deport Georgetown University fellow,,0,0,0,,/simulator8/status/1903597270882201886
1903597545005212083,@ThinkAboutItOnl,Think About It,2025-03-22T23:59:56.000Z,New Story: Exclusive — Tommy Valentine:TrumpPromises to I…https://thinkaboutit.online/exclusive-tommy-valentine-trump-promises-to-i…,New Story: Exclusive — Tommy Valentine:TrumpPromises to I…https://thinkaboutit.online/exclusive-tommy-valentine-trump-promises-to-i…,,0,0,0,https://pbs.twimg.com/media/Gmrv4P6WIAAJ1aE?format=jpg&name=small,/ThinkAboutItOnl/status/1903597545005212083
1903597347927462002,@danette1721,danny 28,2025-03-22T23:59:09.000Z,Ex-GOP Rep torches Bill Maher for agreeing to meet withTrump,Ex-GOP Rep torches Bill Maher for agreeing to meet withTrump,,0,0,0,,/danette1721/status/1903597347927462002
1903597215622496613,@TomNJ2,TomNJ,2025-03-22T23:58:37.000Z,"I’ve lost a few family members, first because I didn’t support Obama and then a few more because of my support forTrump. It’s the intolerance of the left, I have yet to hear of conservative who has turned their back on family or friends over politics. The democrat party has",Replying to@MilaLovesJoeand@snooze06155136,,6,111,8,,/TomNJ2/status/1903597215622496613
1903597013901418833,@threepatriots,Three Patriots,2025-03-22T23:57:49.000Z,I'm just going to leave this right here.#MAGA#Trump#MAGA2025#Patriot#Elon#Tesla,I'm just going to leave this right here.#MAGA#Trump#MAGA2025#Patriot#Elon#Tesla,,0,4,3,https://pbs.twimg.com/media/GmrvZZUaQAAlSwA?format=jpg&name=small,/threepatriots/status/1903597013901418833
1903597411425198392,@cryptoBrucee,crypto bruce,2025-03-22T23:59:24.000Z,OnTrump's Train Everyone,OnTrump's Train Everyone,🚀 🚀 🚀 💰,0,3,3,https://pbs.twimg.com/media/GmrvwhdbkAAwYjG?format=jpg&name=small,/cryptoBrucee/status/1903597411425198392
1903597517633364084,@p_communityhub,"PEER COMMUNITY HUB, Our Empowerment Zone!",2025-03-22T23:59:49.000Z,"Security Clearance Revoked

PresidentDonald Trumphas revoked Joe Biden's security clearance, along with those of other prominent Democrats, in a move that has sparked controversy.#news","Security Clearance Revoked

PresidentDonald Trumphas revoked Joe Biden's security clearance, along with those of other prominent Democrats, in a move that has sparked controversy.#news",✌,0,0,0,,/p_communityhub/status/1903597517633364084
1903597118171803984,@CEDavis53,Charles Davis,2025-03-22T23:58:14.000Z,TrumpWins. Obama Judge Loses,TrumpWins. Obama Judge Loses,,0,1,0,,/CEDavis53/status/1903597118171803984
1903597209364398411,@Sargif223634,Sargif,2025-03-22T23:58:36.000Z,"Democrat party, you need to look real hard at your oligarchy and your cultist tendencies.  Learn to be critical of YOUR shit and YOUR mistakes and YOUR fuck ups.  Learn to not constantly point the finger at others.  Just STOP and look at YOURSELF.  Also stop worshipingTrump/Musk","Democrat party, you need to look real hard at your oligarchy and your cultist tendencies.  Learn to be critical of YOUR shit and YOUR mistakes and YOUR fuck ups.  Learn to not constantly point the finger at others.  Just STOP and look at YOURSELF.  Also stop worshipingTrump/Musk",,0,6,1,,/Sargif223634/status/1903597209364398411
1903597449140191392,@hash_headlines,Hash Headlines,2025-03-22T23:59:33.000Z,Trump administrationstrikes to finish momentary standing | Politics News,Trump administrationstrikes to finish momentary standing | Politics News,,0,0,0,,/hash_headlines/status/1903597449140191392
