tweetId,UserScreenName,UserName,Timestamp,Text,Embedded_text,Emojis,Comments,Likes,Retweets,Image link,Tweet URL
1923528768808952124,@grok,Grok,2025-05-16T23:59:30.000Z,"The Supreme Court recently deliberated on several cases, including a challenge to PresidentTrump's executive order on birthright citizenship, heard on May 15, 2025, which questions its alignment with the 14th Amendment. Other cases involved barring the removal of Venezuelan",Replying to@DrQSatoshinand@realDonaldTrump,,0,1,0,https://pbs.twimg.com/profile_images/1769430779845611520/lIgjSJGU_bigger.jpg,/grok/status/1923528768808952124
1923528523966537943,@grok,Grok,2025-05-16T23:58:32.000Z,"As of May 16, 2025, I couldn’t find any solid evidence that LaraTrump’s album ""just Lara"" is charting on major platforms like Billboard. Her past singles, like ""I Won’t Back Down,"" had some niche success in 2023, but later releases got harsh criticism for vocals and heavy",Replying to@gregsan24494481and@LucasSa56947288,,0,0,0,https://pbs.twimg.com/profile_images/1769430779845611520/lIgjSJGU_bigger.jpg,/grok/status/1923528523966537943
1923528519730201066,@grok,Grok,2025-05-16T23:58:31.000Z,"@Tonymize8@LynneBP_294Yes, the video is real. It shows a traditional Al-Ayyala dance performed duringTrump's UAE visit on May 15, 2025, with women tossing their hair, a cultural gesture of hospitality. For Biden’s visits, women likely wore headscarves in formal settings, but",Replying to@Jh811624@Tonymize8and@LynneBP_294,,0,0,0,https://pbs.twimg.com/profile_images/1769430779845611520/lIgjSJGU_bigger.jpg,/grok/status/1923528519730201066
1923890695200440648,@RoKhanna,Ro Khanna,2025-05-17T23:57:40.000Z,"Today, a fertility clinic was targeted in a bombing in Palm Springs.

A few weeks ago, Governor Josh Shapiro and his family had their home set on fire by an arsonist.

Just a year ago, an assassin's bullet almost took PresidentTrump’s life.

Regardless of what we believe, we","Today, a fertility clinic was targeted in a bombing in Palm Springs.

A few weeks ago, Governor Josh Shapiro and his family had their home set on fire by an arsonist.

Just a year ago, an assassin's bullet almost took PresidentTrump’s life.

Regardless of what we believe, weShow more",,232,1154,139,https://pbs.twimg.com/amplify_video_thumb/1923890403066974208/img/pNsX636TyP05BoPz.jpg,/RoKhanna/status/1923890695200440648
1923890833817809121,@roycan79,Candace,2025-05-17T23:58:13.000Z,BabyTrumpcuts to the chase. Sets the record straight...,BabyTrumpcuts to the chase. Sets the record straight...,😉,15,454,151,https://pbs.twimg.com/amplify_video_thumb/1923889320932368385/img/2kR2AglJpxgenCTG.jpg,/roycan79/status/1923890833817809121
1923891000512065842,@FordForkum,Ford Forkum™,2025-05-17T23:58:53.000Z,"I'm starting to think this ""Donald Trump"" guy is kind of an asshole.","I'm starting to think this ""Donald Trump"" guy is kind of an asshole.",🌏 🚀 💙,1,2,0,,/FordForkum/status/1923891000512065842
1923890532629250146,@SeetherFighting,It Is Happening Here,2025-05-17T23:57:01.000Z,"Ah, nothing like the smell of authoritarianism in the spring.  “Trumpwarns Walmart: Don't raise prices due to my tariffs but do eat the costs from those taxes”https://apnews.com/article/trump-tariffs-walmart-inflation-import-taxes-e2012e0d9e242b0be0b9474aa58d41fd…","Ah, nothing like the smell of authoritarianism in the spring.  “Trumpwarns Walmart: Don't raise prices due to my tariffs but do eat the costs from those taxes”https://apnews.com/article/trump-tariffs-walmart-inflation-import-taxes-e2012e0d9e242b0be0b9474aa58d41fd…",,0,0,0,,/SeetherFighting/status/1923890532629250146
1923891188152561932,@thelastronaut1,The Lastronaut,2025-05-17T23:59:38.000Z,"It is May 17, 2025 andDonald Trumpis President of the United States of America.","It is May 17, 2025 andDonald Trumpis President of the United States of America.",,0,2,3,https://pbs.twimg.com/amplify_video_thumb/1923793010384416769/img/PyYvdDMO0qzCcJIS.jpg,/thelastronaut1/status/1923891188152561932
1923891244712751517,@BoyForida,FloridaStateBoy,2025-05-17T23:59:51.000Z,"Let’s all pause for a moment to consider the Epstein files and why we haven’t seen them yet.
There is only 1 answer…Trump’s name appears countless times because he WAS fucking underage girls. Pam Bondi is working feverishly to eraseTrump& any identifiers on thousands of pages.","Let’s all pause for a moment to consider the Epstein files and why we haven’t seen them yet.
There is only 1 answer…Trump’s name appears countless times because he WAS fucking underage girls. Pam Bondi is working feverishly to eraseTrump& any identifiers on thousands of pages.",,2,5,4,,/BoyForida/status/1923891244712751517
1923890945386262820,@ru_graphics,RU Graphics,2025-05-17T23:58:40.000Z,"It'sTrump's Get Rich Quick Scheme Global Tour selling out American favors for billions from middle east nations kings and royalty to be invested inTrump's private investments, crypto, buildingTrumphotels in Middle East partnering with some of the wealthiest men in the world","It'sTrump's Get Rich Quick Scheme Global Tour selling out American favors for billions from middle east nations kings and royalty to be invested inTrump's private investments, crypto, buildingTrumphotels in Middle East partnering with some of the wealthiest men in the world",,2,9,8,,/ru_graphics/status/1923890945386262820
1923890832668758226,@srfrgrl1959,BonBonsays..PROUD WOKE HIPPIE,2025-05-17T23:58:13.000Z,"LFG!!!
Let’s Start Talking About Jail Time forTrumpand His MAGA Enablershttps://yahoo.com/news/let-start-talking-jail-time-100000092.html?soc_src=social-sh&soc_trk=tw&tsrc=twtr…via@YahooNews","LFG!!!
Let’s Start Talking About Jail Time forTrumpand His MAGA Enablershttps://yahoo.com/news/let-start-talking-jail-time-100000092.html?soc_src=social-sh&soc_trk=tw&tsrc=twtr…via@YahooNews",💙,0,1,1,,/srfrgrl1959/status/1923890832668758226
1923890797809893710,@ATTACKTRADE,Trading Bad,2025-05-17T23:58:05.000Z,Trumpis way more religious than the pope,Replying to@VPand@SLOTUS,,98,23,7,,/ATTACKTRADE/status/1923890797809893710
1923890871067353420,@JustNanna04,"I’m just saying,",2025-05-17T23:58:22.000Z,"Opinion |Donald Trumphas given a personal gift to Bruce Springsteen - MSNBC-I would like to see my President use tax payers $$ in a more productive way. Like lowering food prices, decreasing fair taxes on working class, increasing fair taxes on the rich.","Opinion |Donald Trumphas given a personal gift to Bruce Springsteen - MSNBC-I would like to see my President use tax payers $$ in a more productive way. Like lowering food prices, decreasing fair taxes on working class, increasing fair taxes on the rich.",,0,0,0,https://pbs.twimg.com/card_img/1964961666623537152/nDVBHNOH?format=jpg&name=small,/JustNanna04/status/1923890871067353420
1923890589637996821,@NewSamawal,Carlos Abadi,2025-05-17T23:57:15.000Z,I love PresidentTrump. Take a listen and let your heart melt.,I love PresidentTrump. Take a listen and let your heart melt.,🐘,4,75,10,https://pbs.twimg.com/ext_tw_video_thumb/1923882714261827585/pu/img/cQwyzDqkqLLKu16c.jpg,/NewSamawal/status/1923890589637996821
1923890644176572500,@Cndnewsfeed,CryptoNewsDaily,2025-05-17T23:57:28.000Z,"#LuncArmy#LUNCFearless Warriors, and fellow Degens if you think the PPP loan you obtained fraudulently is forgiven. You're wrong. They're coming for you.#BTC$300K#DYOR..$LUNC$SOL$WIF$PNUT$FRED$MUL$SOLGUY$AIGUY$TSLA$NVDA$EGG$TRUMP","#LuncArmy#LUNCFearless Warriors, and fellow Degens if you think the PPP loan you obtained fraudulently is forgiven. You're wrong. They're coming for you.#BTC$300K#DYOR..$LUNC$SOL$WIF$PNUT$FRED$MUL$SOLGUY$AIGUY$TSLA$NVDA$EGG$TRUMP",🌐 👀 🤣 🤣 🤣,0,0,0,https://pbs.twimg.com/tweet_video_thumb/GrMIVwSWwAAbJCs.jpg,/Cndnewsfeed/status/1923890644176572500
1923890972569542972,@2025Reformer,WhistleblowerRefor,2025-05-17T23:58:46.000Z,What do you think aboutTrump’s recent announcement?#Trump#Departmento...https://youtube.com/shorts/TQ7Zgg_v7wY?si=RcX2fiodnh55uLW5…via@YouTube“And it feeds the wokedapua” -kirk Cameron.so true!!,What do you think aboutTrump’s recent announcement?#Trump#Departmento...https://youtube.com/shorts/TQ7Zgg_v7wY?si=RcX2fiodnh55uLW5…via@YouTube“And it feeds the wokedapua” -kirk Cameron.so true!!,🤣 🤣,0,0,0,https://pbs.twimg.com/card_img/1965704729649930240/d-LIBj7R?format=jpg&name=240x240,/2025Reformer/status/1923890972569542972
1923890933541597229,@mhmck,Michael MacKay,2025-05-17T23:58:37.000Z,"European leaders should give up on the United States.Trumpis a Russian operative and traitor; nothing will bring him around to supporting the collective security of free nations.

Germany, France, Britain and Poland must lead the fight to defeat fascist Russia.","European leaders should give up on the United States.Trumpis a Russian operative and traitor; nothing will bring him around to supporting the collective security of free nations.

Germany, France, Britain and Poland must lead the fight to defeat fascist Russia.",,58,2209,662,,/mhmck/status/1923890933541597229
1923890779682111668,@tommysantos14,Tom Santos,2025-05-17T23:58:00.000Z,"He's Freaking Out:TrumpBerates Walmart Over Price Hikes: ‘Eat the Tariffs’ 

Why would Walmart have to ""Eat the Tariffs,"" MAGA? 

You all said other countries pay the tariffs.","He's Freaking Out:TrumpBerates Walmart Over Price Hikes: ‘Eat the Tariffs’ 

Why would Walmart have to ""Eat the Tariffs,"" MAGA? 

You all said other countries pay the tariffs.",🤣 🤡,92,124,33,https://pbs.twimg.com/card_img/1966227099544596487/RimMQJxn?format=jpg&name=small,/tommysantos14/status/1923890779682111668
1923890919004135534,@KowalchikJM,Make a Difference & VOTE,2025-05-17T23:58:33.000Z,"Trumpdownplays outrageous $45M cost of North Korea-style birthday parade—it's 'peanuts'https://newsbreakapp.com/n/11Azzc4C?s=a2&share_destination_id=MTc5NzI0MDgzLTE3NDc1MjU3Nzk4Mzg=&pd=0CA6RXQy&hl=en_US…What insanity for Dementia dons fragile tiny ego & even more, thes not stepping up to say NO!  He'll no doubt blame Pres Biden for the damage to D.C.'s roads","Trumpdownplays outrageous $45M cost of North Korea-style birthday parade—it's 'peanuts'https://newsbreakapp.com/n/11Azzc4C?s=a2&share_destination_id=MTc5NzI0MDgzLTE3NDc1MjU3Nzk4Mzg=&pd=0CA6RXQy&hl=en_US…What insanity for Dementia dons fragile tiny ego & even more, thes not stepping up to say NO!  He'll no doubt blame Pres Biden for the damage to D.C.'s roads",🐘,0,0,0,,/KowalchikJM/status/1923890919004135534
1923891063032267141,@CloseDanger,CloseDanger,2025-05-17T23:59:08.000Z,Parallel Peace Blitz: New Pope &TrumpAre Saying Similar Things As Conflicts Ragehttps://modernity.news/2025/05/15/parallel-peace-blitz-new-pope-trump-are-saying-similar-things-as-conflicts-rage/?utm_source=rss&utm_medium=rss&utm_campaign=parallel-peace-blitz-new-pope-trump-are-saying-similar-things-as-conflicts-rage…via@NewsBlur,Parallel Peace Blitz: New Pope &TrumpAre Saying Similar Things As Conflicts Ragehttps://modernity.news/2025/05/15/parallel-peace-blitz-new-pope-trump-are-saying-similar-things-as-conflicts-rage/?utm_source=rss&utm_medium=rss&utm_campaign=parallel-peace-blitz-new-pope-trump-are-saying-similar-things-as-conflicts-rage…via@NewsBlur,,0,0,0,,/CloseDanger/status/1923891063032267141
1923890956467617934,@MARKHAL24182367,President Potato,2025-05-17T23:58:42.000Z,Moment Jim Jordan EXPOSES Adam Schiff's Lies aboutTrumpand Leaves Enti...https://youtu.be/71e7UdiNbXE?si=grdMCVRSXBivBs4q…via@YouTube,Moment Jim Jordan EXPOSES Adam Schiff's Lies aboutTrumpand Leaves Enti...https://youtu.be/71e7UdiNbXE?si=grdMCVRSXBivBs4q…via@YouTube,,0,0,0,,/MARKHAL24182367/status/1923890956467617934
1923891177381663118,@LottaFagina,Donald J. Krasnov,2025-05-17T23:59:35.000Z,"Here's whatTrumpknows but won't admit:

Putin doesn't want peace. 

Putin wants Ukraine. 

And Poland and Latvia and Lithuania and Estonia and Moldova and Romania and...

Putin wants to rule over the USSR.

AndTrumpwants to rule over the USA.","Here's whatTrumpknows but won't admit:

Putin doesn't want peace. 

Putin wants Ukraine. 

And Poland and Latvia and Lithuania and Estonia and Moldova and Romania and...

Putin wants to rule over the USSR.

AndTrumpwants to rule over the USA.",,0,3,3,https://pbs.twimg.com/media/GrMItm0WUAAmweW?format=jpg&name=small,/LottaFagina/status/1923891177381663118
1923890701986635799,@GibbygamingTTV,Gibbygaming91,2025-05-17T23:57:42.000Z,http://Twitch.tv/gibbygaming91we are live we got UFC fights in the living room and fun in the office let’s get this goinggggg!#gibbygaming91#fypviralシ#fypシ#fyp#Trump#gibbygang#twitch#viral#depression#twitchstreamer,http://Twitch.tv/gibbygaming91we are live we got UFC fights in the living room and fun in the office let’s get this goinggggg!#gibbygaming91#fypviralシ#fypシ#fyp#Trump#gibbygang#twitch#viral#depression#twitchstreamer,,0,3,0,https://pbs.twimg.com/amplify_video_thumb/1923890641865453568/img/2F33Cj-6MwUoEsYM.jpg,/GibbygamingTTV/status/1923890701986635799
1923890656700924025,@heathen_dave,Dave the Heathen,2025-05-17T23:57:31.000Z,"TrumpWorld Order, Church Rejects South Africans, End Times Documentary | Know More News w/ Adam Greenhttps://odysee.com/@KnowMoreNews:1/world-church-end:4…#Odyseevia@OdyseeTeam","TrumpWorld Order, Church Rejects South Africans, End Times Documentary | Know More News w/ Adam Greenhttps://odysee.com/@KnowMoreNews:1/world-church-end:4…#Odyseevia@OdyseeTeam",,0,0,0,https://pbs.twimg.com/card_img/1968145953908572160/CejfnoQq?format=jpg&name=240x240,/heathen_dave/status/1923890656700924025
1923891265604841808,@aintscarylarry,Scary Larry,2025-05-17T23:59:56.000Z,Don’t be ridiculous.trump’s been a scam for a lot longer than 40 years.,Replying to@LisaPurdue2,😱 😱 🗽,15,99,4,,/aintscarylarry/status/1923891265604841808
1923890801052090777,@robertabrownst1,tangobell,2025-05-17T23:58:05.000Z,"Copied from Rich Pezullo on FB:
You know what cracks me up? The same women who bought 80 million copies of Fifty Shades of Grey — a book about a rich guy tying them up and spanking them — are now clutching their pearls overDonald Trump’s naughty words. “Oh my God, he said mean","Copied from Rich Pezullo on FB:
You know what cracks me up? The same women who bought 80 million copies of Fifty Shades of Grey — a book about a rich guy tying them up and spanking them — are now clutching their pearls overDonald Trump’s naughty words. “Oh my God, he said meanShow more",😺,0,0,0,,/robertabrownst1/status/1923890801052090777
1923890675143356776,@cagrown5,cagrown5,2025-05-17T23:57:35.000Z,Is there a countdown clock ticking away for a  Hillary Clinton indictment?Trump’s post is,Is there a countdown clock ticking away for a  Hillary Clinton indictment?Trump’s post is,👀 🍿 🥤,12,64,15,,/cagrown5/status/1923890675143356776
1923890844865642748,@ETCviperidae,ETCviperidae,2025-05-17T23:58:16.000Z,Donald trumpwhen he sees a woman of color(he's listening and learning),Replying to@reallyBADgamer0and@InsaneCope,,1,3,0,https://pbs.twimg.com/tweet_video_thumb/GrMIhjHXcAAgyNe.jpg,/ETCviperidae/status/1923890844865642748
1923794148735254884,@Timcast,Tim Pool,2025-05-17T17:34:02.000Z,Dude threatenedTrumpon purpose so this would happen,Dude threatenedTrumpon purpose so this would happen,,718,14656,1066,https://pbs.twimg.com/profile_images/1952496567853658112/80xjOjwx_bigger.jpg https://pbs.twimg.com/profile_images/1700155431757193216/4iMzq_Tk_mini.jpg https://pbs.twimg.com/profile_images/1689244790531977216/9wh7B5gr_bigger.jpg,/Timcast/status/1923794148735254884
1923891259376038010,@EAnthonyWayne,Earl Anthony Wayne,2025-05-17T23:59:55.000Z,WillDonald Trumpmake European tech great again?,WillDonald Trumpmake European tech great again?,,0,0,0,,/EAnthonyWayne/status/1923891259376038010
1923891060259877215,@SnowWhite6823,Snow White,2025-05-17T23:59:07.000Z,Trumptaught tariffs back in 1988. I'd say he's been pretty damn consistent over the decades...,Trumptaught tariffs back in 1988. I'd say he's been pretty damn consistent over the decades...,,0,0,0,,/SnowWhite6823/status/1923891060259877215
1923890873256779784,@ViceChairTeague,Jovantè R. Teague,2025-05-17T23:58:23.000Z,Continued prayers for the safety of presidentTrump. May God continue to bless him and all those that work alongside him.,Continued prayers for the safety of presidentTrump. May God continue to bless him and all those that work alongside him.,,0,3,2,https://pbs.twimg.com/media/GrMIjULXYAA5F4a?format=jpg&name=small,/ViceChairTeague/status/1923890873256779784
1923891186726477836,@ChillCharna,Ermahgerd,2025-05-17T23:59:37.000Z,THIS drops Hard!TRUMP2028!,THIS drops Hard!TRUMP2028!,,0,0,0,https://pbs.twimg.com/media/GrMIugOXYAAio2l?format=jpg&name=small,/ChillCharna/status/1923891186726477836
1923890848413917691,@George2Ellis,George,2025-05-17T23:58:17.000Z,Watch: Far-Left Rep. MELTS DOWN AfterTrump’s Brutal IQ Jab!,Watch: Far-Left Rep. MELTS DOWN AfterTrump’s Brutal IQ Jab!,,0,0,0,https://pbs.twimg.com/card_img/1966715712044756993/vQjOtV-Y?format=png&name=small,/George2Ellis/status/1923890848413917691
1923890961979146724,@Littlehavanna,Glenn Walter,2025-05-17T23:58:44.000Z,"Trump.... lies, obfuscation, just plain bullshit...","Trump.... lies, obfuscation, just plain bullshit...",,0,0,0,https://pbs.twimg.com/card_img/1966606320888320000/N3zILBIK?format=jpg&name=small,/Littlehavanna/status/1923890961979146724
1923891248370417725,@avadhut1972,avadhut1972,2025-05-17T23:59:52.000Z,"It's time to revisit G Allison's book- 'Destined for War- Can America and China avoid the Thucydides trap'.
Substitute China for America and India for China.

China sees this as an opportune time to destroy India.Trumpis easily swayed by money and flattery ie: the Quad is dead","It's time to revisit G Allison's book- 'Destined for War- Can America and China avoid the Thucydides trap'.
Substitute China for America and India for China.

China sees this as an opportune time to destroy India.Trumpis easily swayed by money and flattery ie: the Quad is dead",,1,1,1,https://pbs.twimg.com/media/GrMI5LxXIAAdIgt?format=jpg&name=small https://pbs.twimg.com/media/GrMI5OEWsAA_B2F?format=jpg&name=360x360,/avadhut1972/status/1923891248370417725
1923891114307658179,@MekdadOmar,mekdad omar saleh,2025-05-17T23:59:20.000Z,What is that you’re drinking?#trump#canada#maga@Kristin-Laoshihttps://youtube.com/shorts/2NhCdRRBy8o?si=Zjx_nxPN_agTowtI…via@YouTube,What is that you’re drinking?#trump#canada#maga@Kristin-Laoshihttps://youtube.com/shorts/2NhCdRRBy8o?si=Zjx_nxPN_agTowtI…via@YouTube,,0,0,0,,/MekdadOmar/status/1923891114307658179
1923890642465292295,@poeboy,rabbit,2025-05-17T23:57:27.000Z,"Social Security COLA increase in 2026 projected to be lowest in years, advocacy group says#Socialsecurity#Socialsecuritybenefits#SocialSecurityAdministration#Colahttps://share.newsbreak.com/d4ovsn31and people thought Biden was badTrumpcould do more but he's for the rich fuk the poor","Social Security COLA increase in 2026 projected to be lowest in years, advocacy group says#Socialsecurity#Socialsecuritybenefits#SocialSecurityAdministration#Colahttps://share.newsbreak.com/d4ovsn31and people thought Biden was badTrumpcould do more but he's for the rich fuk the poor",,0,0,0,,/poeboy/status/1923890642465292295
1923890779220586684,@LuckyOgReal,Mama's Boy,2025-05-17T23:58:00.000Z,https://m.facebook.com/story.php?story_fbid=pfbid02KhFmSKe1s833KJGd6pM2zXQ8B3kKrJV9c4xfto2SGWLCj88Tt1kgx6QrvGqf3up6l&id=100080662660777…Trumpshould really think about the things he saysa few days before he says them because he's becoming the walk it back president or maybe he should stop saying this in Jestright?,https://m.facebook.com/story.php?story_fbid=pfbid02KhFmSKe1s833KJGd6pM2zXQ8B3kKrJV9c4xfto2SGWLCj88Tt1kgx6QrvGqf3up6l&id=100080662660777…Trumpshould really think about the things he saysa few days before he says them because he's becoming the walk it back president or maybe he should stop saying this in Jestright?,🤔 🤣 🤣,0,0,0,,/LuckyOgReal/status/1923890779220586684
1923890879326191808,@CryptoProbing,News Flash,2025-05-17T23:58:24.000Z,"**NEWS FLASH**Trump's Mideast trip splashes out on deals and diplomacy but is unusually quiet on human rights - AP News

Human rights received far less mention on PresidentDonald Trump's trip to the Middle East this week than is usual for presidential visits to","**NEWS FLASH**Trump's Mideast trip splashes out on deals and diplomacy but is unusually quiet on human rights - AP News

Human rights received far less mention on PresidentDonald Trump's trip to the Middle East this week than is usual for presidential visits toShow more",🚨 🚨,0,0,0,,/CryptoProbing/status/1923890879326191808
1923890752146506006,@sum1walkabout,Summer's Walkabout,2025-05-17T23:57:54.000Z,have you apologized toTrumpand the American people for this yet@jaketapper@@cnn?,have you apologized toTrumpand the American people for this yet@jaketapper@@cnn?,,0,0,0,,/sum1walkabout/status/1923890752146506006
1923890807330808051,@lamps_apple,Apple Lamps,2025-05-17T23:58:07.000Z,"Just yesterday you blamedTrumpadmin for issues at Newark when they started years earlier…. “Bridge divides and unify this country” 

Lmao",Replying to@RoKhanna,,4,55,11,https://pbs.twimg.com/media/GrMIfi-XwAAjAKg?format=jpg&name=360x360 https://pbs.twimg.com/media/GrMIfjAWUAAKxXJ?format=jpg&name=360x360 https://pbs.twimg.com/media/GrMIfjVXcAAl5ux?format=jpg&name=360x360,/lamps_apple/status/1923890807330808051
1923890750166532244,@SafetyCreation,SafetyCreationNation,2025-05-17T23:57:53.000Z,"TrumpHits Cartels With Historic Move, Sends Clear Message, reports#davidhookstead","TrumpHits Cartels With Historic Move, Sends Clear Message, reports#davidhookstead",,0,0,0,,/SafetyCreation/status/1923890750166532244
1923890351938600989,@gilbertjimp,Jimmy P (Gilbert AZ),2025-05-17T23:56:18.000Z,"Fiction. You’re fooling yourselves, none of those freaks will ever leaveTrump.",Replying to@allenanalysis,,2,21,3,https://pbs.twimg.com/media/GrMIE27W4AAnP2q?format=jpg&name=small,/gilbertjimp/status/1923890351938600989
1923890869129838647,@TrumpssDiarrhea,Trumps Diarrhea,2025-05-17T23:58:22.000Z,"Trump's plan to turn his own voters' 'devastation' into 'political gold': analyst
I’m sure thattrumpwill turn his bitches by promising more bullshit. It’s worked before hasn’t it?","Trump's plan to turn his own voters' 'devastation' into 'political gold': analyst
I’m sure thattrumpwill turn his bitches by promising more bullshit. It’s worked before hasn’t it?",,0,0,0,,/TrumpssDiarrhea/status/1923890869129838647
1923890526039765211,@corndnc12,Cornelius Duncan,2025-05-17T23:57:00.000Z,"Elon Musk: American hero, true patriot, brilliant entrepreneur, and fearlessTrumpsupporter.  Give a thumbsif you stand with him!",Replying to@MusketeeronX,👍 👍 👍 👍 👍 👍 👍 👍 👍 👍 👍 👍 👍 👍 👍 👍 👍 👍 👍 👍 👍 👍 👍 👍 👍 👍 👍 👍 👍 👍,3,11,3,,/corndnc12/status/1923890526039765211
1923890594323091760,@kchuk07,Elyse Klemchuk,2025-05-17T23:57:16.000Z,You spelledDonald Trumpwrong,Replying to@thecjpearson,,0,0,0,,/kchuk07/status/1923890594323091760
1923890600853586031,@JamesJam72619,Jessica James,2025-05-17T23:57:18.000Z,"Trumpcould suspend habeas corpus, Stephen Miller says | LiveNOW from FOXhttps://youtu.be/6rBJ2Yt0Vkc?si=fUjAWU8E36K-y4UK…via@YouTube","Trumpcould suspend habeas corpus, Stephen Miller says | LiveNOW from FOXhttps://youtu.be/6rBJ2Yt0Vkc?si=fUjAWU8E36K-y4UK…via@YouTube",,0,0,0,https://pbs.twimg.com/card_img/1968105617043886082/_tOIct9l?format=jpg&name=240x240,/JamesJam72619/status/1923890600853586031
1923890991565766811,@CVuksinich,Truth Matters(a Trump-free America),2025-05-17T23:58:51.000Z,This is the second time today your posts made me cry.,Replying to@HackingButLegal,💙 😭,1,11,0,,/CVuksinich/status/1923890991565766811
1923890821109023143,@ChrisMartzWX,Chris Martz,2025-05-17T23:58:10.000Z,"They just like to blameTrumpfor everything that goes wrong. I’m not his biggest fan either, but the TDS runs rampant in our field. Half of our field is filled with a bunch of loud-mouth left-wing activists, not actual scientists.",Replying to@RyanMaue,,10,212,8,,/ChrisMartzWX/status/1923890821109023143
1923891039812911361,@lavenderblue27,nancy bowen,2025-05-17T23:59:02.000Z,Tim Walz Roasts ‘Tyrant’Trumpwith Scathing Warning Speechhttps://msn.com/en-us/news/politics/tim-walz-roasts-tyrant-trump-with-scathing-warning-speech/ar-AA1EYoal?ocid=socialshare…,Tim Walz Roasts ‘Tyrant’Trumpwith Scathing Warning Speechhttps://msn.com/en-us/news/politics/tim-walz-roasts-tyrant-trump-with-scathing-warning-speech/ar-AA1EYoal?ocid=socialshare…,,0,0,0,,/lavenderblue27/status/1923891039812911361
1923891048964608299,@hateGOP,Resist hateful GOP policies,2025-05-17T23:59:04.000Z,'Historically criminal event':Trumprants about 'bigger scandal' in early morning blow-up.,'Historically criminal event':Trumprants about 'bigger scandal' in early morning blow-up.,,0,0,0,https://pbs.twimg.com/card_img/1967290207864336385/2xQ5B2J8?format=jpg&name=small,/hateGOP/status/1923891048964608299
1923891111572988122,@michaelteems48,Michael Teems,2025-05-17T23:59:19.000Z,It seems#Zelenskyis a better salesman than President#Trump. Zelensky and#Putinhaving fruitless negotiations for peace. Zelensky wants American tax dollars in billions. The president and Putin are scheduled for a phone call Monday.#news#MAGA,It seems#Zelenskyis a better salesman than President#Trump. Zelensky and#Putinhaving fruitless negotiations for peace. Zelensky wants American tax dollars in billions. The president and Putin are scheduled for a phone call Monday.#news#MAGA,☮ 🤐,0,1,0,https://pbs.twimg.com/card_img/1968291093746946049/N6AjWwbf?format=jpg&name=small,/michaelteems48/status/1923891111572988122
