tweetId,UserScreenName,UserName,Timestamp,Text,Embedded_text,Emojis,Comments,Likes,Retweets,Image link,Tweet URL
1902500714967962029,@Timcast,Tim Pool,2025-03-19T23:21:31.000Z,"NOPE

Fuck off with the ""trumpMUST listen to these judges""

Holy Fuck","NOPE

Fuck off with the ""trumpMUST listen to these judges""

Holy Fuck",,622,17606,2142,https://pbs.twimg.com/profile_images/1952496567853658112/80xjOjwx_bigger.jpg https://pbs.twimg.com/media/GmcKQqaboAACe4d?format=jpg&name=small,/Timcast/status/1902500714967962029
1902509891824013607,@raggapegs,Voice of Reason,2025-03-19T23:57:59.000Z,Trump2028? Still a cunt!,Trump2028? Still a cunt!,😅 🤣,41,1594,273,https://pbs.twimg.com/media/GmcSqXRaEAAxIUT?format=jpg&name=small,/raggapegs/status/1902509891824013607
1902510240714944677,@Acyn,Acyn,2025-03-19T23:59:22.000Z,Trump: A little secret… people have tried to come up with gold paint that would look like gold. You’ve never been able to match gold with gold paint. That’s why it’s gold,Trump: A little secret… people have tried to come up with gold paint that would look like gold. You’ve never been able to match gold with gold paint. That’s why it’s gold,,960,3156,624,https://pbs.twimg.com/amplify_video_thumb/1902510198356635649/img/xvaCCwNNRfg6FY45.jpg,/Acyn/status/1902510240714944677
1902510349837860873,@Breaking911,Breaking911,2025-03-19T23:59:48.000Z,"TRUMP: ""The only thing I totally admired about Sleepy Joe Biden is the following; he'd go to a beach, he'd lay down on a cot, barely able to get his feet through the sand, within minutes he's sleeping.""

""That's the only thing I think was wonderful.""","TRUMP: ""The only thing I totally admired about Sleepy Joe Biden is the following; he'd go to a beach, he'd lay down on a cot, barely able to get his feet through the sand, within minutes he's sleeping.""

""That's the only thing I think was wonderful.""",😂 😂,137,6100,558,https://pbs.twimg.com/ext_tw_video_thumb/1902509362473738240/pu/img/YcPJZi-J1B6fiY_-.jpg,/Breaking911/status/1902510349837860873
1902510027455557700,@NUPEsupreme,Deuce,2025-03-19T23:58:32.000Z,"Trumpcapitalized off ofignorance, fear, and hatred. MFs were so busy hatingfolk and never saw their own demise coming. POOF!!!@tariqnasheed@Marcel4Congress@PDeniseLong@CCFreedmen@MsKKester@Albertteac@ShidaBaebi@TweetyMontgome1@WkndGirl","Trumpcapitalized off ofignorance, fear, and hatred. MFs were so busy hatingfolk and never saw their own demise coming. POOF!!!@tariqnasheed@Marcel4Congress@PDeniseLong@CCFreedmen@MsKKester@Albertteac@ShidaBaebi@TweetyMontgome1@WkndGirl",⚪ ⚫ 🌬,1,6,5,https://pbs.twimg.com/ext_tw_video_thumb/1902216079889330176/pu/img/cgFLCbF18LRag7J4.jpg,/NUPEsupreme/status/1902510027455557700
1902510094082043910,@heyChrisBoyle,Chris Boyle,2025-03-19T23:58:48.000Z,"Donald Trumpvisits the Kennedy Center to clean out the dust, and release the secrets! Including the long awaited JFK files…

Watch full episodes of “Nights with Chris Boyle” on OAN Live!","Donald Trumpvisits the Kennedy Center to clean out the dust, and release the secrets! Including the long awaited JFK files…

Watch full episodes of “Nights with Chris Boyle” on OAN Live!",,9,113,29,https://pbs.twimg.com/amplify_video_thumb/1902509206550540289/img/VbTFsHbS-UCvpmPs.jpg,/heyChrisBoyle/status/1902510094082043910
1902510089321189572,@AprilSpark1890,𝓐𝓟𝓡𝓘𝓛 𝓢𝓟𝓐𝓡𝓚𝓢,2025-03-19T23:58:46.000Z,"Texas
El Paso Border Sector
During the Biden administration 
- 3000 a day entered illegally 
During theTrump Administration- 9 a day are entering illegally","Texas
El Paso Border Sector
During the Biden administration 
- 3000 a day entered illegally 
During theTrump Administration- 9 a day are entering illegally",,3,68,58,https://pbs.twimg.com/amplify_video_thumb/1902510009025531905/img/aNK1xRj6ZEKFf_NY.jpg,/AprilSpark1890/status/1902510089321189572
1902510248591560870,@saorypon,Saory Pon,2025-03-19T23:59:24.000Z,Press Secretary: PresidentTrumpjust told Zelensky that U.S ownership of Ukraine’s nuclear power plants would provide the “best protection for that infrastructure.”,Press Secretary: PresidentTrumpjust told Zelensky that U.S ownership of Ukraine’s nuclear power plants would provide the “best protection for that infrastructure.”,,0,4,5,https://pbs.twimg.com/amplify_video_thumb/1902510195580006400/img/ropVOugY9dc79chV.jpg,/saorypon/status/1902510248591560870
1902435003864379898,@TheOnion,The Onion,2025-03-19T19:00:25.000Z,Trump’s North American Tariffs: Myth Vs. Facthttps://theonion.com/trumps-north-american-tariffs-myth-vs-fact/…,Trump’s North American Tariffs: Myth Vs. Facthttps://theonion.com/trumps-north-american-tariffs-myth-vs-fact/…,,11,825,68,https://pbs.twimg.com/media/GmbOiZaW4AAcxT9?format=jpg&name=small,/TheOnion/status/1902435003864379898
1902510203821850986,@HotSpotHotSpot,HOT SPOT,2025-03-19T23:59:14.000Z,Trumphas a Diet Coke button in the Oval Office,Trumphas a Diet Coke button in the Oval Office,💀,0,7,5,https://pbs.twimg.com/ext_tw_video_thumb/1902510113849810944/pu/img/xi6ySa1DVkGcPG_0.jpg,/HotSpotHotSpot/status/1902510203821850986
1902510145155834104,@45GoldenPatriot,45th GoldenPatriot,2025-03-19T23:59:00.000Z,TRUMPIS FIGHTING TO PROTECT AMERICA,TRUMPIS FIGHTING TO PROTECT AMERICA,,0,9,6,https://pbs.twimg.com/amplify_video_thumb/1902509929090719744/img/Ln1FtutCLU3qdte-.jpg,/45GoldenPatriot/status/1902510145155834104
1902510383484825940,@mattcoulter_,Matt Coulter,2025-03-19T23:59:57.000Z,Conor McGregor full speech at White House before meeting withDonald Trump,Conor McGregor full speech at White House before meeting withDonald Trump,,0,4,3,https://pbs.twimg.com/card_img/1967614334269325312/WNhPvVns?format=jpg&name=240x240,/mattcoulter_/status/1902510383484825940
1902148012111237184,@Timcast,Tim Pool,2025-03-19T00:00:00.000Z,"JFK FILES RELEASED, Shocking Documents Released ByTrumpDROPPED w/Amber Duke","JFK FILES RELEASED, Shocking Documents Released ByTrumpDROPPED w/Amber Duke",,86,1134,241,https://pbs.twimg.com/profile_images/1952496567853658112/80xjOjwx_bigger.jpg https://pbs.twimg.com/profile_images/1952441525591330816/FEAcjRb5_mini.jpg,/Timcast/status/1902148012111237184
1902510169843462427,@CHRISsW0RLD,CHRIS’WORLD,2025-03-19T23:59:06.000Z,"Zelenskyy and Putin both have WILD demands!

Somehow somewayTrumpis still brokering the deal! 

Here’s the detailsWATCH THIS!","Zelenskyy and Putin both have WILD demands!

Somehow somewayTrumpis still brokering the deal! 

Here’s the detailsWATCH THIS!",‼ ⬇,5,93,89,,/CHRISsW0RLD/status/1902510169843462427
1902510293290267024,@DornEatsIt,Perturabo,2025-03-19T23:59:35.000Z,I thinkDonald Trumphas been watching The Golden Girls because this is starting to make sense,I thinkDonald Trumphas been watching The Golden Girls because this is starting to make sense,,0,2,1,https://pbs.twimg.com/card_img/1967562885531303936/A_2UfBY5?format=jpg&name=240x240,/DornEatsIt/status/1902510293290267024
1902510153888383151,@LiddleSavages,IT’S TIME FOR JUSTICE,2025-03-19T23:59:02.000Z,"Steve Bannon: “I’m a firm believer thatTrumpwill run again in 2028. I’ve already endorsedTrump. I want to see him again in 2028.”

Chris Cuomo: “You know he’s term limited, how do you think he gets another term ?”

Steve Bannon: “We’re working on it.”","Steve Bannon: “I’m a firm believer thatTrumpwill run again in 2028. I’ve already endorsedTrump. I want to see him again in 2028.”

Chris Cuomo: “You know he’s term limited, how do you think he gets another term ?”

Steve Bannon: “We’re working on it.”",,0,0,0,https://pbs.twimg.com/media/GmaaA2gWwAATJLK.jpg,/LiddleSavages/status/1902510153888383151
1902510291532865727,@ProudElephantUS,Proud Elephant,2025-03-19T23:59:35.000Z,"PresidentTrumpcompares himself to Joe Biden: 

“They get a kick when I'm doing other work and doing a news conference — when you had another guy that couldn't name his favorite ice cream.”","PresidentTrumpcompares himself to Joe Biden: 

“They get a kick when I'm doing other work and doing a news conference — when you had another guy that couldn't name his favorite ice cream.”",🦅 🤣 🔥,9,362,56,https://pbs.twimg.com/ext_tw_video_thumb/1902509409143812100/pu/img/GO7QUOwy0CbwC_nu.jpg https://pbs.twimg.com/profile_images/1916971216620982274/1DsLEcqW_bigger.jpg,/ProudElephantUS/status/1902510291532865727
1902510321086165267,@ABC7,ABC7 Eyewitness News,2025-03-19T23:59:42.000Z,"#BREAKINGPresidentDonald Trumpis expected to sign an executive order to diminish the Department of Education at the White House on Thursday, multiple sources told ABC News.https://abc7.la/4iuyvKG","#BREAKINGPresidentDonald Trumpis expected to sign an executive order to diminish the Department of Education at the White House on Thursday, multiple sources told ABC News.https://abc7.la/4iuyvKG",,30,82,27,https://pbs.twimg.com/media/GmcTDgXWUAAUj-q?format=jpg&name=small,/ABC7/status/1902510321086165267
1902510312617865434,@elomax6,Eric Lomax,2025-03-19T23:59:40.000Z,"Office Hours: What’sTrump’s REAL goal?, by@RBReichhttps://open.substack.com/pub/robertreich/p/office-hours-whats-trumps-real-goal?r=upfjh&utm_campaign=post&utm_medium=email…","Office Hours: What’sTrump’s REAL goal?, by@RBReichhttps://open.substack.com/pub/robertreich/p/office-hours-whats-trumps-real-goal?r=upfjh&utm_campaign=post&utm_medium=email…",,0,0,0,,/elomax6/status/1902510312617865434
1902510347216449553,@CKymbra63546,Kymbra C. Kelley,2025-03-19T23:59:48.000Z,Trump administrationextends opioid emergency as fentanyl deaths drop - NPR,Trump administrationextends opioid emergency as fentanyl deaths drop - NPR,,0,1,0,,/CKymbra63546/status/1902510347216449553
1902510252106367227,@Osint613,Open Source Intel,2025-03-19T23:59:25.000Z,BREAKINGNBC:Trumpto sign executive order dismantling the Education Department.,BREAKINGNBC:Trumpto sign executive order dismantling the Education Department.,🔴,23,668,79,https://pbs.twimg.com/media/GmcS_CFXEAAUm0-?format=jpg&name=small,/Osint613/status/1902510252106367227
1902510232271483190,@dxrnelljcl,dxrnelljcl,2025-03-19T23:59:20.000Z,"Break + retest + engulfing on$TRUMP?

Interesting","Break + retest + engulfing on$TRUMP?

Interesting",,8,27,5,https://pbs.twimg.com/profile_images/1788689184355414016/mZMLcdNO_bigger.jpg https://pbs.twimg.com/media/GmcS-Lia8AItE7U?format=jpg&name=small,/dxrnelljcl/status/1902510232271483190
1902510316803518658,@CHRISsW0RLD,CHRIS’WORLD,2025-03-19T23:59:41.000Z,"LIVE NOWTonight I Discuss:
-Are The JFK Files A Flop?
-CanTrumpGet Peace in Ukraine?
-PROOF of MORE USAID Fraud!
-THE SWATTING NEEDS TO STOP!
-AND MUCH MORE!

𝘓𝘪𝘷𝘦 𝘔𝘰𝘯𝘥𝘢𝘺 - 𝘛𝘩𝘶𝘳𝘴𝘥𝘢𝘺
8𝘱𝘮/𝘌𝘚𝘛","LIVE NOWTonight I Discuss:
-Are The JFK Files A Flop?
-CanTrumpGet Peace in Ukraine?
-PROOF of MORE USAID Fraud!
-THE SWATTING NEEDS TO STOP!
-AND MUCH MORE!

𝘓𝘪𝘷𝘦 𝘔𝘰𝘯𝘥𝘢𝘺 - 𝘛𝘩𝘶𝘳𝘴𝘥𝘢𝘺
8𝘱𝘮/𝘌𝘚𝘛",💥 💥,6,56,86,https://pbs.twimg.com/profile_images/1944609316906172416/V2HW9D6P_mini.jpg,/CHRISsW0RLD/status/1902510316803518658
1902510001454735775,@MaekeleTeklay,Maekele Teklay,2025-03-19T23:58:25.000Z,"Can Europe Achieve Strategic Independence from Washington?
- The United States has withdrawn its troops from all over Europe.
-US PresidentDonald Trumpwithdraws 35,000 US troops from Germany
-Withdraw about 20,000 troops from various parts of Europe.","Can Europe Achieve Strategic Independence from Washington?
- The United States has withdrawn its troops from all over Europe.
-US PresidentDonald Trumpwithdraws 35,000 US troops from Germany
-Withdraw about 20,000 troops from various parts of Europe.",,0,0,0,https://pbs.twimg.com/media/GmcPx0UWwAAWGi4?format=png&name=360x360 https://pbs.twimg.com/media/GmcQJjza8AcNqZN?format=jpg&name=360x360 https://pbs.twimg.com/media/GmcQ2fMWAAATUhe?format=png&name=360x360 https://pbs.twimg.com/media/GmcSvlQWIAAhBT8?format=png&name=small,/MaekeleTeklay/status/1902510001454735775
1902510223232766201,@natureboy1t,crabbman,2025-03-19T23:59:18.000Z,"Jack Schlossberg Slams ""Obsessed""Donald TrumpAfter Release of JFK Assassination Documentshttps://msn.com/en-us/travel/news/jack-schlossberg-slams-obsessed-donald-trump-after-release-of-jfk-assassination-documents/vi-AA1Bg5Ad?ocid=socialshare…","Jack Schlossberg Slams ""Obsessed""Donald TrumpAfter Release of JFK Assassination Documentshttps://msn.com/en-us/travel/news/jack-schlossberg-slams-obsessed-donald-trump-after-release-of-jfk-assassination-documents/vi-AA1Bg5Ad?ocid=socialshare…",,0,0,0,,/natureboy1t/status/1902510223232766201
1902510209618133245,@PharmaPinkSheet,"Pink Sheet, Citeline Regulatory",2025-03-19T23:59:15.000Z,US FDA’s Speed Of Work UnderTrumpQuietly Raising Industry Concernshttp://ow.ly/wWEI1062XTR#PinkSheet,US FDA’s Speed Of Work UnderTrumpQuietly Raising Industry Concernshttp://ow.ly/wWEI1062XTR#PinkSheet,,0,1,2,https://pbs.twimg.com/media/GmcS9E9bgAA4-Ns?format=jpg&name=small,/PharmaPinkSheet/status/1902510209618133245
1902510080169304539,@AndrewW43599783,Bucky The Big Brown Beaver,2025-03-19T23:58:44.000Z,"EvenTrumplikes Carney, proving once again that nobody likes Poilievre","EvenTrumplikes Carney, proving once again that nobody likes Poilievre",,0,3,1,https://pbs.twimg.com/media/GmcS1efXMAA857A?format=jpg&name=small,/AndrewW43599783/status/1902510080169304539
1902510110028538336,@electMikeHarvey,Mike Harvey,2025-03-19T23:58:51.000Z,"Has anyone heard a peep from Florida congresswoman@KathyCastorFL? 

How does she feel aboutTrumpand Doge? Has anyone seen her?","Has anyone heard a peep from Florida congresswoman@KathyCastorFL? 

How does she feel aboutTrumpand Doge? Has anyone seen her?",,0,10,9,,/electMikeHarvey/status/1902510110028538336
1902510188810428583,@AMudrunner,Anne Mudrunner,2025-03-19T23:59:10.000Z,"Tesla Attacks, Weird Walz Comments, and Judges Keep FightingTrump, w/ R...https://youtu.be/jPdJxmBf-Nk?si=YrAyR-7oYxukbE3i…via@YouTube","Tesla Attacks, Weird Walz Comments, and Judges Keep FightingTrump, w/ R...https://youtu.be/jPdJxmBf-Nk?si=YrAyR-7oYxukbE3i…via@YouTube",,0,0,0,,/AMudrunner/status/1902510188810428583
1902510378489200888,@nzekigongo,RЦZIПDΛПΛ KIGӨПGӨ,2025-03-19T23:59:55.000Z,"I can simply say that I was $900 million rich or richer thanTrumpin 1991. Dear Lord, please multiply my wealthy like the miracle you gaveTrump. I am real waiting","I can simply say that I was $900 million rich or richer thanTrumpin 1991. Dear Lord, please multiply my wealthy like the miracle you gaveTrump. I am real waiting",🙏 👇,0,0,0,,/nzekigongo/status/1902510378489200888
1902510280338489595,@Cinquinaca,Evergreen,2025-03-19T23:59:32.000Z,"I got something’s to say to you Fucker CarlsonI used to admire you one you are a liar propagandist and a POS a real danger toTrumpMAGA, women and America@TuckerToday@TuckerCarlsonYou are paid by Qatar and Iran","I got something’s to say to you Fucker CarlsonI used to admire you one you are a liar propagandist and a POS a real danger toTrumpMAGA, women and America@TuckerToday@TuckerCarlsonYou are paid by Qatar and Iran",🙄,0,1,1,,/Cinquinaca/status/1902510280338489595
1902510189237964871,@JeddSteele,Jedd Steele,2025-03-19T23:59:10.000Z,Trumpdoesn’t need one of those backpacks with a leash like Joe did.,Trumpdoesn’t need one of those backpacks with a leash like Joe did.,,0,0,0,https://pbs.twimg.com/profile_images/1628885077051539457/KpgyeXAU_mini.jpg,/JeddSteele/status/1902510189237964871
1902510321010348351,@BoSnerdley,Bo Snerdley,2025-03-19T23:59:42.000Z,Karoline Leavitt rips 'partisan' judge overTrumpmigrant flightshttps://mol.im/a/14516459via@MailOnline,Karoline Leavitt rips 'partisan' judge overTrumpmigrant flightshttps://mol.im/a/14516459via@MailOnline,,7,300,31,,/BoSnerdley/status/1902510321010348351
1902510209039257988,@paulsimon991,paul simon,2025-03-19T23:59:15.000Z,"Trumpset to sign executive order shuttering the Education Departmenthttps://nbcnews.com/politics/trump-administration/trump-set-sign-executive-order-shuttering-department-education-rcna197191…via@nbcnewsNice ""fake news"" narrative in the final paragraph.","Trumpset to sign executive order shuttering the Education Departmenthttps://nbcnews.com/politics/trump-administration/trump-set-sign-executive-order-shuttering-department-education-rcna197191…via@nbcnewsNice ""fake news"" narrative in the final paragraph.",,0,0,0,https://pbs.twimg.com/card_img/1966327787767345160/x5NlxmFn?format=jpg&name=small,/paulsimon991/status/1902510209039257988
1902510253373042757,@ConserLibrarian,ConservativeLibrarian,2025-03-19T23:59:25.000Z,Congresswoman Sets the Record Straight on GrossTrumpAllegations,Congresswoman Sets the Record Straight on GrossTrumpAllegations,,0,0,0,,/ConserLibrarian/status/1902510253373042757
1902510179792404830,@USATRUMPMAN1,USA Trump Man,2025-03-19T23:59:08.000Z,Who remembers this song,Who remembers this song,,62,55,9,https://pbs.twimg.com/media/GmcS7O3WAAAhwA9?format=jpg&name=small,/USATRUMPMAN1/status/1902510179792404830
1902510345651908623,@AnatoliUkraine,AnatolijUkraine,2025-03-19T23:59:47.000Z,Trump’s logic is as broken as his morals. Selling citizenship while screaming “America First” is peak hypocrisy—even for him.,Replying to@Acyn,,1,112,14,,/AnatoliUkraine/status/1902510345651908623
1902510182053077211,@dupui,I Have No More Patience Fact: Trump has our backs,2025-03-19T23:59:08.000Z,I am convinced,I am convinced,,0,0,0,https://pbs.twimg.com/profile_images/1964787501324779520/5XNTcgzK_mini.jpg https://pbs.twimg.com/media/GmW4O2rWUAIvqnM?format=jpg&name=small,/dupui/status/1902510182053077211
1902510091154129231,@dupui,I Have No More Patience Fact: Trump has our backs,2025-03-19T23:58:47.000Z,I don’t either.,I don’t either.,,0,0,0,https://pbs.twimg.com/profile_images/1911850515622699008/L4ev1V-k_mini.jpg https://pbs.twimg.com/profile_images/1877085039948668928/f4AibqzY_bigger.jpg,/dupui/status/1902510091154129231
1902510379684471178,@SonOfEvergenius,Son_OF_EVERGENIUS,2025-03-19T23:59:56.000Z,PresidentTrumpTo Speak At Digital Assets Summit Tomorrowhttps://bitcoinmagazine.com/news/president-trump-to-speak-at-digital-assets-summit-tomorrow…via@bitcoinmagazine,PresidentTrumpTo Speak At Digital Assets Summit Tomorrowhttps://bitcoinmagazine.com/news/president-trump-to-speak-at-digital-assets-summit-tomorrow…via@bitcoinmagazine,,0,2,1,https://pbs.twimg.com/card_img/1966574361890152449/5FNFLvKn?format=png&name=small,/SonOfEvergenius/status/1902510379684471178
1902510110657978528,@Local4News,Local 4 WDIV Detroit,2025-03-19T23:58:51.000Z,"Donald Trumpplans to sign an executive order Thursday calling for the shutdown of the U.S. Education Department, according to a White House official, advancing a campaign promise to eliminate an agency that's been a longtime target of conservatives.","Donald Trumpplans to sign an executive order Thursday calling for the shutdown of the U.S. Education Department, according to a White House official, advancing a campaign promise to eliminate an agency that's been a longtime target of conservatives.",,0,5,1,,/Local4News/status/1902510110657978528
1902510239821295658,@cuchovivas,Cucho Vivas,2025-03-19T23:59:22.000Z,Donald Trumpplans to sign an executive order Thursday calling for the shutdown of the U.S. Education Department,Donald Trumpplans to sign an executive order Thursday calling for the shutdown of the U.S. Education Department,,0,0,0,https://pbs.twimg.com/card_img/1967445137329696768/Gby4Ak1_?format=jpg&name=small,/cuchovivas/status/1902510239821295658
1902510036556923241,@FranklinLamber9,Franklin Lamberty,2025-03-19T23:58:34.000Z,"Trump’s new top prosecutor in Upstate NY suggested trying Biden for treason, deporting Obama#DonaldTrump#JoeBiden#Senate#Voterfraudhttps://share.newsbreak.com/c5w0u7pr","Trump’s new top prosecutor in Upstate NY suggested trying Biden for treason, deporting Obama#DonaldTrump#JoeBiden#Senate#Voterfraudhttps://share.newsbreak.com/c5w0u7pr",,0,0,0,,/FranklinLamber9/status/1902510036556923241
1902510262252671068,@weareteamtrump,Trump Hotels Jobs,2025-03-19T23:59:28.000Z,"Interested in a job in Chicago, IL? This could be a great fit:","Interested in a job in Chicago, IL? This could be a great fit:",,0,0,0,,/weareteamtrump/status/1902510262252671068
1902510239691227455,@TMommadukes,Tonya,2025-03-19T23:59:22.000Z,"Jerome Powell trashingTrump. 
Maybe he needs a deep@DOGEdive.","Jerome Powell trashingTrump. 
Maybe he needs a deep@DOGEdive.",,0,0,0,https://pbs.twimg.com/amplify_video_thumb/1902429852252180480/img/E_YgT0mja-bMRIAu.jpg,/TMommadukes/status/1902510239691227455
1902510341243740537,@RobertMihaly1,Robert Mihaly,2025-03-19T23:59:46.000Z,They also all live inTrump's colon!#Traitorsall!,They also all live inTrump's colon!#Traitorsall!,✍ 😷 🌻,0,0,0,https://pbs.twimg.com/profile_images/1830963641375449089/HOt1ARpN_mini.jpg https://pbs.twimg.com/media/Gk01jddXgAACWG4.png,/RobertMihaly1/status/1902510341243740537
1902510204043805160,@NancyMar2025,Courage4ever,2025-03-19T23:59:14.000Z,"I am very grateful to be included in your list. Thank you, JackPlease follow my friend and amazing Patriot@JackMedia7",Replying to@JackMedia7@Kimsparrow13and 16 others,💎 💎 ❤ 🙏 ❤ ✨ ✨ ✨ ✨ ✨ 👆 👆 👆 👆 👆 👆 👆 👆 👆 👆 👆,1,7,3,https://pbs.twimg.com/media/GmcS8uzWcAAJHID?format=jpg&name=small,/NancyMar2025/status/1902510204043805160
1902510199979577426,@Pieroscara,Piero Scaramuzzi,2025-03-19T23:59:13.000Z,"What we have seen sinceTrumpgot into politics is that he says politically incorrect things, but gets things done. Professional politicians say all the right things and get nothing done.","What we have seen sinceTrumpgot into politics is that he says politically incorrect things, but gets things done. Professional politicians say all the right things and get nothing done.",,0,2,0,,/Pieroscara/status/1902510199979577426
1902510271832215607,@pontiph,Kathy,2025-03-19T23:59:30.000Z,Faith leaders across the US gather in Oval Office to pray overTrump#DonaldTrump#MikePence#Religionhttps://share.newsbreak.com/c5w22p8g,Faith leaders across the US gather in Oval Office to pray overTrump#DonaldTrump#MikePence#Religionhttps://share.newsbreak.com/c5w22p8g,,0,0,0,,/pontiph/status/1902510271832215607
1902510335229063254,@KaliBiolo,Kali Biolo,2025-03-19T23:59:45.000Z,Hey Fox News… are you having a liberal psychotic episode? There are ZERO concerns. ZERO. We approve everythingTrumpand Elon are doing. Unfollowing liberal Faux News,Replying to@FoxNews,🌹 🌹,3,394,21,,/KaliBiolo/status/1902510335229063254
1902510380582367457,@ewa_baczkowska,Evita26,2025-03-19T23:59:56.000Z,PresidentTrumphas  fired both Democratic Commissioners on a Federal Trade Commission.,PresidentTrumphas  fired both Democratic Commissioners on a Federal Trade Commission.,,0,4,1,https://pbs.twimg.com/media/GmcTG7-bYAAofEo?format=jpg&name=360x360 https://pbs.twimg.com/media/GmcTG7ra8AUqwUg?format=jpg&name=360x360,/ewa_baczkowska/status/1902510380582367457
1902510073882238999,@DiogenesQuest,Gregory G. Sarno,2025-03-19T23:58:43.000Z,Trump’s America Is a Nation of Chumps,Trump’s America Is a Nation of Chumps,,0,1,0,https://pbs.twimg.com/card_img/1966634260829265922/q8Wy49MG?format=jpg&name=small,/DiogenesQuest/status/1902510073882238999
1902510211589353600,@timbotimbo,timbob,2025-03-19T23:59:16.000Z,Fitting that Susan Collins is the face in the photo.  She is certainly a leader inTrump's fight to make congress irrelevant.,Fitting that Susan Collins is the face in the photo.  She is certainly a leader inTrump's fight to make congress irrelevant.,,0,0,0,https://pbs.twimg.com/profile_images/1821642506800353280/xIpx4wIO_mini.jpg,/timbotimbo/status/1902510211589353600
1902510188310999302,@LarryJCovingto2,Larry J Covington Sr,2025-03-19T23:59:10.000Z,The idea renaming the Gulf of Mexico was first jokingly in the early 2010s by Stephen Colbert to call it the Gulf of America.  By Executive Order by PresidentTrumpit is now the Gulf of America.,The idea renaming the Gulf of Mexico was first jokingly in the early 2010s by Stephen Colbert to call it the Gulf of America.  By Executive Order by PresidentTrumpit is now the Gulf of America.,,4,16,2,,/LarryJCovingto2/status/1902510188310999302
1902510291700871238,@jcwandemberg,Juan Carlos Wandemberg Boschetti Ph.D.,2025-03-19T23:59:35.000Z,"TypicalTrump's  ""Art of the deal""","TypicalTrump's  ""Art of the deal""",,0,0,0,https://pbs.twimg.com/profile_images/1799010965301915649/1LDhq6ku_mini.jpg https://pbs.twimg.com/profile_images/1822957904644739072/BXonw0wU_bigger.jpg https://pbs.twimg.com/media/GmakVe-XIAA2gmP.jpg,/jcwandemberg/status/1902510291700871238
1902510240987304046,@Web3warren,Warren,2025-03-19T23:59:23.000Z,Free Alpa Get in early$baby$ron$reba$trump$JIMMY#newcoinlaunchhttps://x.com/Nakamoto16J/st/Nakamoto16J/status/1902481737470312904…,Free Alpa Get in early$baby$ron$reba$trump$JIMMY#newcoinlaunchhttps://x.com/Nakamoto16J/st/Nakamoto16J/status/1902481737470312904…,,1,4,0,,/Web3warren/status/1902510240987304046
1902510062100439145,@SFsurveyor,San Francisco Surveying Company,2025-03-19T23:58:40.000Z,no matter how many times and ways  you lie about it - The facts do not change.Trumpis required to lead within in the confines of the constitution. The proper venue to resolve disputes is in court. That is how true Americans roll.,no matter how many times and ways  you lie about it - The facts do not change.Trumpis required to lead within in the confines of the constitution. The proper venue to resolve disputes is in court. That is how true Americans roll.,,0,0,0,,/SFsurveyor/status/1902510062100439145
1902510040222969875,@LaRoucheOrg,LaRoucheOrg,2025-03-19T23:58:35.000Z,HelpTrumpMake Peace — TLO Battles It Out,HelpTrumpMake Peace — TLO Battles It Out,,0,10,4,,/LaRoucheOrg/status/1902510040222969875
