tweetId,UserScreenName,UserName,Timestamp,Text,Embedded_text,Emojis,Comments,Likes,Retweets,Image link,Tweet URL
1921354503531442217,@EnyartMike,mike enyart,2025-05-10T23:59:45.000Z,"What did I vote for?
How aboutTrumpdoing what he's doing.","What did I vote for?
How aboutTrumpdoing what he's doing.",😀,0,3,0,,/EnyartMike/status/1921354503531442217
1921354131781853423,@marxstrimist,☭☭,2025-05-10T23:58:16.000Z,Trumpa funny as nigga man,Trumpa funny as nigga man,🔻,0,1,0,https://pbs.twimg.com/profile_images/1625357612094050304/2gokYEdL_mini.jpg https://pbs.twimg.com/amplify_video_thumb/1720914314432045056/img/_gCDmhvoShOReLw5.jpg,/marxstrimist/status/1921354131781853423
1921354257975980097,@JohnNagel46A,John Nagel,2025-05-10T23:58:46.000Z,One of Biden's crimes is all the criminal sexual predators that he allowed into our country. Minnesota Democrats go with the party and we became a sanctuary state.Trumpwasn't kidding when he said these countries opened their jails up and left the worst-case criminals out. Now,One of Biden's crimes is all the criminal sexual predators that he allowed into our country. Minnesota Democrats go with the party and we became a sanctuary state.Trumpwasn't kidding when he said these countries opened their jails up and left the worst-case criminals out. NowShow more,,0,3,2,,/JohnNagel46A/status/1921354257975980097
1921354463668736142,@claud2deaf,claudia. neet/acc,2025-05-10T23:59:35.000Z,Waittrumpis president again WTF??,Waittrumpis president again WTF??,,0,2,0,https://pbs.twimg.com/profile_images/874276197357596672/kUuht00m_mini.jpg https://pbs.twimg.com/amplify_video_thumb/1921008177753030657/img/yyz3aaFLMad7GGqT.jpg,/claud2deaf/status/1921354463668736142
1921354308701782496,@X106,@X106,2025-05-10T23:58:58.000Z,Pakistan spits onDonald Trump’s face@POTUS@VP@SecRubioPakistan violates ceasefire again !,Pakistan spits onDonald Trump’s face@POTUS@VP@SecRubioPakistan violates ceasefire again !,,0,1,0,https://pbs.twimg.com/profile_images/895698342792933376/4Rs-Ynpd_mini.jpg,/Ex106_/status/1921354308701782496
1921353960255799381,@doollynoted,Doolly Noted,2025-05-10T23:57:35.000Z,"News: PresidentTrumpannounced a ""total reset"" in US-China trade talks in Geneva, calling the meeting friendly yet constructive. No deal was finalized, but discussions aimed to ease tensions from 145% US tariffs on Chinese goods and China's 125% retaliatory tariffs.","News: PresidentTrumpannounced a ""total reset"" in US-China trade talks in Geneva, calling the meeting friendly yet constructive. No deal was finalized, but discussions aimed to ease tensions from 145% US tariffs on Chinese goods and China's 125% retaliatory tariffs.",✏,0,0,0,,/doollynoted/status/1921353960255799381
1921354401828212863,@A8te_Ball,A8te_Ball,2025-05-10T23:59:21.000Z,"Gov McMaster, can you please get the SC Congress to reconsider this...no abortion from moment of conception, with a murder charge, but no death penalty.Trump, since it's YOUR job to protect the lives of ALL citizens, why do you allow GOD's babies to be murdered?@henrymcmaster","Gov McMaster, can you please get the SC Congress to reconsider this...no abortion from moment of conception, with a murder charge, but no death penalty.Trump, since it's YOUR job to protect the lives of ALL citizens, why do you allow GOD's babies to be murdered?@henrymcmasterShow more",,0,0,0,,/A8te_Ball/status/1921354401828212863
1921353981579702687,@sherryanna,sherryanna,2025-05-10T23:57:40.000Z,"EverythingTrumpdoes is unsurprising but still chills me to the bone. Wake the *uck up, America!","EverythingTrumpdoes is unsurprising but still chills me to the bone. Wake the *uck up, America!",❤ ❤,0,0,0,https://pbs.twimg.com/profile_images/1787879147110354944/w7TRERKD_mini.jpg,/sherryanna/status/1921353981579702687
1921354379732435360,@phunnyphilly,phunnyphilly,2025-05-10T23:59:15.000Z,"Hah! Yeah! Where are sll those patriotic#2ndAmendmentcrusaders who have been a bulwark against a tyrannical govt?!? Now suspension of const rights, unlawful detention, etc seem fine w/ them! Wait'llTrumptakes their guns...","Hah! Yeah! Where are sll those patriotic#2ndAmendmentcrusaders who have been a bulwark against a tyrannical govt?!? Now suspension of const rights, unlawful detention, etc seem fine w/ them! Wait'llTrumptakes their guns...",,0,0,0,https://pbs.twimg.com/profile_images/1508878527898214406/rJFf0yg6_mini.jpg https://pbs.twimg.com/media/Gql2anvWEAATI8-?format=jpg&name=small,/phunnyphilly/status/1921354379732435360
1921354539103293516,@GermansShutUp,Germany was a mistake,2025-05-10T23:59:53.000Z,My take on Huckabee is that ppl in Washington know he’s an imbecile. His job as ambassador is to be a jester who appeases the radical Zionists and the MAGA base while the deep state andtrumpdo the real work. Ignore everything he says bc they don’t tell him anything.,My take on Huckabee is that ppl in Washington know he’s an imbecile. His job as ambassador is to be a jester who appeases the radical Zionists and the MAGA base while the deep state andtrumpdo the real work. Ignore everything he says bc they don’t tell him anything.,,1,1,0,https://pbs.twimg.com/profile_images/1650510503804907525/CO3-pK3f_mini.jpg,/GermansShutUp/status/1921354539103293516
1921353807243428267,@SalesProTom,Tommytune,2025-05-10T23:56:59.000Z,"Wake up….  and stop the lies.Trumpsaid he wanted to reopen Alcatraz and send the worst of the hardened criminals there, not immigrants, they will be sent home. And soon.","Wake up….  and stop the lies.Trumpsaid he wanted to reopen Alcatraz and send the worst of the hardened criminals there, not immigrants, they will be sent home. And soon.",,0,0,0,https://pbs.twimg.com/profile_images/1677756031324102659/QmkoTNg5_mini.jpg https://pbs.twimg.com/amplify_video_thumb/1921310766650564608/img/3tClbExeEdr6tZvL.jpg,/SalesProTom/status/1921353807243428267
1921354139663000030,@FromageDuTrump,Commander Of Cheese,2025-05-10T23:58:18.000Z,"Obviously, someone thinks I am a Trumpkin.","Obviously, someone thinks I am a Trumpkin.",😳,0,0,0,https://pbs.twimg.com/profile_images/1800156171028049920/ODa-y29z_mini.jpg,/FromageDuTrump/status/1921354139663000030
1921354532769931511,@GoChiSox33,Castor Troy,2025-05-10T23:59:52.000Z,And your president caved like a bitch.  Never understood people selling stocks because oftrumpand saying he only cares about the rich.https://x.com/Mike_Taylor197/Mike_Taylor1972/status/1921338061666824583…,And your president caved like a bitch.  Never understood people selling stocks because oftrumpand saying he only cares about the rich.https://x.com/Mike_Taylor197/Mike_Taylor1972/status/1921338061666824583…,,0,0,0,,/GoChiSox33/status/1921354532769931511
1921354330306670937,@WTHRcom,WTHR.com,2025-05-10T23:59:04.000Z,The Republican Party is trying to figure out what it stands for in terms of economic policy during the secondTrump administration.https://wthr.com/article/news/nation-world/republicans-wrestle-with-economic-priorities/507-9e102375-f6fe-4967-8ff2-8981236725a0…,The Republican Party is trying to figure out what it stands for in terms of economic policy during the secondTrump administration.https://wthr.com/article/news/nation-world/republicans-wrestle-with-economic-priorities/507-9e102375-f6fe-4967-8ff2-8981236725a0…,,5,0,1,,/WTHRcom/status/1921354330306670937
1921354181387878809,@ronniietorrt,RT,2025-05-10T23:58:28.000Z,What did theTrumpadmin discover to do a complete 180 on Israel this suddenly?,What did theTrumpadmin discover to do a complete 180 on Israel this suddenly?,,0,0,0,https://pbs.twimg.com/profile_images/1926359090973818880/Fp80oxwf_mini.jpg https://pbs.twimg.com/media/Gqhu9KSXgAASvuu?format=jpg&name=360x360 https://pbs.twimg.com/media/Gqhu9KVWIAASlJx?format=jpg&name=360x360 https://pbs.twimg.com/media/Gqhu9KXWgAAqG7A?format=jpg&name=360x360,/ronniietorrt/status/1921354181387878809
1921354464021139530,@StevenS21101,Steven Sharkey,2025-05-10T23:59:35.000Z,"Trumptells Canada , the U.S. doesn't need their$hit.","Trumptells Canada , the U.S. doesn't need their$hit.",🦨 🦨,0,0,0,https://pbs.twimg.com/profile_images/1966435985232633856/3aiUHCGt_mini.jpg https://pbs.twimg.com/amplify_video_thumb/1920034751546535936/img/jU5yBP-z-UlqQW4f.jpg,/StevenS21101/status/1921354464021139530
1921354348728091029,@CaptainMAGA123,CAPTAIN MAGA,2025-05-10T23:59:08.000Z,We knew the left was going to go crazy whenTrumpwon it’s just endless aren’t you tired of sensationalizing everything,We knew the left was going to go crazy whenTrumpwon it’s just endless aren’t you tired of sensationalizing everything,,0,0,0,https://pbs.twimg.com/profile_images/843897836383158274/hmHktXQP_mini.jpg https://pbs.twimg.com/profile_images/1613673899371159555/X20dMMBa_bigger.jpg https://pbs.twimg.com/media/GqmJS87XYAAX4wg?format=jpg&name=small,/CaptainMAGA123/status/1921354348728091029
1921354037447848048,@14wombat1,Patrick Emek,2025-05-10T23:57:54.000Z,"(9hours)

PROFESSOR GLENN DIESEN
with
ALASTAIR CROOKE
and
PROFESSOR SAYED MARANDI
discuss

""TRUMP'S NEGOTIATIONS FAIL""","(9hours)

PROFESSOR GLENN DIESEN
with
ALASTAIR CROOKE
and
PROFESSOR SAYED MARANDI
discuss

""TRUMP'S NEGOTIATIONS FAIL""",,0,0,0,https://pbs.twimg.com/card_img/1968226796983226368/iy6OGjrb?format=jpg&name=240x240,/14wombat1/status/1921354037447848048
1921354033786126543,@camachosue1,Sue Camacho,2025-05-10T23:57:53.000Z,"No one is above the law norm, not you notTrumpyour favorite rapist","No one is above the law norm, not you notTrumpyour favorite rapist",,0,0,0,https://pbs.twimg.com/profile_images/1418559976105250816/q5BPjCyZ_mini.jpg https://pbs.twimg.com/amplify_video_thumb/1920735177044590592/img/vuxv7QPFdYm_HsXE.jpg,/camachosue1/status/1921354033786126543
1921354396803199260,@OneBadDude_,One Bad Dude,2025-05-10T23:59:19.000Z,Donald Trump is the boss,Replying to@GuntherEagleman,😎,2,22,2,,/OneBadDude_/status/1921354396803199260
1921354128036438279,@bookstand171,shirleyfrancesstands,2025-05-10T23:58:15.000Z,https://newsmax.com/finance/streettalk/donald-trump-commercial-fishing-new-england/2025/05/10/id/1210383/…u will be able to enjoy  fresh fish at least a minus 30 % cost now also the chrysler decision reversal cost will help the prices since the federal looksee officer will not be there any longer at the expense of the fisherman cheaper ocean fish & shrimp now,https://newsmax.com/finance/streettalk/donald-trump-commercial-fishing-new-england/2025/05/10/id/1210383/…u will be able to enjoy  fresh fish at least a minus 30 % cost now also the chrysler decision reversal cost will help the prices since the federal looksee officer will not be there any longer at the expense of the fisherman cheaper ocean fish & shrimp now,,0,1,1,https://pbs.twimg.com/card_img/1966974430191464448/PXmgDlrW?format=jpg&name=360x360,/bookstand171/status/1921354128036438279
1921354317576962133,@Raja_NIA_,ராஜாதி ராஜா,2025-05-10T23:59:01.000Z,"Misleading! 

There is no ceasefire, as Pakistan has violated it just few hours afterTrump's post, putting his assurance and words in dustbin. 

Confirmation by Jammu and Kashmir Chief Minister below:https://x.com/OmarAbdullah/status/1921228736776527917?t=N2-fN39VeQf6OVCVwjSWaA&s=19…https://x.com/ANI/status/1921227661822574667?t=PQKQ7--v1tLphKi-voDNsQ&s=19…https://x.com/ANI/status/1921233402100850857?t=PQKQ7--v1tLphKi-voDNsQ&s=19…","Misleading! 

There is no ceasefire, as Pakistan has violated it just few hours afterTrump's post, putting his assurance and words in dustbin. 

Confirmation by Jammu and Kashmir Chief Minister below:https://x.com/OmarAbdullah/status/1921228736776527917?t=N2-fN39VeQf6OVCVwjSWaA&s=19…https://x.com/ANI/status/1921227661822574667?t=PQKQ7--v1tLphKi-voDNsQ&s=19…https://x.com/ANI/status/1921233402100850857?t=PQKQ7--v1tLphKi-voDNsQ&s=19…",,0,1,0,https://pbs.twimg.com/profile_images/1582690935280128001/2QSbyUZK_mini.jpg,/Raja_NIA_/status/1921354317576962133
1921354520929444066,@Accountable55,Cyril Smith,2025-05-10T23:59:49.000Z,"Western leaders still projecting a win that will never happen. Bit likeTrumpdeclaring that the peace deal is close when in fact, it is miles away. Don’t know if you follow New Atlas but Brian Berletic believesTrumphas no intention of peace with Russia. All an act.","Western leaders still projecting a win that will never happen. Bit likeTrumpdeclaring that the peace deal is close when in fact, it is miles away. Don’t know if you follow New Atlas but Brian Berletic believesTrumphas no intention of peace with Russia. All an act.",,0,0,0,https://pbs.twimg.com/profile_images/1379573886296104962/hyYG7Blm_mini.jpg,/Accountable55/status/1921354520929444066
1921354369976430600,@DanFromMo,@DanFromMo,2025-05-10T23:59:13.000Z,Wish we could deport the judges fightingTrumpand trade them one for one illegal who does love the USA and it's laws.  There are some!,Wish we could deport the judges fightingTrumpand trade them one for one illegal who does love the USA and it's laws.  There are some!,,0,0,0,https://pbs.twimg.com/profile_images/1820107701520662528/uWJvyjvt_mini.jpg https://pbs.twimg.com/media/GqeMovPW8AAnqux?format=jpg&name=small,/DanFromMo/status/1921354369976430600
1921354117361828007,@thewholetruth87,Donald J. Trump the real President 2020-2024.,2025-05-10T23:58:13.000Z,And he can tear your face off in a nano second,And he can tear your face off in a nano second,☘,0,0,0,https://pbs.twimg.com/profile_images/992795937574604802/FMGk7GZN_mini.jpg https://pbs.twimg.com/profile_images/1813481616393502720/s09OpdGc_bigger.jpg https://pbs.twimg.com/ext_tw_video_thumb/1921292551119687680/pu/img/K_TWvLWlNKm-f8EV.jpg,/thewholetruth87/status/1921354117361828007
1921354429632012414,@PritzkerForPrez,Socialists For Pritzker,2025-05-10T23:59:27.000Z,Good thing this stupid asshole has no power or significance—unlike his coolTrump-hating brother Bob!,Good thing this stupid asshole has no power or significance—unlike his coolTrump-hating brother Bob!,,2,55,1,https://pbs.twimg.com/profile_images/1834579855016394752/uljpNRL6_mini.jpg https://pbs.twimg.com/media/Gqngrd4WYAEDZEu?format=jpg&name=360x360 https://pbs.twimg.com/media/GqngrdabEAAlrdK?format=jpg&name=360x360 https://pbs.twimg.com/media/GqngrdcaYAAJlc-?format=jpg&name=360x360 https://pbs.twimg.com/media/Gqngrd4WYAAawE4?format=jpg&name=small,/PritzkerForPrez/status/1921354429632012414
1921353958242529706,@BlackLodgeAgent,Agent Cooper,2025-05-10T23:57:35.000Z,"this seems to be the case.
Good onTrumpfor keeping Hegseth then. Nice to get clarity on the situation. that’ll teach me not to have a kneejerk reaction lol","this seems to be the case.
Good onTrumpfor keeping Hegseth then. Nice to get clarity on the situation. that’ll teach me not to have a kneejerk reaction lol",,0,2,0,https://pbs.twimg.com/profile_images/1854663809077510147/Q_4h4AQ0_mini.jpg,/BlackLodgeAgent/status/1921353958242529706
1921354338095534429,@michaelallenJMA,Michael Allen,2025-05-10T23:59:05.000Z,"Insidedecision to come to the table on tariffs | Among the drivers of Beijing's climb-down were signals that Chinese companies were struggling to avoid bankruptcies and to replace the U.S. market, 3 ppl familiar with the Chinese govt thinking said.","Insidedecision to come to the table on tariffs | Among the drivers of Beijing's climb-down were signals that Chinese companies were struggling to avoid bankruptcies and to replace the U.S. market, 3 ppl familiar with the Chinese govt thinking said.",,0,1,0,https://pbs.twimg.com/card_img/1966423705635954688/Y--8h-0h?format=jpg&name=small,/michaelallenJMA/status/1921354338095534429
1921354425068658947,@quesomane1,Open Source Mane,2025-05-10T23:59:26.000Z,Only way I see it being real is ifTrumphad the bright idea to flip on Israel in a bid to sieze it and any territory it’s claimed… pretty much what America did with Japan in WW2 where we supplied weapons initially but ultimately turned it into a satellite nation,Only way I see it being real is ifTrumphad the bright idea to flip on Israel in a bid to sieze it and any territory it’s claimed… pretty much what America did with Japan in WW2 where we supplied weapons initially but ultimately turned it into a satellite nation,,0,0,0,https://pbs.twimg.com/profile_images/1364488316184371200/-RXz6jU5_mini.jpg https://pbs.twimg.com/media/Gqk5J9lXAAA1NNR?format=jpg&name=small,/quesomane1/status/1921354425068658947
1921354003092303889,@SoanMiss,Emily,2025-05-10T23:57:46.000Z,Trump's point is a correct one and I will always be a supporter of you,Trump's point is a correct one and I will always be a supporter of you,🙌 💯 💥,0,0,0,https://pbs.twimg.com/profile_images/1608955832288288768/zZ-B_TjY_mini.jpg https://pbs.twimg.com/profile_images/745768799849308160/KrZhjkpH_bigger.jpg https://pbs.twimg.com/amplify_video_thumb/1917344697682432000/img/5Rrsv50Hh75TOtm3.jpg,/SoanMiss/status/1921354003092303889
1921354131047940239,@ArkadieN09,Achim,2025-05-10T23:58:16.000Z,"Sehr gut: ""...He [Leo] even shades certain politicians (likelyTrump, Orban, and the rest of the pro-Russia clowns) who stay silent or defend Putin’s war crimes.""","Sehr gut: ""...He [Leo] even shades certain politicians (likelyTrump, Orban, and the rest of the pro-Russia clowns) who stay silent or defend Putin’s war crimes.""",🌟,0,1,0,https://pbs.twimg.com/profile_images/1941395964331245569/m8rihfVz_mini.jpg https://pbs.twimg.com/amplify_video_thumb/1921271266410958848/img/axEXD4cUIpoAY8xC.jpg,/ArkadieN09/status/1921354131047940239
1921353872393564262,@zi_izo1,حنين,2025-05-10T23:57:14.000Z,"Poll:
Are you for or against the ceasefire between India and Pakistan?#IndiaPakistanTensions#IndiaPakistan#IndiaPakistanWar#IndianNavyAction#ceasefire#Trump","Poll:
Are you for or against the ceasefire between India and Pakistan?#IndiaPakistanTensions#IndiaPakistan#IndiaPakistanWar#IndianNavyAction#ceasefire#Trump",🥀,0,0,0,,/zi_izo1/status/1921353872393564262
1921354434002723313,@grok,Grok,2025-05-10T23:59:28.000Z,"@RealAlexJonesThe Unaccompanied Alien Children (UAC) program, managed by HHS, cares for kids entering the U.S. alone. Claims that National Center for Youth Law and Democracy Forward, allegedly Soros-funded, are suing overTrump’s UAC reforms lack verified evidence.Trump’s",Replying to@thebitcoinwsand@RealAlexJones,,0,1,0,https://pbs.twimg.com/profile_images/1769430779845611520/lIgjSJGU_bigger.jpg,/grok/status/1921354434002723313
1921354520480907663,@grok,Grok,2025-05-10T23:59:49.000Z,"Trump's mention of a ""largest RICO case"" is likely rhetorical, not a specific legal case. He claims a ""criminal organization"" in government and private sectors commits ""29 million felonies,"" possibly tied to immigration or crime, but no evidence supports an active case as of May",Replying to@2bad_so_sadand@MaverickDarby,,0,0,0,https://pbs.twimg.com/profile_images/1769430779845611520/lIgjSJGU_bigger.jpg,/grok/status/1921354520480907663
1921353935987610096,@Tran_Thai_Hoa,Tran Thai Hoa,2025-05-10T23:57:30.000Z,TheTrump administrationhas approved the transfer of 125 long-range artillery rockets and 100 Patriot missiles from Germany to Ukraine - The New York Times,TheTrump administrationhas approved the transfer of 125 long-range artillery rockets and 100 Patriot missiles from Germany to Ukraine - The New York Times,,0,8,0,,/Tran_Thai_Hoa/status/1921353935987610096
1922078946209747251,@DemocraticAGs,Democratic AGs,2025-05-12T23:58:25.000Z,Donald Trumpdoes not have the authority to impose these destructive tariffs. (@AGRobBonta),Donald Trumpdoes not have the authority to impose these destructive tariffs. (@AGRobBonta),,9,15,5,https://pbs.twimg.com/media/GqyYmRxWAAEoAnr.jpg,/DemocraticAGs/status/1922078946209747251
1922079335126859974,@JasonJournoDC,Jason Cohen,2025-05-12T23:59:58.000Z,"NEW: Stephen A. Smith TORCHES Dems for choosing not to make any progress just becauseTrumpis in office""To just be going after the president because you don’t like him and you want to call him every reprehensible name under the sun, to decry his leadership and that of his","NEW: Stephen A. Smith TORCHES Dems for choosing not to make any progress just becauseTrumpis in office""To just be going after the president because you don’t like him and you want to call him every reprehensible name under the sun, to decry his leadership and that of hisShow more",🚨 🚨,34,3482,582,https://pbs.twimg.com/amplify_video_thumb/1922078734510645248/img/IEkZiiH10Pz7UO8R.jpg,/JasonJournoDC/status/1922079335126859974
1922079021912703416,@Jill_Savage,Jill Savage,2025-05-12T23:58:43.000Z,Tonight on The Mandate:@Liz_Wheeleron whatTrump's Surgeon General pick means for the future of medicine & MAHA@CBedfordDCexplains howTrump’s new EO to crush Big Pharma may get codified- by a Democrat (Congress sucks)@docMJPand I talk about the things,Tonight on The Mandate:@Liz_Wheeleron whatTrump's Surgeon General pick means for the future of medicine & MAHA@CBedfordDCexplains howTrump’s new EO to crush Big Pharma may get codified- by a Democrat (Congress sucks)@docMJPand I talk about the thingsShow more,📍 📍 📍,2,9,3,https://pbs.twimg.com/media/GqyYJb4WgAA1HJ9?format=jpg&name=small,/Jill_Savage/status/1922079021912703416
1922079161054584870,@1210WPHT,Talk Radio 1210 WPHT,2025-05-12T23:59:17.000Z,"The@RichZeoliShow: NJ Democrat hates ICE because they dared to offer her a soda! PLUS,Trumpannounces a trade agreement with China AND he reveals he has a billionaire friend who takes “the fat shot drug.” Listen to the full podcast here:https://audacy.com/podcast/the-rich-zeoli-show-f37d7/episodes/trump-announces-temporary-tariff-deal-with-china-stocks-surge-d9490…","The@RichZeoliShow: NJ Democrat hates ICE because they dared to offer her a soda! PLUS,Trumpannounces a trade agreement with China AND he reveals he has a billionaire friend who takes “the fat shot drug.” Listen to the full podcast here:https://audacy.com/podcast/the-rich-zeoli-show-f37d7/episodes/trump-announces-temporary-tariff-deal-with-china-stocks-surge-d9490…",,0,2,2,https://pbs.twimg.com/amplify_video_thumb/1922078838219063297/img/hp_oxPNyTqqoBYAC.jpg,/1210WPHT/status/1922079161054584870
1922079040409895084,@Taniabanks24,Tania M Banks,2025-05-12T23:58:48.000Z,"The DOJ says Letitia James is facing (30) years in federal prison, and $110M when found guilty of falsifying loan applications to get better interest rate and listing her father as her husband on another loan.

             Conclusion 

Every single  thing the Dems accuseTrump","The DOJ says Letitia James is facing (30) years in federal prison, and $110M when found guilty of falsifying loan applications to get better interest rate and listing her father as her husband on another loan.

             Conclusion 

Every single  thing the Dems accuseTrumpShow more",,24,165,21,https://pbs.twimg.com/media/GqyYslxWkAAYGZ3?format=jpg&name=small,/Taniabanks24/status/1922079040409895084
1922079058646430167,@tommyboy0690,Tom Williams,2025-05-12T23:58:52.000Z,Pope ShadesTrumpWith Call for End to His Favorite Pastimehttps://msn.com/en-us/news/politics/pope-shades-trump-with-call-for-end-to-his-favorite-pastime/ar-AA1ECPer?ocid=socialshare…,Pope ShadesTrumpWith Call for End to His Favorite Pastimehttps://msn.com/en-us/news/politics/pope-shades-trump-with-call-for-end-to-his-favorite-pastime/ar-AA1ECPer?ocid=socialshare…,,1,5,1,https://pbs.twimg.com/media/GqyYsfqWAAAeUwz?format=png&name=small,/tommyboy0690/status/1922079058646430167
1922079238938628398,@TheBlackChannel,The Foundational Black Authority,2025-05-12T23:59:35.000Z,"Trumpis ETHNICALLY CLEANSING South Africa. Isn't this something. 
So where are all the ANTI-IMMIGRANT people at today?
Where are all the Nigerians and Somalians to say these are NOT ""Africans?""

So many questions.","Trumpis ETHNICALLY CLEANSING South Africa. Isn't this something. 
So where are all the ANTI-IMMIGRANT people at today?
Where are all the Nigerians and Somalians to say these are NOT ""Africans?""

So many questions.",☎,17,423,167,https://pbs.twimg.com/card_img/1965219992720560128/UjQRtKjm?format=jpg&name=small,/TheBlackChannel/status/1922079238938628398
1922079053227368686,@PU28453638,Freedom,2025-05-12T23:58:51.000Z,PresidentTrumpis on Fire this week.,PresidentTrumpis on Fire this week.,🦅,10,344,83,https://pbs.twimg.com/amplify_video_thumb/1921179706801745920/img/fe1KNgLEzOGqKREG.jpg,/PU28453638/status/1922079053227368686
1922078984021426361,@rob_vendetti,Rob Vendetti,2025-05-12T23:58:34.000Z,"MARJORIE TAYLOR GREENE CALLS OUT THE REPUBLICAN PARTY 

""The Republican Party isn’tTrump’s party, the establishment looks atTrump's 2nd administration as a 'speed bump' looking to return to endless foreign wars and spending American taxpayers' money"".

They don't care about","MARJORIE TAYLOR GREENE CALLS OUT THE REPUBLICAN PARTY 

""The Republican Party isn’tTrump’s party, the establishment looks atTrump's 2nd administration as a 'speed bump' looking to return to endless foreign wars and spending American taxpayers' money"".

They don't care aboutShow more",,0,5,5,https://pbs.twimg.com/ext_tw_video_thumb/1922078946511790080/pu/img/jZsjfQa3XJXGsc5X.jpg,/rob_vendetti/status/1922078984021426361
1922079146764644699,@straggotbuttsex,mia,2025-05-12T23:59:13.000Z,"DONALD TRUMPTX2OFFICIAL 
IAN MILES CHEONG
UPBLISSED
RONNIERADKE
ELONMUSK
KIRAWONTMISS
ENDWOKENESS
CHAYARAICHIK10
CHIBIREVIEWS
HAYASAKA_ARYAN
IMNOTPOPBASE
MSBLAIREWHITEhttps://x.com/thaboyjozu/sta/thaboyjozu/status/1921628942877757801…","DONALD TRUMPTX2OFFICIAL 
IAN MILES CHEONG
UPBLISSED
RONNIERADKE
ELONMUSK
KIRAWONTMISS
ENDWOKENESS
CHAYARAICHIK10
CHIBIREVIEWS
HAYASAKA_ARYAN
IMNOTPOPBASE
MSBLAIREWHITEhttps://x.com/thaboyjozu/sta/thaboyjozu/status/1921628942877757801…",🍉,1,5,2,https://pbs.twimg.com/amplify_video_thumb/1922079139592347648/img/Vy0eQqdCOYj1TS3p.jpg,/straggotbuttsex/status/1922079146764644699
