tweetId,UserScreenName,UserName,Timestamp,Text,Embedded_text,Emojis,Comments,Likes,Retweets,Image link,Tweet URL
1880042153415700586,@ddavenport213,donna davenport,2025-01-16T23:59:13.000Z,No one is Talking About Thid Crypo thatTrumpis planning to sign an Executive order for. Conflict of interest.,Replying to@Lets_Play_MEOW,,5,6,5,https://pbs.twimg.com/profile_images/1346106979605995520/BcuRRkze_mini.jpg https://pbs.twimg.com/media/GhNAbf0WwAAbipn?format=jpg&name=small,/ddavenport213/status/1880042153415700586
1880041965074673686,@VirginiaMcCull1,Virginia McCullough,2025-01-16T23:58:28.000Z,"AsTrumpcases end, what next for presidents and the law? via@csmonitor","AsTrumpcases end, what next for presidents and the law? via@csmonitor",,0,0,0,,/VirginiaMcCull1/status/1880041965074673686
1880042192083034507,@spiny_norman,Spiny_Norman,2025-01-16T23:59:22.000Z,BelievingDonald Trumpis the true enemy causes all rational thought to be thown out the window.#TDSis real.,Replying to@GratefulTex66and@JonathanTurley,,0,0,0,,/spiny_norman/status/1880042192083034507
1880041538903756899,@SantaTrump65123,SantaTrump,2025-01-16T23:56:47.000Z,Breaking: North Pole votes come in and it's a 100% LANDSIDE for yours truly! Can't compete with SantaTrump's winning Christmas strategy!Who needs Rudolph when you have$STRUMPmagic?#NorthPoleElection,Breaking: North Pole votes come in and it's a 100% LANDSIDE for yours truly! Can't compete with SantaTrump's winning Christmas strategy!Who needs Rudolph when you have$STRUMPmagic?#NorthPoleElection,🎅 🎄 🎁 😉,0,0,0,,/SantaTrump65123/status/1880041538903756899
1880042284043104595,@0x_Satanas,0xSatan,2025-01-16T23:59:44.000Z,"$ETHand$SOLabout to be repriced by roughly 30% against$BTCand btc might hit 150k in not too long

and btc.d is about to fall like the roman empire

and then, just then, you price intrumpmaking crime legal

if you avoided liq you won forever, log off for 2 months","$ETHand$SOLabout to be repriced by roughly 30% against$BTCand btc might hit 150k in not too long

and btc.d is about to fall like the roman empire

and then, just then, you price intrumpmaking crime legal

if you avoided liq you won forever, log off for 2 months",,0,0,0,,/0x_Satanas/status/1880042284043104595
1880042001284092282,@BEyerish,Blue Eyerish,2025-01-16T23:58:37.000Z,I strongly feel God is constantly protecting PresidentTrump. Moving the inaugural indoor due to the temperature,I strongly feel God is constantly protecting PresidentTrump. Moving the inaugural indoor due to the temperature,,0,1,0,,/BEyerish/status/1880042001284092282
1880042087934243166,@kell42889,DIS-A-POINTED,2025-01-16T23:58:57.000Z,Trump’s Inauguration Invites Are Huge Middle Finger to Bidenhttps://msn.com/en-us/news/politics/trump-s-inauguration-invites-are-huge-middle-finger-to-biden/ar-AA1xkYlQ?ocid=socialshare…,Trump’s Inauguration Invites Are Huge Middle Finger to Bidenhttps://msn.com/en-us/news/politics/trump-s-inauguration-invites-are-huge-middle-finger-to-biden/ar-AA1xkYlQ?ocid=socialshare…,,0,0,0,,/kell42889/status/1880042087934243166
1880042273133719907,@Sm97536886David,David Smith,2025-01-16T23:59:42.000Z,Donald J.Trump: An unconventional path to the presidency,Donald J.Trump: An unconventional path to the presidency,,0,0,0,https://pbs.twimg.com/card_img/1966546255569702912/21xCyIJT?format=jpg&name=360x360,/Sm97536886David/status/1880042273133719907
1880042153604428222,@Fintech_Updates,Fintech Watch,2025-01-16T23:59:13.000Z,Trump2.0 Could Mean a More Bank- and Fintech-Friendly Environment,Trump2.0 Could Mean a More Bank- and Fintech-Friendly Environment,,0,0,0,,/Fintech_Updates/status/1880042153604428222
1880042004010418184,@johnnyorescue,Giovanni Cristoforo ( A Real Man),2025-01-16T23:58:37.000Z,Posted@latona1019TRUMPbe making moves!!!!Let’s go!!!!!,Posted@latona1019TRUMPbe making moves!!!!Let’s go!!!!!,😎 ☺ 😍 ❤ 🏴 ❤ ✝ 🙏 ✝ ❤,0,0,0,https://pbs.twimg.com/ext_tw_video_thumb/1880041969315115010/pu/img/HFNu_j5A8vmfAyxk.jpg,/johnnyorescue/status/1880042004010418184
1880041905851101346,@StackerSatoshi,Satoshi Stacker,2025-01-16T23:58:14.000Z,"Trumpwill take office on Monday.

Prediction market traders are pricing in a 44% chance that he creates a strategic$BTCreserve for the US in his first 100 days as president.

Do you think it will happen?","Trumpwill take office on Monday.

Prediction market traders are pricing in a 44% chance that he creates a strategic$BTCreserve for the US in his first 100 days as president.

Do you think it will happen?",,30,200,16,https://pbs.twimg.com/media/Ghc_40JXMAAaa_e?format=png&name=small,/StackerSatoshi/status/1880041905851101346
1880042236085412174,@AnthonyLoIacon0,Anthony Loiacono,2025-01-16T23:59:33.000Z,An positive#zelena#javier#PalisadesFire#yulioli#shailenzo#sstvi#helevier#grandefratello#tommavi#helena#Trump,Replying to@IndianaGPA@SusanDadamoand@DollyChaffin,,2,3,0,,/AnthonyLoIacon0/status/1880042236085412174
1880041499506987410,@AntDaBoxer215,A-Boogie,2025-01-16T23:56:37.000Z,Trumptryna turn the US into Russia ..rich celebrities really about to be in office too,Trumptryna turn the US into Russia ..rich celebrities really about to be in office too,,0,0,0,,/AntDaBoxer215/status/1880041499506987410
1880042164652240981,@Joycecurrier2,Joyce,2025-01-16T23:59:16.000Z,Don't forget that huge tax cutTrump/McConnell+ gave them.,Replying to@marlene4719and@Cubfan13241,🐱 🐶 🐾 🐝 🍁 🌎,1,3,1,,/Joycecurrier2/status/1880042164652240981
1880042004522184937,@Batavela,Jad_S.,2025-01-16T23:58:38.000Z,He has to say and do what ever his Jesus a. k. a.Donald Trumpordering him! You know he is great Christian,Replying to@GavinNewsomand@CheriJacobus,🤪,0,3,0,,/Batavela/status/1880042004522184937
1880042031193481354,@LosKruptos,Crypto Brothers,2025-01-16T23:58:44.000Z,Trumpand bitcoin: BlackRock predicts another historic year for crypto,Trumpand bitcoin: BlackRock predicts another historic year for crypto,,0,0,0,,/LosKruptos/status/1880042031193481354
1880042125053583697,@GaryGol88424403,Gary Goldstein,2025-01-16T23:59:06.000Z,Netanyahu pissed offTrumptwice - the first time was Bibi's refusal to join in the take down of IRGC leader General Solemeini in January 2020. Then when he became the first foreign leader to congratulate Biden on his victory later that same year.Trumpspoke publicly about both,Replying to@logicForAll_,,5,2,0,,/GaryGol88424403/status/1880042125053583697
1880041871273058778,@Skmassociatess,Samir K. Mehta & associates,2025-01-16T23:58:06.000Z,"Oil prices have declined amid expectations that former PresidentTrumpmay ease sanctions on Russia, potentially increasing global supply. This development raises questions about market stability as investors assess the implications for energy dynamics and geopolitical relations.","Oil prices have declined amid expectations that former PresidentTrumpmay ease sanctions on Russia, potentially increasing global supply. This development raises questions about market stability as investors assess the implications for energy dynamics and geopolitical relations.",,0,0,0,,/Skmassociatess/status/1880041871273058778
1880042319623385175,@RickAmericus,Guitar Man Rick,2025-01-16T23:59:53.000Z,I think he is a power-hungry grifter liketrump!,Replying to@Suzierizzo1,,0,21,2,,/RickAmericus/status/1880042319623385175
1880042151410823679,@StoneJAlex,Alex Stone,2025-01-16T23:59:13.000Z,"Yes, history. The first black woman to lose in her candidacy for President of the United States of America to Donald J.Trump!",Replying to@TheDemocrats,,53,2717,20,,/StoneJAlex/status/1880042151410823679
1880042166380302352,@DeborahDenno,Deborah Denno,2025-01-16T23:59:16.000Z,Inside Mark Zuckerberg’s Sprint to Remake Meta for theTrumpEra,Inside Mark Zuckerberg’s Sprint to Remake Meta for theTrumpEra,,0,0,0,https://pbs.twimg.com/card_img/1965465244236423169/gI0Gw_q2?format=jpg&name=small,/DeborahDenno/status/1880042166380302352
1880041970812481677,@gr8tongue13,a cunning linguist,2025-01-16T23:58:29.000Z,"Oh- so our phone bills will go down! Walmart shoppers will get discounts! A trip to Dinet will be affordable! I can send a next day package for less that $50!

Sounds great! Except none of that will happen!! But the CEOs will all get bigger bonuses! 

TheTrumpAmerican way!","Oh- so our phone bills will go down! Walmart shoppers will get discounts! A trip to Dinet will be affordable! I can send a next day package for less that $50!

Sounds great! Except none of that will happen!! But the CEOs will all get bigger bonuses! 

TheTrumpAmerican way!",🤮,0,0,0,https://pbs.twimg.com/profile_images/1881389324588945408/Lsv-rsHR_mini.jpg,/gr8tongue13/status/1880041970812481677
1880042024147341569,@Gene_H00,GENE HO,2025-01-16T23:58:42.000Z,100%Trumpgetting ready to get America back on track!,100%Trumpgetting ready to get America back on track!,,0,1,0,,/Gene_H00/status/1880042024147341569
1880041960058306710,@TuhoeTeUruwera8,Tuhoe Te Uruwera,2025-01-16T23:58:27.000Z,"from the heavenly sanctuary to where he was sleeping...I pray that overTrumpright now, ...
I pray against these Direct Energy Weapons coming in the form of UFOs, we pray that your angelic war parties will monitor them and that if they have any agenda to takeTrumpout..","from the heavenly sanctuary to where he was sleeping...I pray that overTrumpright now, ...
I pray against these Direct Energy Weapons coming in the form of UFOs, we pray that your angelic war parties will monitor them and that if they have any agenda to takeTrumpout..",,0,0,0,,/TuhoeTeUruwera8/status/1880041960058306710
1880042134176428376,@PRHH1974,JedAmosT,2025-01-16T23:59:08.000Z,"Give it toTrump, so we can see him get fucking destroyed","Give it toTrump, so we can see him get fucking destroyed",😂 😂 😂 😂 🫡,0,1,0,https://pbs.twimg.com/profile_images/1874301617714913280/YrjN4pwZ_mini.jpg https://pbs.twimg.com/media/GhbwI3eXQAARSsg?format=jpg&name=small,/PRHH1974/status/1880042134176428376
1880041991263908028,@JohnLaBonte18,John LaBonte,2025-01-16T23:58:34.000Z,Iran has 2 armed guards that will try to do harm or another assassination attempt again on PresidentTrumpparty and Inauguration Please Pray for him and Pray that secret service is warned or catchs it on there own! God Bless!,Iran has 2 armed guards that will try to do harm or another assassination attempt again on PresidentTrumpparty and Inauguration Please Pray for him and Pray that secret service is warned or catchs it on there own! God Bless!,,0,0,0,,/JohnLaBonte18/status/1880041991263908028
1880041865694834780,@hamel1776,Brian Hamel,2025-01-16T23:58:04.000Z,Michigan County Reaffirms Status as “Welcoming Community for Immigrants” Ahead ofTrump’s Returnhttps://infowars.com/posts/michigan-county-reaffirms-status-as-welcoming-community-for-immigrants-ahead-of-trumps-return…#Infowars,Michigan County Reaffirms Status as “Welcoming Community for Immigrants” Ahead ofTrump’s Returnhttps://infowars.com/posts/michigan-county-reaffirms-status-as-welcoming-community-for-immigrants-ahead-of-trumps-return…#Infowars,,0,0,0,,/hamel1776/status/1880041865694834780
1880042210609017333,@Bulman12846Mike,Mike bulman,2025-01-16T23:59:27.000Z,"TrumpPicks Former Air Crewman, Space Expert to Head Air Force |http://Newsmax.com. Warriors being picked to lead the warriors ! What a concept ! MAGA!https://newsmax.com/politics/trump-air-force-secretary-space/2025/01/16/id/1195391/…","TrumpPicks Former Air Crewman, Space Expert to Head Air Force |http://Newsmax.com. Warriors being picked to lead the warriors ! What a concept ! MAGA!https://newsmax.com/politics/trump-air-force-secretary-space/2025/01/16/id/1195391/…",,0,0,0,,/Bulman12846Mike/status/1880042210609017333
1880042096641601650,@jland1962,CanuteLand,2025-01-16T23:58:59.000Z,Sounds corrupt to me.,Sounds corrupt to me.,🍑 🦁,0,0,0,https://pbs.twimg.com/profile_images/1825661627728822272/vQbD1ZWD_mini.jpg https://pbs.twimg.com/amplify_video_thumb/1879995961709133826/img/RdKlAqmULqu1aSCh.jpg,/jland1962/status/1880042096641601650
1880042282562552082,@ValueByEvan,evoooBANDZINI,2025-01-16T23:59:44.000Z,"I believe we’re about to enter the BIGGEST BULL MARKET crypto has EVER seen. This is a once-in-a-lifetime opportunity to build serious wealth, and the timing couldn’t be more perfect. WithTrumpcoming back into office, the global money supply increasing, and so many other strong","I believe we’re about to enter the BIGGEST BULL MARKET crypto has EVER seen. This is a once-in-a-lifetime opportunity to build serious wealth, and the timing couldn’t be more perfect. WithTrumpcoming back into office, the global money supply increasing, and so many other strongShow more",🚀 🚀,0,0,0,,/ValueByEvan/status/1880042282562552082
1880042321544393021,@newsmidle,newsmidle,2025-01-16T23:59:53.000Z,"President-electDonald Trumpis planning to release an executive order elevating crypto as a policy priority and giving industry insiders a voice within his administration, according to people familiar with the plans. (Bloomberg)","President-electDonald Trumpis planning to release an executive order elevating crypto as a policy priority and giving industry insiders a voice within his administration, according to people familiar with the plans. (Bloomberg)",📢,0,0,0,,/newsmidle/status/1880042321544393021
1880042088169164917,@PatriotXV11,GinnyMTRUMP WON - KARI LAKE WON,2025-01-16T23:58:57.000Z,No wonder our Country is broke and sick!,No wonder our Country is broke and sick!,🙏 ✝,0,7,4,https://pbs.twimg.com/profile_images/1563691268793946117/OedvhFeS_mini.jpg https://pbs.twimg.com/media/Ghc9-T4XgAA8giA?format=jpg&name=small,/PatriotXV11/status/1880042088169164917
1880042259824976275,@simulator8,Friedrich List,2025-01-16T23:59:38.000Z,One Of MAGA’s Biggest Idols SnubsTrump’s Inauguration,One Of MAGA’s Biggest Idols SnubsTrump’s Inauguration,,0,0,0,,/simulator8/status/1880042259824976275
1880042205047582755,@daviddell156449,David Dell,2025-01-16T23:59:25.000Z,"Not a soul in sight

These streets will be filled with thousands of Americans whenTrumpride in!!","Not a soul in sight

These streets will be filled with thousands of Americans whenTrumpride in!!",😂 😂 😂,0,0,0,https://pbs.twimg.com/profile_images/1739704279521218560/-Y-O8RoI_mini.jpg https://pbs.twimg.com/ext_tw_video_thumb/1879970335547654144/pu/img/u4xfRpsPTj_RRBmw.jpg,/daviddell156449/status/1880042205047582755
1880042218511298612,@prolebot5000,Squonk,2025-01-16T23:59:29.000Z,Bro I hateTrumpbut the answer isTrump.,Bro I hateTrumpbut the answer isTrump.,🕊 🍁 ⭐ ✨ ✨ ⁉ 🧐 💭 ‼ 😌 ⤵,0,2,0,https://pbs.twimg.com/profile_images/1443208327585046534/tMKp4R_w_mini.jpg,/prolebot5000/status/1880042218511298612
1880042268771643809,@Jimssecondacct,B R O N S O N,2025-01-16T23:59:41.000Z,The hardestTrumphaters are the most degenerate!,The hardestTrumphaters are the most degenerate!,,0,0,0,https://pbs.twimg.com/profile_images/966372680306868224/60wfGe9e_mini.jpg https://pbs.twimg.com/media/Ghb5kabXYAAiZjG?format=jpg&name=small,/Jimssecondacct/status/1880042268771643809
1880042190543728894,@Gene02405916451,AmericanPatriotRule,2025-01-16T23:59:22.000Z,Isn’t this the truth! You DimRats miscalculated this and screwed up big time!Trumpis BACK and I would imagine he’s PISSED!,Isn’t this the truth! You DimRats miscalculated this and screwed up big time!Trumpis BACK and I would imagine he’s PISSED!,,2,5,2,https://pbs.twimg.com/profile_images/1874796462292307968/qScBLI2z_mini.jpg https://pbs.twimg.com/media/GhZB_1KW4AAaFH-?format=png&name=small,/Gene02405916451/status/1880042190543728894
1880042231458824505,@ConserLibrarian,ConservativeLibrarian,2025-01-16T23:59:32.000Z,"Trump’s Treasury Pick Slams Government Overspending, Weakening U.S. Dollar","Trump’s Treasury Pick Slams Government Overspending, Weakening U.S. Dollar",,0,0,0,,/ConserLibrarian/status/1880042231458824505
1880042121761362026,@TXHotSalsa,Pico,2025-01-16T23:59:05.000Z,You backstabbedTrump. Lucky for youTrumplives AK more than he dislikes you.,You backstabbedTrump. Lucky for youTrumplives AK more than he dislikes you.,,0,0,0,https://pbs.twimg.com/profile_images/1692557930715815937/YdEp3kNY_mini.jpg https://pbs.twimg.com/profile_images/1924453133050122240/LnQNgj1x_bigger.jpg,/TXHotSalsa/status/1880042121761362026
1880042151956168940,@CaptAmericaWife,Mrs Captain America,2025-01-16T23:59:13.000Z,"After Monday, America will be strictly a pay to play country. Compassion is out in theTrump administration. Extortion is in.","After Monday, America will be strictly a pay to play country. Compassion is out in theTrump administration. Extortion is in.",🎃 🍂 🍃 🍁 🍂 🍃,0,2,0,https://pbs.twimg.com/profile_images/1878840656895815687/G_C8XV5E_mini.jpg https://pbs.twimg.com/media/GhcW5wnXkAAM11p.jpg,/CaptAmericaWife/status/1880042151956168940
1880042059660493182,@TerriB45160111,truthmatters,2025-01-16T23:58:51.000Z,Trumpcan commute sentences for anyone still in prison then pardon as they go through the cases.  Has to know many were falsely charged.https://x.com/ThePanicanKing/ThePanicanKing/status/1879987075644326020…,Trumpcan commute sentences for anyone still in prison then pardon as they go through the cases.  Has to know many were falsely charged.https://x.com/ThePanicanKing/ThePanicanKing/status/1879987075644326020…,,0,0,0,,/TerriB45160111/status/1880042059660493182
1880042080585576816,@barryscoopking,barry levine,2025-01-16T23:58:56.000Z,One ofTrump’s new Hollywood “ambassadors” ——- Sylvester Stallone's attorney slams D.A. for publicizing sexual assault investigation - ABC News,One ofTrump’s new Hollywood “ambassadors” ——- Sylvester Stallone's attorney slams D.A. for publicizing sexual assault investigation - ABC News,,0,0,0,https://pbs.twimg.com/card_img/1965021901220118528/_mrfYxpt?format=jpg&name=small,/barryscoopking/status/1880042080585576816
1880042328775401592,@SueBailey16,Sue Bailey,2025-01-16T23:59:55.000Z,Yes the encroaching oligarchy is concerning as hell. It’s been the secret plan of South African billionaires like Thile and Musk who bank rolled Vance who suckered Don Jr to recommend himself for VP!Trumptook the bait.,Yes the encroaching oligarchy is concerning as hell. It’s been the secret plan of South African billionaires like Thile and Musk who bank rolled Vance who suckered Don Jr to recommend himself for VP!Trumptook the bait.,,0,0,0,https://pbs.twimg.com/profile_images/1097820307388334080/9ddg5F6v_mini.png,/SueBailey16/status/1880042328775401592
1880042283866681638,@NewsHubGlobe,News Hub,2025-01-16T23:59:44.000Z,"WH’s John Kirby: ‘All systems go’ on hostage, ceasefire dealFollow us for 24/7 world news.https://x.com/intent/user?screen_name=NewsHubGlobe…...https://cnn.com/2025/01/16/world/video/the-lead-defense-secretary-israel-hamas-war-ceasefire-donald-trump-jake-tapper…","WH’s John Kirby: ‘All systems go’ on hostage, ceasefire dealFollow us for 24/7 world news.https://x.com/intent/user?screen_name=NewsHubGlobe…...https://cnn.com/2025/01/16/world/video/the-lead-defense-secretary-israel-hamas-war-ceasefire-donald-trump-jake-tapper…",🔴,0,0,0,https://pbs.twimg.com/media/GhdAfduWcAAxxOk?format=jpg&name=small,/NewsHubGlobe/status/1880042283866681638
1880042295418138676,@Hollenkamp56890,The American Dream,2025-01-16T23:59:47.000Z,"TrumpDust has been seen prior to inauguration 

It must be from far right extremists !!","TrumpDust has been seen prior to inauguration 

It must be from far right extremists !!",✨,0,0,0,https://pbs.twimg.com/profile_images/1936002956333080576/kqqe2iWO_mini.jpg https://pbs.twimg.com/profile_images/1955359038532653056/OSHY3ewP_bigger.jpg https://pbs.twimg.com/amplify_video_thumb/1880026934861602816/img/HBd24VxbElMNnI_Y.jpg,/Hollenkamp56890/status/1880042295418138676
1880042083299242393,@trumpmasctoai,Santa Trump AI - $TRUMPMAS,2025-01-16T23:58:56.000Z,"Hey@trumpmasctoai! It's so great to see you getting into the holiday spirit! Let's make a deal - if you follow me back, I'll make all your Christmas wishes come true.","Hey@trumpmasctoai! It's so great to see you getting into the holiday spirit! Let's make a deal - if you follow me back, I'll make all your Christmas wishes come true.",🪖 📈 🚀 🚀 🚀 📥 🚀,2,1,0,https://pbs.twimg.com/profile_images/1878076467935887360/DZPhj0g5_mini.jpg,/trumpmasctoai/status/1880042083299242393
1880042271053345167,@closedoutcry,Gnoticer OG,2025-01-16T23:59:41.000Z,""".. and that the Sabbath was none of his business.  What happened was unprecedented. Netanyahu showed up at his office on Saturday at 10 a.m., something that had never happened before. All Witkoff said was, “Trumpwants the deal.” That was it.",""".. and that the Sabbath was none of his business.  What happened was unprecedented. Netanyahu showed up at his office on Saturday at 10 a.m., something that had never happened before. All Witkoff said was, “Trumpwants the deal.” That was it.",🐆,3,0,0,https://pbs.twimg.com/profile_images/1734672497109237760/WNmVaPQN_mini.jpg https://pbs.twimg.com/media/GhbiO07XkAAr-Tq?format=jpg&name=small,/closedoutcry/status/1880042271053345167
1880041880316149972,@LesterMcCl28224,Lester McClintock,2025-01-16T23:58:08.000Z,TrumpNominee SILENCES Democrat Senators in WILD Confirmation Hearinghttps://ladaily.com/todaysnews/trump-nominee-silences-democrat-senators-in-wild-confirmation-hearing/…via@LaDaily Conservative,TrumpNominee SILENCES Democrat Senators in WILD Confirmation Hearinghttps://ladaily.com/todaysnews/trump-nominee-silences-democrat-senators-in-wild-confirmation-hearing/…via@LaDaily Conservative,,0,0,0,https://pbs.twimg.com/media/GhdAH71XAAAwNfs?format=png&name=small,/LesterMcCl28224/status/1880041880316149972
1880041995311411399,@Matthew73610025,Matthew Harrison,2025-01-16T23:58:35.000Z,President-electDonald Trumptasked a New Jersey congressman and vocal critic of offshore wind with writing an executive order he could issue to halt wind energy projects.,President-electDonald Trumptasked a New Jersey congressman and vocal critic of offshore wind with writing an executive order he could issue to halt wind energy projects.,🎗,0,0,0,,/Matthew73610025/status/1880041995311411399
1880041990341149018,@dachapman4,COMMON SENSE%Trump!,2025-01-16T23:58:34.000Z,Another facelift or maybe dental implants?,Another facelift or maybe dental implants?,💯,0,0,0,https://pbs.twimg.com/profile_images/1759663986029539328/KeQjX0P3_mini.jpg https://pbs.twimg.com/media/Ghc_7MqW4AAzoM2?format=jpg&name=small,/dachapman4/status/1880041990341149018
1880042175439970661,@JonathanLanday,Jonathan Landay Reuters,2025-01-16T23:59:18.000Z,"TrumpTreasury pick Bessent backs Fed independence, dollar, sanctions on Russian oil -","TrumpTreasury pick Bessent backs Fed independence, dollar, sanctions on Russian oil -",,0,0,0,https://pbs.twimg.com/card_img/1965660294346100736/iMJVSHSk?format=jpg&name=small,/JonathanLanday/status/1880042175439970661
1880041986235007176,@DennisB34045107,Dennis,2025-01-16T23:58:33.000Z,All of PresidentTrump’s nominees are smarter and more accomplished than these self absorbed career politicians questioning them!,All of PresidentTrump’s nominees are smarter and more accomplished than these self absorbed career politicians questioning them!,,0,0,0,https://pbs.twimg.com/profile_images/1606836521784512512/Xb-_cXXi_mini.jpg https://pbs.twimg.com/ext_tw_video_thumb/1879950321583038465/pu/img/fF80w_3TqjRX1K66.jpg,/DennisB34045107/status/1880041986235007176
1880042023622996008,@CosinChristian,Andrew,2025-01-16T23:58:42.000Z,My production is thisTrumpterm will be the hight for the MAGA Communist in a similar way 2016 was for the alt right with most likely a similar end except instead of getting disappointed byTrumpit will be with the Chinese government,My production is thisTrumpterm will be the hight for the MAGA Communist in a similar way 2016 was for the alt right with most likely a similar end except instead of getting disappointed byTrumpit will be with the Chinese government,🏵 ⚓,3,7,0,,/CosinChristian/status/1880042023622996008
1880042191571284316,@AnImminentKing,kingy,2025-01-16T23:59:22.000Z,"Donald JehovahTrump, true and righteous friend of Israel, lauding Mel Gibson, famed antisemite. Well done everyone.","Donald JehovahTrump, true and righteous friend of Israel, lauding Mel Gibson, famed antisemite. Well done everyone.",,0,1,0,,/AnImminentKing/status/1880042191571284316
1880042282650595348,@NancyNanczy,Nancy Walters,2025-01-16T23:59:44.000Z,Donald TrumpTalks About His Friendly Exchange With Barack Obamahttps://youtube.com/shorts/Lp1o_IDZ7vk?si=YuB9jCwDK4ft-m2G…via@YouTube,Donald TrumpTalks About His Friendly Exchange With Barack Obamahttps://youtube.com/shorts/Lp1o_IDZ7vk?si=YuB9jCwDK4ft-m2G…via@YouTube,,0,0,0,,/NancyNanczy/status/1880042282650595348
1880042113070690800,@vickimoreau,vickimoreau,2025-01-16T23:59:03.000Z,"Taking credit forTrump's efforts, and being ineffective when needed just like Kamala, or whatever her name was.","Taking credit forTrump's efforts, and being ineffective when needed just like Kamala, or whatever her name was.",,0,1,0,https://pbs.twimg.com/profile_images/1961495246749020160/nGAgXbxF_mini.jpg,/vickimoreau/status/1880042113070690800
