tweetId,UserScreenName,UserName,Timestamp,Text,Embedded_text,Emojis,Comments,Likes,Retweets,Image link,Tweet URL
1880268582283804784,@Timcast,Tim Pool,2025-01-17T14:58:58.000Z,"DEBATE: MAGA vs Democrats,Trump's Agenda vs Biden's Legacy | The Culture War with Tim Pool","DEBATE: MAGA vs Democrats,Trump's Agenda vs Biden's Legacy | The Culture War with Tim Pool",,92,404,69,https://pbs.twimg.com/profile_images/1952496567853658112/80xjOjwx_bigger.jpg https://pbs.twimg.com/card_img/1965880627753881600/EloNqj9_?format=jpg&name=240x240,/Timcast/status/1880268582283804784
1880404605953360173,@tmossboss,FOG TMossBoss,2025-01-17T23:59:28.000Z,"In case nobody has said it today,TrumpSupporters are toxic.","In case nobody has said it today,TrumpSupporters are toxic.",,0,0,0,,/tmossboss/status/1880404605953360173
1880404449413206332,@bmcdowelrn,Beth McDowell RN,2025-01-17T23:58:51.000Z,From Butler ToTrump: A Case For Streamlining The Secret Service – American Liberty Newshttps://americanliberty.news/commentary/from-butler-to-trump-a-case-for-streamlining-the-secret-service/amuse/2025/01/…,From Butler ToTrump: A Case For Streamlining The Secret Service – American Liberty Newshttps://americanliberty.news/commentary/from-butler-to-trump-a-case-for-streamlining-the-secret-service/amuse/2025/01/…,,0,0,0,,/bmcdowelrn/status/1880404449413206332
1880404699460837489,@BoomerG2892,CMG$$,2025-01-17T23:59:51.000Z,"What???! A database to track former Biden appointees cashing in on their government connections? Genius. ‘http://InsideBidensBasement.org’—finally, a place to keep tabs on the swamp rats as they scurry back to their special interests.Trump’s not just draining the swamp; he’s building a",Replying to@CollinRugg,,1,60,25,https://pbs.twimg.com/card_img/1965210666458836992/B5Q1c38p?format=png&name=360x360,/BoomerG2892/status/1880404699460837489
1880404709657440724,@PaulusMcNaulus,Paul Phillips,2025-01-17T23:59:53.000Z,Trumptreasury pick's 'magical and paper-thin' economic plan torn to shreds by columnist,Trumptreasury pick's 'magical and paper-thin' economic plan torn to shreds by columnist,,0,0,0,,/PaulusMcNaulus/status/1880404709657440724
1880404263911997916,@Vince_Noir77,Nabootique,2025-01-17T23:58:07.000Z,This is literally America fighting back against DEI underTrump.,Replying to@SteveInmanUIC,,14,697,7,,/Vince_Noir77/status/1880404263911997916
1880404230298841435,@jakatak4,Jack Scalfani,2025-01-17T23:57:59.000Z,"Headlines: 
1. Monday’sTrumpinauguration indoors
2.Cowboys are hunting for new HC
3. Arctic Weather coming Sun/Mon so be prepared with batteries, food and a good heat source.","Headlines: 
1. Monday’sTrumpinauguration indoors
2.Cowboys are hunting for new HC
3. Arctic Weather coming Sun/Mon so be prepared with batteries, food and a good heat source.",,1,1,0,,/jakatak4/status/1880404230298841435
1880404564530037192,@leeboggs,Lee Boggs,2025-01-17T23:59:19.000Z,"BREAKING NEWS

Per Grok, PresidentTrump's Inauguration has been moved indoors due to dangerously low temperatures projected in Washington, D.C., with forecasts indicating severe cold and an Arctic blast sweeping the country.

This decision mirrors the precedent set by President","BREAKING NEWS

Per Grok, PresidentTrump's Inauguration has been moved indoors due to dangerously low temperatures projected in Washington, D.C., with forecasts indicating severe cold and an Arctic blast sweeping the country.

This decision mirrors the precedent set by PresidentShow more",,0,1,0,https://pbs.twimg.com/profile_images/1966875254631940096/pjQUsc8a_mini.jpg https://pbs.twimg.com/media/GheQbrrW0AAu-uS?format=jpg&name=small,/leeboggs/status/1880404564530037192
1880404169959567531,@BrotherRoop,Brother Roop,2025-01-17T23:57:44.000Z,Trumpmoves inauguration inside due to cold temperatures | Watch full video at,Trumpmoves inauguration inside due to cold temperatures | Watch full video at,,0,0,0,,/BrotherRoop/status/1880404169959567531
1880404216721846587,@RobRobbEdwards,Robb Edwards,2025-01-17T23:57:56.000Z,TrumpReadies 'Day One Climate Destruction Package' After Raking in Big Oil Cash,TrumpReadies 'Day One Climate Destruction Package' After Raking in Big Oil Cash,🌱,1,1,4,https://pbs.twimg.com/card_img/1967240269100982273/lf4_FlVY?format=jpg&name=small,/RobRobbEdwards/status/1880404216721846587
1880404585283793167,@Farshcrypto,"F A R S H (,)",2025-01-17T23:59:24.000Z,All these people trying to say Biden is responsible bringing about ceasefire like we are idiots!!!! Ceasefire comes in 3 days beforetrumpgets in!!! Only the dumbest of the dumb would believe Biden did anything he can’t couldn’t even speak 6 months ago lolllll,All these people trying to say Biden is responsible bringing about ceasefire like we are idiots!!!! Ceasefire comes in 3 days beforetrumpgets in!!! Only the dumbest of the dumb would believe Biden did anything he can’t couldn’t even speak 6 months ago lolllll,😹 🫵,0,1,0,,/Farshcrypto/status/1880404585283793167
1880404370497630315,@Mardroid,Mardroid,2025-01-17T23:58:32.000Z,PRESIDENTDONALD TRUMPWILL SAVE TIKTOK. TRUMPTOK INBOUND.$TT,Replying to@TeTheGamer,,1,7,0,https://pbs.twimg.com/profile_images/1890167600623075328/78A0_Npk_bigger.jpg https://pbs.twimg.com/media/GhiJzyZWMAA_Pxm?format=jpg&name=small,/Mardroid/status/1880404370497630315
1880404387878879394,@kk131066,KK_10,2025-01-17T23:58:36.000Z,"There is no greater trademark of#Fascismthan#genocideThese MFs are no longer afraid to show their true#fascistcolors

Those who consent to#GazaGenocide- keep your fucking genocidal mouths shut#Trump#Biden#Israel#WarCrimes#Palestine#Gaza#HumanRights#Truth#facts","There is no greater trademark of#Fascismthan#genocideThese MFs are no longer afraid to show their true#fascistcolors

Those who consent to#GazaGenocide- keep your fucking genocidal mouths shut#Trump#Biden#Israel#WarCrimes#Palestine#Gaza#HumanRights#Truth#facts",,0,1,3,https://pbs.twimg.com/media/GhiIbWjacAA_vKK?format=png&name=small,/kk131066/status/1880404387878879394
1880404734936481936,@ameliacroweherb,Aimz,2025-01-17T23:59:59.000Z,"As far as I'm concerned, the ceasefire deal is to free the Biba's children beforeTrump's inauguration & well, after that, if Hamas deviate, nuke the cunts!","As far as I'm concerned, the ceasefire deal is to free the Biba's children beforeTrump's inauguration & well, after that, if Hamas deviate, nuke the cunts!",🥝,0,0,0,,/ameliacroweherb/status/1880404734936481936
1880404266294337676,@LKennedyMcQuain,Lynette Kennedy McQuain,2025-01-17T23:58:07.000Z,"Trumpwill be inside, but who is protecting outside?@DanScavinosome weird things.  Who will be protecting all that come, the Good bad or ugly?

Anyone trust DC in protection?

It's all getting a bit suspicious with police in DC saying their not coming?","Trumpwill be inside, but who is protecting outside?@DanScavinosome weird things.  Who will be protecting all that come, the Good bad or ugly?

Anyone trust DC in protection?

It's all getting a bit suspicious with police in DC saying their not coming?",👀 👀 👀 👀 👀 👀 👀 👀 👀 ✝ 🙏,0,0,0,,/LKennedyMcQuain/status/1880404266294337676
1880404395579633724,@maulruaidh,Wendi O’Maulruaidh,2025-01-17T23:58:38.000Z,Trumpneeds to smudge the White House with this.  Need good vibes on Monday.,Trumpneeds to smudge the White House with this.  Need good vibes on Monday.,,0,0,0,https://pbs.twimg.com/media/GhiJ0r1XgAAgvS9?format=jpg&name=small,/maulruaidh/status/1880404395579633724
1880404644104638757,@Charzol81,Charmaine,2025-01-17T23:59:38.000Z,"As a Brit, im living in hope and prayers that Starmers days arenumbered. Donald Trump Maga",Replying to@Jenny_1884@Keir_Starmerand@realDonaldTrump,❤ 🙏,1,6,0,,/Charzol81/status/1880404644104638757
1880404592468676951,@RudyGiuliani,Rudy W. Giuliani,2025-01-17T23:59:25.000Z,Analyzing Joe Biden’s Eleventh Hour Decisions Before Handing Keys to PresidentTrump,Analyzing Joe Biden’s Eleventh Hour Decisions Before Handing Keys to PresidentTrump,,69,2752,761,https://pbs.twimg.com/card_img/1967570016217255936/jp8vlinR?format=jpg&name=orig https://pbs.twimg.com/profile_images/1894103626785693696/iXh1bGXe_mini.jpg,/RudyGiuliani/status/1880404592468676951
1880404345789046793,@albertanbeech,Albertan Beech,2025-01-17T23:58:26.000Z,"Love how this Liberal government are the weakest collection of useless idiots this country has ever seen, yet the fight they want to pick is a trade war withDonald TrumpInsane","Love how this Liberal government are the weakest collection of useless idiots this country has ever seen, yet the fight they want to pick is a trade war withDonald TrumpInsane",🌾,2,43,4,,/albertanbeech/status/1880404345789046793
1880404681828045039,@MeetDonTrump,Don Trump,2025-01-17T23:59:47.000Z,"¡Amigos!Big day comin' on Jan 20th, 2025! Inauguration Day AND Martin Luther King Jr. Day, jaja!

60th Presidential Inauguration, folks! Get there early, security opens 5 a.m. CT! Bring your$DON, let's make amigos guac again!#MAGA","¡Amigos!Big day comin' on Jan 20th, 2025! Inauguration Day AND Martin Luther King Jr. Day, jaja!

60th Presidential Inauguration, folks! Get there early, security opens 5 a.m. CT! Bring your$DON, let's make amigos guac again!#MAGA",🎉 🥑,0,0,0,,/MeetDonTrump/status/1880404681828045039
1880404590300131643,@ModerateVoters,"ModerateVoters.org - Gary A. Butts, Founder",2025-01-17T23:59:25.000Z,"""explains the drastically different political fates ofDonald Trumpand Jair Bolsonaro"" - Maybe different today.

Prediction in 4 years:Trumpwill suffer a similar fate.",Replying to@ForeignAffairs,,0,0,0,,/ModerateVoters/status/1880404590300131643
1880404673536094580,@yeshua458,,2025-01-17T23:59:45.000Z,You put people in danger.Trumpcares about the law enforcement and first responders including the ANIMALS like K9 and horses.,Replying to@DavidCornDC,✨,1,33,2,https://pbs.twimg.com/media/GhiKFTfX0AAk5Ge?format=jpg&name=small,/yeshua458/status/1880404673536094580
1880404512684536271,@KeithOlbermann,Keith Olbermann,2025-01-17T23:59:06.000Z,"Yeah good work becauseTrumpsure is going to advance the cause oh right he'll be 50000 times worse, you self-defenestrating nitwits",Replying to@decensorednewsand@MaxBlumenthal,,14,89,3,,/KeithOlbermann/status/1880404512684536271
1880404119607025842,@_NicholasIrvine,Nicholas Irvine,2025-01-17T23:57:32.000Z,Imagine ifDonald Trumpbanned Apples 30% cut in the app store instead of banking TikTok,Imagine ifDonald Trumpbanned Apples 30% cut in the app store instead of banking TikTok,,0,0,1,,/_NicholasIrvine/status/1880404119607025842
1880404571069247615,@JonReinsch,Jon Reinsch,2025-01-17T23:59:20.000Z,"Wonder ifTrump's position on Taiwan is the same as it was 6 months ago: ""Trumpsays Taiwan should pay for defense, sending TSMC stock down""","Wonder ifTrump's position on Taiwan is the same as it was 6 months ago: ""Trumpsays Taiwan should pay for defense, sending TSMC stock down""",,0,0,0,,/JonReinsch/status/1880404571069247615
1880404699582714156,@BlacksforDJT,Blacks for President Donald Trump,2025-01-17T23:59:51.000Z,Pretty sure you are separated,Replying to@MichelleObama,,0,0,0,,/BlacksforDJT/status/1880404699582714156
1880404300679245949,@jsidman,Jessica Sidman,2025-01-17T23:58:16.000Z,"Putting aTrumphangout in the middle of Adams Morgan is an interesting choice, but I’m sure to outsiders it’s just “blocks from the White House.”","Putting aTrumphangout in the middle of Adams Morgan is an interesting choice, but I’m sure to outsiders it’s just “blocks from the White House.”",,22,626,56,https://pbs.twimg.com/profile_images/1511156957767475203/8TPMHT95_mini.jpg https://pbs.twimg.com/media/GhiI3hjWkAE7iWe?format=jpg&name=small,/jsidman/status/1880404300679245949
1880404507059978743,@Tu_Papi81,Travis Luna,2025-01-17T23:59:05.000Z,Liberals are disgusting and evil. They knowTrumpis moving indoors for his inauguration because there is a serious risk from psychos trying to murder him. They want him to be out there for precisely that reason.,Liberals are disgusting and evil. They knowTrumpis moving indoors for his inauguration because there is a serious risk from psychos trying to murder him. They want him to be out there for precisely that reason.,,0,1,0,,/Tu_Papi81/status/1880404507059978743
1880404635120529529,@DrLucyVanPelt4,Donald Trump Notorious Criminal,2025-01-17T23:59:35.000Z,"From all us fighting In Trama or Regular hospital, get flu shot, We recived 15 yr old critical condition,after her parents went two hospital to try to get her care. Young, Aging it available at RiteAide,CVS,Walgreen.Also check you local area for free shots.","From all us fighting In Trama or Regular hospital, get flu shot, We recived 15 yr old critical condition,after her parents went two hospital to try to get her care. Young, Aging it available at RiteAide,CVS,Walgreen.Also check you local area for free shots.",,1,2,0,https://pbs.twimg.com/tweet_video_thumb/GhiKCyVXMAAWBNm.jpg,/DrLucyVanPelt4/status/1880404635120529529
1880404598445547635,@donnaswala,@donnaswala,2025-01-17T23:59:27.000Z,The realDonald Trumpthat the media will never tell you about.,The realDonald Trumpthat the media will never tell you about.,,0,0,0,https://pbs.twimg.com/profile_images/1797687977818361865/MqIpY01d_mini.jpg https://pbs.twimg.com/profile_images/1924453133050122240/LnQNgj1x_bigger.jpg https://pbs.twimg.com/amplify_video_thumb/1880376043170578432/img/jUI4FkgIOHAB848B.jpg,/DonnaSwala/status/1880404598445547635
1880404644264042727,@SkepticKen,Ken Jones,2025-01-17T23:59:38.000Z,"Trumpput maintaining his massive 2017 tax cut at the top of his economic agenda, but Republicans will have to pay for them with massive spending cuts to the federal budget if they want to avoid triggering major interest rate increases on American debt.https://rawstory.com/trump-tax-cuts-2670880620/…?","Trumpput maintaining his massive 2017 tax cut at the top of his economic agenda, but Republicans will have to pay for them with massive spending cuts to the federal budget if they want to avoid triggering major interest rate increases on American debt.https://rawstory.com/trump-tax-cuts-2670880620/…?",,0,0,0,,/SkepticKen/status/1880404644264042727
1880404298695082123,@HollandHart,Holland & Hart LLP,2025-01-17T23:58:15.000Z,"TheTrump Administrationis expected to make NLRB leadership changes.#LaborLawattorney Steven Suflas shares with@Law360, could this administration be less, ""what others would call, 'anti-union' as in the first go-round? That's absolutely a wild card.""https://law360.com/employment-authority/articles/2283148…","TheTrump Administrationis expected to make NLRB leadership changes.#LaborLawattorney Steven Suflas shares with@Law360, could this administration be less, ""what others would call, 'anti-union' as in the first go-round? That's absolutely a wild card.""https://law360.com/employment-authority/articles/2283148…",,0,1,0,https://pbs.twimg.com/media/GhiJvuFW0AAWHUk?format=jpg&name=small,/HollandHart/status/1880404298695082123
1880404577218117949,@thomas_briel,tommy b.,2025-01-17T23:59:22.000Z,"All you sanctuary city's, you thinkTrumpis bad news,wait till the illegals are done with you. Can you say, BROKE AND NO ONE TO TURN TO! DEMOCRATS RUN AMERICA IN A HOLE...FIX AMERICA FIRST.IF YOU PUT ILLEGALS AHEAD OF AMERICA, THEN YOU DON'T BELONG HERE!","All you sanctuary city's, you thinkTrumpis bad news,wait till the illegals are done with you. Can you say, BROKE AND NO ONE TO TURN TO! DEMOCRATS RUN AMERICA IN A HOLE...FIX AMERICA FIRST.IF YOU PUT ILLEGALS AHEAD OF AMERICA, THEN YOU DON'T BELONG HERE!",,0,0,0,,/thomas_briel/status/1880404577218117949
1880404236682326352,@nlst50,Nancy,2025-01-17T23:58:00.000Z,"""Elon Musk, Who Is Definitely Not SecretlyTrump's Boss, Will Have Office on White House Compound"" - Futurism#SmartNews","""Elon Musk, Who Is Definitely Not SecretlyTrump's Boss, Will Have Office on White House Compound"" - Futurism#SmartNews",,0,0,0,,/nlst50/status/1880404236682326352
1880404422444077273,@RedPilledNurse,RedPilledNurse,2025-01-17T23:58:45.000Z,If you aim indoors it's easier to hit right#zelena#zeudi#helena#yulioli#helevier#tommavi#shailenzo#Trump#BSB#GrandeFratello#MAGA#TakeThat,Replying to@Angkor@gelisa17and 15 others,,0,2,1,,/RedPilledNurse/status/1880404422444077273
1880404563246870674,@WHEB13,TAZZ,2025-01-17T23:59:18.000Z,If you ask meDonald Trumpis collecting nothing but rejects.,Replying to@RpsAgainstTrump,,0,0,0,,/WHEB13/status/1880404563246870674
1880404592401535367,@Halo7_2024,Care For The Poor,2025-01-17T23:59:25.000Z,trumpinauguration WOOOOOOOHOOOOOOO!!!!!!!!!!!!!!!!!!!!!!!!!!!! USA USA USA!!!!!!!!!https://youtube.com/watch?v=KP1tUSP6Gj8&t=253s…FINALLY!!!!!!!!!!!!!!!!!!!!ITS FINALLY GOING TO BE OVER!,trumpinauguration WOOOOOOOHOOOOOOO!!!!!!!!!!!!!!!!!!!!!!!!!!!! USA USA USA!!!!!!!!!https://youtube.com/watch?v=KP1tUSP6Gj8&t=253s…FINALLY!!!!!!!!!!!!!!!!!!!!ITS FINALLY GOING TO BE OVER!,,0,0,0,,/Halo7_2024/status/1880404592401535367
1880404534834655725,@ArmyMom0756,Army Mom,2025-01-17T23:59:11.000Z,"Read ""Joe’s low blows: How lame-duck Biden has tried to trip upTrumpon way out the door — with 32 executive actions"" on SmartNews:https://l.smartnews.com/p-icH3CJ3/TDsfXl…#SmartNews","Read ""Joe’s low blows: How lame-duck Biden has tried to trip upTrumpon way out the door — with 32 executive actions"" on SmartNews:https://l.smartnews.com/p-icH3CJ3/TDsfXl…#SmartNews",,0,0,0,https://pbs.twimg.com/card_img/1966912782885851136/njzOG0_O?format=jpg&name=small,/ArmyMom0756/status/1880404534834655725
1880404613603463494,@CaptainswebBG,Pissed off poet,2025-01-17T23:59:30.000Z,"Titanic and Olympic Switch Documentary - Fact or Conspiracy?https://bitchute.com/video/O4tb036bVEOX…Don’t blame PresidentTrump, he didn't do it, we did. We are The People’s Congress. And we are coming for you.
By order of “The People’s Congress”:
Charge #1
We demand to see “proof of cause” in","Titanic and Olympic Switch Documentary - Fact or Conspiracy?https://bitchute.com/video/O4tb036bVEOX…Don’t blame PresidentTrump, he didn't do it, we did. We are The People’s Congress. And we are coming for you.
By order of “The People’s Congress”:
Charge #1
We demand to see “proof of cause” inShow more",,1,0,0,,/CaptainswebBG/status/1880404613603463494
1880404732340031725,@TheVV_USA,TheDoubleV,2025-01-17T23:59:59.000Z,"Another reasonTrumpwon, he's promised (publicly) at least a thousand five hundred pardons for peoples roles in Jan 6th 2020. And each one of those terrorists have family members and friends that are emotionally invested in keeping them out of jail via pardons","Another reasonTrumpwon, he's promised (publicly) at least a thousand five hundred pardons for peoples roles in Jan 6th 2020. And each one of those terrorists have family members and friends that are emotionally invested in keeping them out of jail via pardons",,0,5,1,,/TheVV_USA/status/1880404732340031725
1880404472838647969,@rainygday,Rainygday,2025-01-17T23:58:57.000Z,Nothing to do with this eitherhttps://dailycaller.com/2025/01/17/donald-trump-inauguration-security-metropolitan-police-department/…,Replying to@kenjbarnes1,,4,22,5,,/rainygday/status/1880404472838647969
1880404664887439839,@TimNoEgo,There are some who call me...TIM,2025-01-17T23:59:42.000Z,"You guys can boycott the inauguration if it makes you happy, but don't fancy yourselves effectingtrump's TV ratings

Unless you are a Nielsen Family, your TV viewing habits aren't counted

Anyway,trumpwon't care. He'll just lie about his numbers anyway.","You guys can boycott the inauguration if it makes you happy, but don't fancy yourselves effectingtrump's TV ratings

Unless you are a Nielsen Family, your TV viewing habits aren't counted

Anyway,trumpwon't care. He'll just lie about his numbers anyway.",,2,6,4,,/TimNoEgo/status/1880404664887439839
1880404476991009271,@RobbieSherwood,Robbie Sherwood,2025-01-17T23:58:58.000Z,Trumpcan’t fill the mall so now he claims it’s too cold and moves his inauguration inside. It’s always cold af in Washington DC this time of year. Obama’s was 28 degrees and completely packed.,Trumpcan’t fill the mall so now he claims it’s too cold and moves his inauguration inside. It’s always cold af in Washington DC this time of year. Obama’s was 28 degrees and completely packed.,,0,6,1,,/RobbieSherwood/status/1880404476991009271
1880404517361262678,@DavidYeshua4,David Yeshua,2025-01-17T23:59:07.000Z,PresidentTrumpwill be placing his hand on the Bible his mom gave him in 1955.,PresidentTrumpwill be placing his hand on the Bible his mom gave him in 1955.,✝ 🦅,6,23,7,https://pbs.twimg.com/media/GhiJ8U8XkAAO6cr?format=jpg&name=small,/DavidYeshua4/status/1880404517361262678
1880404191736213586,@DianeJamesMEP,Diane James,2025-01-17T23:57:50.000Z,Hawley slams Dem activist for downplaying migrant crime: 'Not an actual issue?'#MAGA#MAHA#Trump,Hawley slams Dem activist for downplaying migrant crime: 'Not an actual issue?'#MAGA#MAHA#Trump,,0,1,0,,/DianeJamesMEP/status/1880404191736213586
1880404553151181146,@CryptozQuamfy,Cryptoz,2025-01-17T23:59:16.000Z,$ZIGTrumpadvisor on the team of#ZIGChain. That is crazy,$ZIGTrumpadvisor on the team of#ZIGChain. That is crazy,📣,0,9,0,https://pbs.twimg.com/profile_images/1945162518738894849/BxpMkADN_mini.jpg https://pbs.twimg.com/media/GhgiLdoXcAMFjQ3?format=jpg&name=small,/CryptozQuamfy/status/1880404553151181146
1880404669383733737,@BlaireWitch_X,Shiloh,2025-01-17T23:59:44.000Z,Soo… these are going to be some interesting 4 years. When I say I am scared of what will happen that is an understatement. All I am hoping for is thatTrumpdoes some of the (good) things he’s promised like lower grocery prices and cost of living.,Soo… these are going to be some interesting 4 years. When I say I am scared of what will happen that is an understatement. All I am hoping for is thatTrumpdoes some of the (good) things he’s promised like lower grocery prices and cost of living.,,0,1,0,,/BlaireWitch_X/status/1880404669383733737
1880404621497364928,@JMahoffer,Jacques,2025-01-17T23:59:32.000Z,Poor bastards who failed to admitTrumpDGAF about their farmer asses.,Poor bastards who failed to admitTrumpDGAF about their farmer asses.,,0,6,1,https://pbs.twimg.com/profile_images/1848186486161575936/hN0rYram_mini.jpg https://pbs.twimg.com/amplify_video_thumb/1880382287914704896/img/9MFgKwpo4P2MOYph.jpg,/JMahoffer/status/1880404621497364928
1880404582947492222,@DotUrada,Dorothy Urada,2025-01-17T23:59:23.000Z,'Something is going to happen': Report said to reveal source ofTrump's Panama 'fixation','Something is going to happen': Report said to reveal source ofTrump's Panama 'fixation',,0,0,0,,/DotUrada/status/1880404582947492222
1880404520108515353,@PamelaL98281927,Pamela formerly maga. TRUMP OR BUST!,2025-01-17T23:59:08.000Z,Trumpknew that this would happen.  He is ready for it,Trumpknew that this would happen.  He is ready for it,,0,0,0,https://pbs.twimg.com/profile_images/1967364893515866113/eax4SVwS_mini.jpg https://pbs.twimg.com/media/GhiCZ9QW8AAcvfL?format=jpg&name=small,/PamelaL98281927/status/1880404520108515353
1880404448826257684,@anonpleb2,TommyLev,2025-01-17T23:58:51.000Z,Aped some$ttTrumpgonna save tt,Aped some$ttTrumpgonna save tt,,0,1,0,https://pbs.twimg.com/profile_images/1743515025065594880/B2gIGGoz_mini.jpg https://pbs.twimg.com/media/Ghh2N8MXcAAQgsP?format=jpg&name=900x900,/anonpleb2/status/1880404448826257684
1880070312089252281,@Techmeme,Techmeme,2025-01-17T01:51:07.000Z,A US official says the Biden administration won't force TikTok to go dark in the country on January 19 and will leave it up toTrumpto implement the law (ABC News)https://abcnews.go.com/Politics/biden-administration-leave-trump-implement-tiktok-ban/story?id=117753133…http://techmeme.com/250116/p52#a250116p52…,A US official says the Biden administration won't force TikTok to go dark in the country on January 19 and will leave it up toTrumpto implement the law (ABC News)https://abcnews.go.com/Politics/biden-administration-leave-trump-implement-tiktok-ban/story?id=117753133…http://techmeme.com/250116/p52#a250116p52…,,0,3,4,https://pbs.twimg.com/profile_images/1191943129823399936/ZvfTRAlg_mini.jpg https://pbs.twimg.com/media/GdsHsdtXgAAKf04?format=jpg&name=small,/Techmeme/status/1880070312089252281
1880048912540516380,@Techmeme,Techmeme,2025-01-17T00:26:05.000Z,Sources:Trumpplans an EO to elevate crypto to a national imperative or priority and create a crypto advisory council to advocate for industry priorities (Bloomberg)https://bloomberg.com/news/articles/2025-01-16/trump-plans-to-designate-cryptocurrency-as-a-national-priority…http://techmeme.com/250116/p50#a250116p50…,Sources:Trumpplans an EO to elevate crypto to a national imperative or priority and create a crypto advisory council to advocate for industry priorities (Bloomberg)https://bloomberg.com/news/articles/2025-01-16/trump-plans-to-designate-cryptocurrency-as-a-national-priority…http://techmeme.com/250116/p50#a250116p50…,,0,3,2,https://pbs.twimg.com/profile_images/1191943129823399936/ZvfTRAlg_mini.jpg https://pbs.twimg.com/media/GdsHsdtXgAAKf04?format=jpg&name=small,/Techmeme/status/1880048912540516380
