tweetId,UserScreenName,UserName,Timestamp,Text,Embedded_text,Emojis,Comments,Likes,Retweets,Image link,Tweet URL
1923166219391090839,@Washington85435,Washington Patriot,2025-05-15T23:58:52.000Z,"Trumpgot ""everything he wanted from Panama.”#billoreilly#trump#pana...https://youtube.com/shorts/Drb_oeadXAc?si=S9Bc-MAzlSG5e5t8…via@YouTubeTRUMPis so awesome!!! Truly putting American First!!","Trumpgot ""everything he wanted from Panama.”#billoreilly#trump#pana...https://youtube.com/shorts/Drb_oeadXAc?si=S9Bc-MAzlSG5e5t8…via@YouTubeTRUMPis so awesome!!! Truly putting American First!!",,0,0,0,,/Washington85435/status/1923166219391090839
1923166279516422169,@Charlie88193579,Kaptin Kangaroo,2025-05-15T23:59:06.000Z,ConfusedTrumpSTUNS panel into SILENCEhttps://youtu.be/SjW56-fp7bk?si=cheQLSMiXurY7iKD…via@YouTube,ConfusedTrumpSTUNS panel into SILENCEhttps://youtu.be/SjW56-fp7bk?si=cheQLSMiXurY7iKD…via@YouTube,💻,0,1,0,https://pbs.twimg.com/card_img/1966177265609592833/gtEvPdmJ?format=jpg&name=240x240,/Charlie88193579/status/1923166279516422169
1923166237195948040,@OilHeadlineNews,Energy Headline News,2025-05-15T23:58:56.000Z,"Former FBI head James Comey posts picture allegedly calling for getting rid of PresidentTrump, reportedly violently","Former FBI head James Comey posts picture allegedly calling for getting rid of PresidentTrump, reportedly violently",,1,5,1,https://pbs.twimg.com/amplify_video_thumb/1923164554973872128/img/PA-2pq0BIy0LX4to.jpg,/OilHeadlineNews/status/1923166237195948040
1923166430171709704,@MarcSOl_,Marco,2025-05-15T23:59:42.000Z,Market is either asleep rn or waiting forTrumpto address 8647,Market is either asleep rn or waiting forTrumpto address 8647,,0,0,0,,/MarcSOl_/status/1923166430171709704
1923166313687449935,@FINALMESSIAH,FINAL MESSIAH,2025-05-15T23:59:14.000Z,"So their mad cause I wrote a movie  scene aboutTrump's birthday parade...

Yea but ive written more about my EVD BERLIN WALL BABYSITTER NOACHIC GATES G6..

WHY DONT THEY DO SOMETHING ABOUT MY EVD BERLIN WALL THAT IVE BEEN WRITING FOR 20 YEARS..

@@@@","So their mad cause I wrote a movie  scene aboutTrump's birthday parade...

Yea but ive written more about my EVD BERLIN WALL BABYSITTER NOACHIC GATES G6..

WHY DONT THEY DO SOMETHING ABOUT MY EVD BERLIN WALL THAT IVE BEEN WRITING FOR 20 YEARS..

@@@@",👽 👽 👽 👽 🐴 🐴 🐴 🐴 🎥 🎥 🎥 🎥,0,2,1,https://pbs.twimg.com/media/GrB1gY-aAAATTB-?format=jpg&name=360x360 https://pbs.twimg.com/media/GrB1g_TaAAAHrS7?format=jpg&name=360x360 https://pbs.twimg.com/media/GrB1g0gaAAM4Lzr?format=jpg&name=360x360 https://pbs.twimg.com/media/GrB1g_SaAAIZGrc?format=jpg&name=360x360,/FINALMESSIAH/status/1923166313687449935
1923166139758281019,@Master_Chart322,Master_Chart322 ( WILL NEVER DM U FIRST ),2025-05-15T23:58:33.000Z,$PORT3#PORT3long  update1:9 RR  done90% profit with as given 7X leverage#PORT3USDThuge secure profit  bookedlike and Share plz#ALPACA#MEMEMFI#SYN#SUI#SOL#BTC#ETH#FARTCOIN#DARK#MYRO#TURBO$TRUMP#TRUMP$TRUMP$SUI$SOL,$PORT3#PORT3long  update1:9 RR  done90% profit with as given 7X leverage#PORT3USDThuge secure profit  bookedlike and Share plz#ALPACA#MEMEMFI#SYN#SUI#SOL#BTC#ETH#FARTCOIN#DARK#MYRO#TURBO$TRUMP#TRUMP$TRUMP$SUI$SOLShow more,✍ ✅ ✅ ✅ 🍾 🤝 ✅ ✅ 🍾 ❤ 🙏,0,0,0,https://pbs.twimg.com/media/GrB1aTFWsAAB-E6?format=jpg&name=360x360 https://pbs.twimg.com/media/GrB1aTqXcAAk-_J?format=jpg&name=small,/Master_Chart322/status/1923166139758281019
1923166188646871154,@SooSalvas5527,Soo Salvas,2025-05-15T23:58:44.000Z,"This echoes the adage that goes ""a hungry man is an angry man."" So, apt!
Follow for more...#Trump#bts2025#Barcelona","This echoes the adage that goes ""a hungry man is an angry man."" So, apt!
Follow for more...#Trump#bts2025#Barcelona",👍 👍 👍 👍,0,0,0,https://pbs.twimg.com/media/GrB1BeSWMAAn40u?format=jpg&name=small,/SooSalvas5527/status/1923166188646871154
1923081276233289864,@TheOnion,The Onion,2025-05-15T18:21:20.000Z,TrumpGrants Refugee Status To Former SS Guards,Replying to@TheOnion,,10,140,29,https://pbs.twimg.com/card_img/1966518185638719488/At_kxN-j?format=jpg&name=small,/TheOnion/status/1923081276233289864
1923166213804282226,@CommodusJTrump,COMMODUS J TRUMP,2025-05-15T23:58:50.000Z,"Too bad.
Tell@RepSummerLeethey SPENT their ""reparations,"" already.",Replying to@janninereid1,😒,0,0,0,https://pbs.twimg.com/media/GrB1ergXsAAc3zK?format=jpg&name=small,/CommodusJTrump/status/1923166213804282226
1923165916092682723,@JerryGi93983941,Trump Sucks,2025-05-15T23:57:39.000Z,"Read ""‘Tools!’ MTG lashes out after reportTrumpteam pushed her out of Senate bid"" on SmartNews:https://l.smartnews.com/p-l4KsY0E/yl4KuT…#SmartNews","Read ""‘Tools!’ MTG lashes out after reportTrumpteam pushed her out of Senate bid"" on SmartNews:https://l.smartnews.com/p-l4KsY0E/yl4KuT…#SmartNews",,0,0,0,https://pbs.twimg.com/card_img/1962922593184284672/cz7DscTo?format=jpg&name=small,/JerryGi93983941/status/1923165916092682723
1923166257655713997,@JS4Yah,Praise Yah,2025-05-15T23:59:01.000Z,"The LastTrumpVolume Three
2/10/06 From The Lord, Our God and Saviorhttps://thevolumesoftruth.com/The_Last_TrumpAudiohttps://thevolumesoftruth.bandcamp.com/track/the-last-trump-full-letter…Official Bandcamp Channelhttps://thevolumesoftruth.bandcamp.com/?fbclid=IwAR29P2GxVGBSFboHn2znwpuLxTquA8DqJuAOnBJB5NY5EqEx3ZYP614KySo…Videoshttps://youtube.com/watch?v=QwBwcB1o1IE&list=PLE8FlkxQPQkOki3y3XQqS8Nx49EwLuRld&index=2…Official YouTube Channelhttps://youtube.com/user/trumpetcallofgod…","The LastTrumpVolume Three
2/10/06 From The Lord, Our God and Saviorhttps://thevolumesoftruth.com/The_Last_TrumpAudiohttps://thevolumesoftruth.bandcamp.com/track/the-last-trump-full-letter…Official Bandcamp Channelhttps://thevolumesoftruth.bandcamp.com/?fbclid=IwAR29P2GxVGBSFboHn2znwpuLxTquA8DqJuAOnBJB5NY5EqEx3ZYP614KySo…Videoshttps://youtube.com/watch?v=QwBwcB1o1IE&list=PLE8FlkxQPQkOki3y3XQqS8Nx49EwLuRld&index=2…Official YouTube Channelhttps://youtube.com/user/trumpetcallofgod…",,0,3,4,https://pbs.twimg.com/media/GrB1hQhaAAA-0c9?format=jpg&name=small,/JS4Yah/status/1923166257655713997
1923166395719705072,@FinanceRadarOn,FinanceRadar,2025-05-15T23:59:34.000Z,Trump AdministrationDivided on Adding Chinese Chipmakers to Export Ban,Trump AdministrationDivided on Adding Chinese Chipmakers to Export Ban,⚡,0,0,0,,/FinanceRadarOn/status/1923166395719705072
1923166374878236749,@GallagherShow,Mike Gallagher Show,2025-05-15T23:59:29.000Z,What a crazy coinkidink!  There just happened to be shells that spelled out KillTrumpon the beach. And the honorable Mr Comey just happened to stumble across it. Who’d have thunk it?,What a crazy coinkidink!  There just happened to be shells that spelled out KillTrumpon the beach. And the honorable Mr Comey just happened to stumble across it. Who’d have thunk it?,,9,52,11,https://pbs.twimg.com/profile_images/1805215548822650880/_dsr9A3U_mini.jpg https://pbs.twimg.com/media/GrBkLESWwAEbYhn?format=jpg&name=small,/GallagherShow/status/1923166374878236749
1923166158569541701,@CamdenWatch,CAMDEN-WATCH,2025-05-15T23:58:37.000Z,QUOTE ...@RepTedLieu... Why is a foreign country trying to give a massive gift totRUMP... There is no such thing as a ... FREE PALACE IN THE SKY ...https://x.com/RepTedLieu/status/1922834261641408810…... FULL STOP ... !!!,QUOTE ...@RepTedLieu... Why is a foreign country trying to give a massive gift totRUMP... There is no such thing as a ... FREE PALACE IN THE SKY ...https://x.com/RepTedLieu/status/1922834261641408810…... FULL STOP ... !!!,,0,1,1,https://pbs.twimg.com/media/GrB1aT6XsAAs2uT?format=jpg&name=360x360 https://pbs.twimg.com/media/GrB1aT7XIAApPBk?format=jpg&name=360x360 https://pbs.twimg.com/media/GrB1aWbWoAAGwce?format=png&name=360x360 https://pbs.twimg.com/media/GrB1aWgWIAA6HR3?format=jpg&name=360x360 https://pbs.twimg.com/profile_images/1634332968100478979/yvRqAjVn_mini.jpg https://pbs.twimg.com/profile_images/1613673899371159555/X20dMMBa_bigger.jpg https://pbs.twimg.com/amplify_video_thumb/1922833594893979648/img/WBdpJ31OqanjloAe?format=jpg&name=240x240,/CamdenWatch/status/1923166158569541701
1923166426518393198,@nowornever2_0,NowOrNever,2025-05-15T23:59:41.000Z,"And who gets to determine the narrative,Donald Trump?",Replying to@CasperTheBoss23and@RepRaskin,,1,0,0,,/nowornever2_0/status/1923166426518393198
1923166379357913551,@Gameday777,Freedom Nation,2025-05-15T23:59:30.000Z,"Today’s oral arguments regarding the injunction against PresidentTrump’s executive order on Birthright Citizenship and the 14th Amendment have proved without a shadow of a doubt Amy Comey Barrett isTrump's biggest mistake. She, obviously is a plant. He has made a big mistake","Today’s oral arguments regarding the injunction against PresidentTrump’s executive order on Birthright Citizenship and the 14th Amendment have proved without a shadow of a doubt Amy Comey Barrett isTrump's biggest mistake. She, obviously is a plant. He has made a big mistakeShow more",,3,15,5,https://pbs.twimg.com/media/GrB1oHpaAAENOsx?format=jpg&name=small,/Gameday777/status/1923166379357913551
1923166353185190395,@velitesgear,Velit.es,2025-05-15T23:59:23.000Z,RT@velitesgear| Full Text Article:https://foreignpolicy.com/2025/05/15/trump-dealmaking-gulf-saudi-arabia-qatar/…| Author:@ForeignPolicyTrump’s Gulf Dealmaking Bonanza Saudi Arabia and Qatar made splashy economic commitments worth nearly $2 trillion during the U.S. president’s visit.,RT@velitesgear| Full Text Article:https://foreignpolicy.com/2025/05/15/trump-dealmaking-gulf-saudi-arabia-qatar/…| Author:@ForeignPolicyTrump’s Gulf Dealmaking Bonanza Saudi Arabia and Qatar made splashy economic commitments worth nearly $2 trillion during the U.S. president’s visit.,,0,0,0,https://pbs.twimg.com/media/GrB1m0EXsAA6Y6h?format=jpg&name=small,/velitesgear/status/1923166353185190395
1923166266564505758,@WR0000001,Will Robbins,2025-05-15T23:59:03.000Z,"Ex-FBI Director Comey Under Investigation For THREATENINGTrumpWith ""86-47"" Post | Timcast IRL","Ex-FBI Director Comey Under Investigation For THREATENINGTrumpWith ""86-47"" Post | Timcast IRL",,0,0,0,https://pbs.twimg.com/card_img/1967341305065033728/M3Hvn_e9?format=jpg&name=small,/WR0000001/status/1923166266564505758
1922934347696427189,@slashdot,Slashdot,2025-05-15T08:37:29.000Z,TrumpTells Apple CEO To Avoid Manufacturing in India,TrumpTells Apple CEO To Avoid Manufacturing in India,,0,8,4,https://pbs.twimg.com/card_img/1968250541718298624/mLicg1y0?format=png&name=120x120,/slashdot/status/1922934347696427189
1923166051602399519,@WesternJournalX,The Western Journal,2025-05-15T23:58:12.000Z,Noem promised not just Secret Service action but DHS more broadly as well.,Noem promised not just Secret Service action but DHS more broadly as well.,,0,10,3,,/WesternJournalX/status/1923166051602399519
1923166113396920347,@Rat_BoyGL,George L,2025-05-15T23:58:26.000Z,Can’t make it up. All the complaining about PresidentTrumpaccepting a gift and the negotiations for said gift started under President Biden.,Can’t make it up. All the complaining about PresidentTrumpaccepting a gift and the negotiations for said gift started under President Biden.,😂,16,205,116,https://pbs.twimg.com/amplify_video_thumb/1923166061857214464/img/VzS03H-IAYrDrS2O.jpg,/Rat_BoyGL/status/1923166113396920347
1923166391458308438,@tinopener1,tinopener,2025-05-15T23:59:33.000Z,"We are nothing without acoustic guitar, and voice artistry.Donald Trump's people know that",Replying to@tinopener1,,1,0,0,,/tinopener1/status/1923166391458308438
1923166137166029151,@DesertTalk,DesertTalk,2025-05-15T23:58:32.000Z,"Trump's military parade cost: Up to $45 million for D.C. march - enumerate the costs, don't just throw numbers at the public;  the staff is already paid, the vehicles and planes are used to be maintained.  Sounds like liberal BS to me#cnbc","Trump's military parade cost: Up to $45 million for D.C. march - enumerate the costs, don't just throw numbers at the public;  the staff is already paid, the vehicles and planes are used to be maintained.  Sounds like liberal BS to me#cnbc",,0,0,0,,/DesertTalk/status/1923166137166029151
1923166276597272864,@JudyWil49959129,Patriot Lady,2025-05-15T23:59:05.000Z,Corrupt lil Comey threatenedTrump.  Will FBI be visiting this corrupt lil Dem Bastard ?   Ex FBI corrupt Dirty chief is crapping his pants in fear of his Corruprion being exposed.  I think he will be exposed and arrested.  He’s soooooo scared and losing it from his guilt.,Corrupt lil Comey threatenedTrump.  Will FBI be visiting this corrupt lil Dem Bastard ?   Ex FBI corrupt Dirty chief is crapping his pants in fear of his Corruprion being exposed.  I think he will be exposed and arrested.  He’s soooooo scared and losing it from his guilt.,,0,0,0,,/JudyWil49959129/status/1923166276597272864
1923166119545778243,@jmmomoa1967,Joanne Marie Momoa,2025-05-15T23:58:28.000Z,EMERGENCY LIVE:Trump's LIFE is UNDER THREAT by The DEEP STATE!!!https://youtube.com/live/0Dgq797KvAE?si=02AA3yZGO7o5O0o6…via@YouTube,EMERGENCY LIVE:Trump's LIFE is UNDER THREAT by The DEEP STATE!!!https://youtube.com/live/0Dgq797KvAE?si=02AA3yZGO7o5O0o6…via@YouTube,🚨 🚨,0,0,0,,/jmmomoa1967/status/1923166119545778243
1923166262504378816,@BurdickPenny66,PennyMAGA,2025-05-15T23:59:02.000Z,The timing is head scratching.Trumpis on tour.   Arrest comey right fucking now.   Tired of Pam Bondi allowing everyone to get away with this bullshit.,The timing is head scratching.Trumpis on tour.   Arrest comey right fucking now.   Tired of Pam Bondi allowing everyone to get away with this bullshit.,💥,0,2,0,,/BurdickPenny66/status/1923166262504378816
1923166083638341870,@kalicassidy,cheryl keaney,2025-05-15T23:58:19.000Z,SoTrumpletting a cartel family move into USA because of money is no problem but let’s lock up kids in ICE detention centres and let the get sick and die. The US is treating human beings worse than animals,SoTrumpletting a cartel family move into USA because of money is no problem but let’s lock up kids in ICE detention centres and let the get sick and die. The US is treating human beings worse than animals,,0,1,0,,/kalicassidy/status/1923166083638341870
1923166335900565998,@Elsigre2327,Jake,2025-05-15T23:59:19.000Z,"PresidentTrumphas been bestowed with The Order of Zayed, the United Arab Emirates highest civilian honor.","PresidentTrumphas been bestowed with The Order of Zayed, the United Arab Emirates highest civilian honor.",,0,0,0,https://pbs.twimg.com/card_img/1966279190170247168/YjHv2NbA?format=png&name=240x240,/Elsigre2327/status/1923166335900565998
1923166249317503036,@TerryHutto,Trump 2024,2025-05-15T23:58:59.000Z,Doing that is nothing but a joke,Doing that is nothing but a joke,,0,0,0,https://pbs.twimg.com/profile_images/1927922136594927618/n9mJaPMM_mini.jpg https://pbs.twimg.com/media/Gq_arUwWUAAwIJn?format=jpg&name=small,/TerryHutto/status/1923166249317503036
1923166473884664061,@niekjansen4,niek jansen,2025-05-15T23:59:52.000Z,Putin-Trumpmeeting ‘imminent’ – White House official — RT Russia & Former Soviet Union,Putin-Trumpmeeting ‘imminent’ – White House official — RT Russia & Former Soviet Union,,0,0,0,https://pbs.twimg.com/card_img/1965634891317714944/xdEf0sW3?format=jpg&name=small,/niekjansen4/status/1923166473884664061
1923166490674479116,@merryliza,bettylong,2025-05-15T23:59:56.000Z,Yes Mrtrumpto blame lot of bullshit he is with drawing from NY,Yes Mrtrumpto blame lot of bullshit he is with drawing from NY,,0,1,0,https://pbs.twimg.com/profile_images/1774198587095646208/6KEF61Mv_mini.jpg https://pbs.twimg.com/profile_images/1928141117062545408/ZC5izKZr_bigger.jpg,/merryliza/status/1923166490674479116
1923166086062579889,@RetroAgent12,Agent Self FBI,2025-05-15T23:58:20.000Z,When has 86 47 ever meant to assassinateTrump?,Replying to@johnrich,,62,354,7,,/RetroAgent12/status/1923166086062579889
1923166286344826907,@RyanKing142,Ryan King,2025-05-15T23:59:08.000Z,Price discovery incoming$HOLD@everybodyholdX#Bitcoin#Ethereum$BTC$ETH$XRP$TRUMP$DOGE$SHIB$PEPE$FLOKI$TEL$VRA$SPX#Cryptocurrency#Altcoins#Altseason,Price discovery incoming$HOLD@everybodyholdX#Bitcoin#Ethereum$BTC$ETH$XRP$TRUMP$DOGE$SHIB$PEPE$FLOKI$TEL$VRA$SPX#Cryptocurrency#Altcoins#Altseason,💥 💰 💰,1,25,5,https://pbs.twimg.com/profile_images/1954620671750717440/Hn9LfH7n_mini.jpg https://pbs.twimg.com/media/GrB0uR-XwAALIIF?format=png&name=small,/RyanKing142/status/1923166286344826907
1923166422844264781,@macombdaily,The Macomb Daily,2025-05-15T23:59:40.000Z,"Trump’s ‘beautiful’ bill spans 1,116 pages. Here’s what’s inside ithttps://trib.al/8B2W31r","Trump’s ‘beautiful’ bill spans 1,116 pages. Here’s what’s inside ithttps://trib.al/8B2W31r",,0,0,0,https://pbs.twimg.com/media/GrB1qrzWIAAJ2i0?format=jpg&name=small,/macombdaily/status/1923166422844264781
1923166003866775867,@_omgeezy,,2025-05-15T23:58:00.000Z,Ive never seen a tour like this. Thistrumpmiddle east tour might be the craziest shit in history.,Ive never seen a tour like this. Thistrumpmiddle east tour might be the craziest shit in history.,📷,0,0,0,,/_omgeezy/status/1923166003866775867
1923166185278828814,@Downtownfairy,Downtown Fairy,2025-05-15T23:58:43.000Z,Exactly.  Remember the video when PresidentTrumpsaid they asked Saudi Arabia if he NEEDED and escort and they said yes.,Replying to@drawandstrike,,0,44,4,,/Downtownfairy/status/1923166185278828814
1923166323187593497,@Flash908,C Noname,2025-05-15T23:59:16.000Z,Secret Service investigating ex-FBI chief James Comey for allegedly threateningTrumpin since-deleted ‘8647’ Instagram post: ‘Deeply concerning’,Secret Service investigating ex-FBI chief James Comey for allegedly threateningTrumpin since-deleted ‘8647’ Instagram post: ‘Deeply concerning’,,0,0,0,https://pbs.twimg.com/card_img/1966862274569859072/sRRZ9lAc?format=jpg&name=small,/Flash908/status/1923166323187593497
1923166190559465606,@outrageousg,GLORIA BREDEHOEFT,2025-05-15T23:58:45.000Z,"Not needed! Reducing the price of foods needed.
Price tag forTrump’s military festival could reach $45 million","Not needed! Reducing the price of foods needed.
Price tag forTrump’s military festival could reach $45 million",,0,0,0,https://pbs.twimg.com/card_img/1964964159721766912/enj-QAJv?format=jpg&name=small,/outrageousg/status/1923166190559465606
1923166185471857017,@Bobbie08502969,Boomer says: The evil runs wide and deep,2025-05-15T23:58:43.000Z,President Lincoln believes modern day Republicans are perverts.  He's got that right!,President Lincoln believes modern day Republicans are perverts.  He's got that right!,🎙,0,9,4,https://pbs.twimg.com/profile_images/1842209299256287232/BBR1J5KC_mini.jpg https://pbs.twimg.com/media/Gq_UeBYXUAAaLPv?format=jpg&name=small,/Bobbie08502969/status/1923166185471857017
1923166281177424097,@Rachel22Queen,Steel Magnolia,2025-05-15T23:59:06.000Z,"The ""time"" is 2028 if you want a new President. 
Meanwhile your explanation of 'getting rid ofTrump' before then means only one thing and you know it.@FBIDDBongino","The ""time"" is 2028 if you want a new President. 
Meanwhile your explanation of 'getting rid ofTrump' before then means only one thing and you know it.@FBIDDBongino",,0,1,1,https://pbs.twimg.com/profile_images/1700155431757193216/4iMzq_Tk_mini.jpg https://pbs.twimg.com/profile_images/1689244790531977216/9wh7B5gr_bigger.jpg https://pbs.twimg.com/media/GrBT0Q1WcAAF5Hd?format=jpg&name=small,/Rachel22Queen/status/1923166281177424097
1923166433921413474,@ForrestRebel,James,2025-05-15T23:59:43.000Z,"May we wish what he calls for against PresidentTrumpcomes knocking at his door .

BREAKING: James Comey Calls for PresidentTrump's Assass*nation On Instagram!https://wltreport.com/2025/05/15/breaking-james-comey-calls-president-trumps-assassination-instagram/…#JamesComey#Pushvia@DailyNoahNews","May we wish what he calls for against PresidentTrumpcomes knocking at his door .

BREAKING: James Comey Calls for PresidentTrump's Assass*nation On Instagram!https://wltreport.com/2025/05/15/breaking-james-comey-calls-president-trumps-assassination-instagram/…#JamesComey#Pushvia@DailyNoahNews",,0,0,0,,/ForrestRebel/status/1923166433921413474
1923166154555642041,@KowalchikJM,Make a Difference & VOTE,2025-05-15T23:58:36.000Z,"One ofTrump’s newly welcomed Afrikaner ‘refugees’ tweeted that Jews are ‘dangerous and untrustworthy’https://newsbreakapp.com/n/117Tbl4V?s=a2&share_destination_id=MTc5NzI0MDgzLTE3NDczNTMzNDA5NzY=&pd=0CA6RXQy&hl=en_US…I'd say it's very OBVIOUS why Kleinhaus had to leave South Africa for ""safety reasons.""  Any response from Slumpy Don or Leavitt?","One ofTrump’s newly welcomed Afrikaner ‘refugees’ tweeted that Jews are ‘dangerous and untrustworthy’https://newsbreakapp.com/n/117Tbl4V?s=a2&share_destination_id=MTc5NzI0MDgzLTE3NDczNTMzNDA5NzY=&pd=0CA6RXQy&hl=en_US…I'd say it's very OBVIOUS why Kleinhaus had to leave South Africa for ""safety reasons.""  Any response from Slumpy Don or Leavitt?",,1,0,0,,/KowalchikJM/status/1923166154555642041
1923166222973337696,@SERRBEN72,Merben Baterna,2025-05-15T23:58:52.000Z,"Ethereum Stablecoin Volume Hits $908B ATH!Institutional demand surgingMeta & Stripe integrating stablesTrump’s USD1 mints $2BUSDC leads with $500B+ in tx volumeEthereum remains king of dollar-pegged assets

STABLECOINS ARE HEATING UP!#Ethereum#Stablecoins","Ethereum Stablecoin Volume Hits $908B ATH!Institutional demand surgingMeta & Stripe integrating stablesTrump’s USD1 mints $2BUSDC leads with $500B+ in tx volumeEthereum remains king of dollar-pegged assets

STABLECOINS ARE HEATING UP!#Ethereum#StablecoinsShow more",📈 💸 🏛 🪙 💥,1,2,1,https://pbs.twimg.com/media/GrB1Zv6aAAI28A_?format=jpg&name=360x360 https://pbs.twimg.com/media/GrB1Zv_aAAIQxZ5?format=png&name=small,/SERRBEN72/status/1923166222973337696
1923166352027611178,@Riollano63,flor riollano,2025-05-15T23:59:23.000Z,Trumpin Saudi Check out Bongino Inc's video!#TikTok,Trumpin Saudi Check out Bongino Inc's video!#TikTok,,0,0,0,,/Riollano63/status/1923166352027611178
1923166293299188137,@pdx64391533,p dx,2025-05-15T23:59:09.000Z,"Cost ofTrumpbirthday parade skyrocketing ‘up to $45m’ with 25 tanks added to celebrations, according to reports | The Independent","Cost ofTrumpbirthday parade skyrocketing ‘up to $45m’ with 25 tanks added to celebrations, according to reports | The Independent",,0,0,0,https://pbs.twimg.com/card_img/1966685193613262848/QF_Sz2id?format=jpg&name=small,/pdx64391533/status/1923166293299188137
1923166051182756215,@garcapital,GAR Capital,2025-05-15T23:58:11.000Z,Daily Market Recap:,Daily Market Recap:,,0,0,0,,/garcapital/status/1923166051182756215
1923166445262766307,@Jezzebelle2024,Jezzebelle,2025-05-15T23:59:45.000Z,Couldn’t agree more. An absolute dumbass beta boy would find something wrong with seashells and allowed things like J6 andTrump’s ass@ssin attempts happen with his agents involved. He’s past disgraceful!!,Couldn’t agree more. An absolute dumbass beta boy would find something wrong with seashells and allowed things like J6 andTrump’s ass@ssin attempts happen with his agents involved. He’s past disgraceful!!,,0,4,2,https://pbs.twimg.com/profile_images/1958515690350006272/LFIcj8L8_mini.jpg https://pbs.twimg.com/media/GrB0pw4XgAAHgez?format=jpg&name=small,/Jezzebelle2024/status/1923166445262766307
1923166386987106509,@myshedaccount,Ty,2025-05-15T23:59:32.000Z,I I hate hate you youtrumptrump,I I hate hate you youtrumptrump,,0,1,0,,/myshedaccount/status/1923166386987106509
1923165990457692617,@alienimmig56788,alienimmigrant,2025-05-15T23:57:57.000Z,"Trumpneeds to be reminded that the Arab countries are not the United States of America.Trumpmust urgently control and check his high appetite for greediness, acquisition, affluence, and absolute powers.","Trumpneeds to be reminded that the Arab countries are not the United States of America.Trumpmust urgently control and check his high appetite for greediness, acquisition, affluence, and absolute powers.",,0,0,0,,/alienimmig56788/status/1923165990457692617
1923166452812550443,@timethief,timethief Canadian forever,2025-05-15T23:59:47.000Z,A trip to Rome for state officials. Paid for in part by companies they regulate.Trumpis an emerging globalist when it suits him.,A trip to Rome for state officials. Paid for in part by companies they regulate.Trumpis an emerging globalist when it suits him.,🍁 🦫,0,2,0,https://pbs.twimg.com/card_img/1966321988659527680/JdA7cIh4?format=jpg&name=small,/timethief/status/1923166452812550443
1923166499205755183,@dcpetterson,DCPetterson.bsky.social,2025-05-15T23:59:58.000Z,Clearly.@jaketapperwill be reporting onTrump's dangerous psychotic decline and obvious derangement four months after he leaves office.,Clearly.@jaketapperwill be reporting onTrump's dangerous psychotic decline and obvious derangement four months after he leaves office.,,0,13,1,https://pbs.twimg.com/profile_images/1786951995980451840/LKrl00z0_mini.jpg,/dcpetterson/status/1923166499205755183
1923166450333720732,@JimPolk,Jim Polk,2025-05-15T23:59:47.000Z,Oil prices dip as PresidentTrumpsays US is 'getting close' to new Iran dealhttps://mol.im/a/14715481viahttps://dailym.ai/android,Oil prices dip as PresidentTrumpsays US is 'getting close' to new Iran dealhttps://mol.im/a/14715481viahttps://dailym.ai/android,,0,0,0,,/JimPolk/status/1923166450333720732
1923166073714561341,@arielpogimo,Butter of Lie Hunter ,2025-05-15T23:58:17.000Z,James Comey is just posting the number of times he had think aboutDonald Trump's crimes.,Replying to@alx,🔊,0,0,0,,/arielpogimo/status/1923166073714561341
