tweetId,UserScreenName,UserName,Timestamp,Text,Embedded_text,Emojis,Comments,Likes,Retweets,Image link,Tweet URL
1903234796936966531,@kypros_47,Kypros_47,2025-03-21T23:58:30.000Z,"""Trump administrationis revoking the legal status"" ... legal status. Let that sink in.",Replying to@CBSNews,,1,2,1,,/kypros_47/status/1903234796936966531
1903234787961110536,@JackGrodeska,Jack Grodeska,2025-03-21T23:58:28.000Z,"I think that he, and theTrump administrationjust doesn't care.",Replying to@juliettekayyem,,1,5,0,,/JackGrodeska/status/1903234787961110536
1903234726791729380,@RCBlueState,RedChick BlueState,2025-03-21T23:58:13.000Z,VDH explains Democrat strategy: Victor Davis Hanson: Democrats’ 10-Part Strategy to StoppingTrump(At A...https://youtu.be/D_QAGJ2XiiQ?si=5Pe7foyOy8gKuDna…via@YouTube,VDH explains Democrat strategy: Victor Davis Hanson: Democrats’ 10-Part Strategy to StoppingTrump(At A...https://youtu.be/D_QAGJ2XiiQ?si=5Pe7foyOy8gKuDna…via@YouTube,,0,0,0,https://pbs.twimg.com/card_img/1967967150792118272/F6zDo65-?format=jpg&name=240x240,/RCBlueState/status/1903234726791729380
1903234882865934832,@jimsamthomp,Jim Thompson,2025-03-21T23:58:51.000Z,I have no idea at this point why Zelensky would even answer the phone ifTrumpcalled. Ukraine needs to turn to Europe. Because thisTrump administrationhas nothing but bad intentions.,Replying to@Timodc,,0,5,1,,/jimsamthomp/status/1903234882865934832
1903234958006628463,@lisa_liberal,Liberal Lisa in Oklahoma,2025-03-21T23:59:09.000Z,"Donald Trumppardoned 1500 criminals who incited a deadly insurrection on our Capitol. Spread their shit on the Capitol walls, and hung a noose for Mike Pence.
But if you protest at a Tesla dealership you’re a domestic terrorist. 
GET FUCKING REAL.","Donald Trumppardoned 1500 criminals who incited a deadly insurrection on our Capitol. Spread their shit on the Capitol walls, and hung a noose for Mike Pence.
But if you protest at a Tesla dealership you’re a domestic terrorist. 
GET FUCKING REAL.",🖕,7,87,30,https://pbs.twimg.com/profile_images/1332231334761119745/wMzlpuHi_mini.jpg https://pbs.twimg.com/amplify_video_thumb/1903117606573461504/img/j5iUPaRDVSiI9ENy.jpg,/lisa_liberal/status/1903234958006628463
1903234923185778796,@JET24FOX66,JET/FOX/YourErie.com,2025-03-21T23:59:00.000Z,A federal appeals court Friday refused theTrump administration’s request to lift a judge’s order that officials reinstate teacher preparation grants in eight Democratic-led states that sued.,A federal appeals court Friday refused theTrump administration’s request to lift a judge’s order that officials reinstate teacher preparation grants in eight Democratic-led states that sued.,,0,0,0,,/JET24FOX66/status/1903234923185778796
1903234645493420306,@RafaelRufus1968,Rafael Rodriguez,2025-03-21T23:57:54.000Z,Memory loss. Invoke 25th.https://cnn.com/webview/politics/live-news/trump-administration-presidency-news-03-21-2025?cid=ios_app…,Memory loss. Invoke 25th.https://cnn.com/webview/politics/live-news/trump-administration-presidency-news-03-21-2025?cid=ios_app…,,0,0,0,,/RafaelRufus1968/status/1903234645493420306
1903234837650997616,@OttoTopci,🄾🅃🅃🄾 🅃🄾🄿🄲🄸 for Congress,2025-03-21T23:58:40.000Z,"I love how disappointedTrumpvoters will be to say goodbye to their friends & family.  

I drink their tears.  

U.S. to revoke legal status of more than a half-million migrants, urges them to self deport - CBS News","I love how disappointedTrumpvoters will be to say goodbye to their friends & family.  

I drink their tears.  

U.S. to revoke legal status of more than a half-million migrants, urges them to self deport - CBS News",,1,5,3,,/OttoTopci/status/1903234837650997616
1903234974829990296,@McDuB126,MIKDUB,2025-03-21T23:59:13.000Z,"So now, not only are Republicans terrified of convicted felonTrump, but they are also terrified of their own constituents.","So now, not only are Republicans terrified of convicted felonTrump, but they are also terrified of their own constituents.",🍀 🌊,0,9,5,,/McDuB126/status/1903234974829990296
1903234979116490897,@TheEllenDumm,Ellen Dumm,2025-03-21T23:59:14.000Z,"Reality Check: People just think you're a dick Elmo. 

FBI Finds No Evidence That Tesla Attacks Are Coordinated, DespiteTrumpand Musk’s Assertionshttps://thedailybeast.com/fbi-finds-no-evidence-that-tesla-attacks-are-coordinated-despite-trump-and-musks-assertions/?via=desktop&source=twitter…via@thedailybeast","Reality Check: People just think you're a dick Elmo. 

FBI Finds No Evidence That Tesla Attacks Are Coordinated, DespiteTrumpand Musk’s Assertionshttps://thedailybeast.com/fbi-finds-no-evidence-that-tesla-attacks-are-coordinated-despite-trump-and-musks-assertions/?via=desktop&source=twitter…via@thedailybeast",,0,0,0,,/TheEllenDumm/status/1903234979116490897
1903234715399692694,@DebHoutman7,Debi,2025-03-21T23:58:11.000Z,"Becausetrumpthought he stacked the deck in his favor- some people actually believe in the constitution/freedom+the oath of office they took WHICH IS SERIOUSLY “dah” PROFESSIONAL@josevigay1(my mom fell,my son brought me home one early)","Becausetrumpthought he stacked the deck in his favor- some people actually believe in the constitution/freedom+the oath of office they took WHICH IS SERIOUSLY “dah” PROFESSIONAL@josevigay1(my mom fell,my son brought me home one early)",🦋,0,0,1,https://pbs.twimg.com/profile_images/1936002956333080576/kqqe2iWO_mini.jpg https://pbs.twimg.com/profile_images/1955359038532653056/OSHY3ewP_bigger.jpg https://pbs.twimg.com/media/GmalU_xa8AQI-xI?format=jpg&name=small,/DebHoutman7/status/1903234715399692694
1903235090697592998,@Cassian_Andor_1,Cassian Andor of Rebel Alliance vs Emperor Trump,2025-03-21T23:59:40.000Z,This Musk /Trumpdictatorship  is pure evil. Now they threaten to halt all Social Security payments if the judge won’t allow them to break the law.TrumpAdmin Threatens to Stop Social Security If DOGE Can't Have Personal Data - Rolling Stone,This Musk /Trumpdictatorship  is pure evil. Now they threaten to halt all Social Security payments if the judge won’t allow them to break the law.TrumpAdmin Threatens to Stop Social Security If DOGE Can't Have Personal Data - Rolling Stone,,0,0,0,https://pbs.twimg.com/card_img/1965590942338920449/hGgHiEPJ?format=jpg&name=small,/Cassian_Andor_1/status/1903235090697592998
1903234944832258388,@HonkyTonker69,@HonkyTonker69,2025-03-21T23:59:05.000Z,"Tim Wallyalz says he can kick the ass of mostTrumpsupporters.  
Well TIM, 
Come to#Wisconsinand#GETYOUSOME!!!","Tim Wallyalz says he can kick the ass of mostTrumpsupporters.  
Well TIM, 
Come to#Wisconsinand#GETYOUSOME!!!",,0,1,0,,/DwaynePotter11/status/1903234944832258388
1903234797545095637,@joebrooks,Joe Brooks,2025-03-21T23:58:30.000Z,"Columbia University has agreed to meet certain demands from theTrump administrationas part of an effort to restore $400 million in federal funding. Key stipulations include a mask ban, disciplinary actions against protesters, and admissions ref… article]","Columbia University has agreed to meet certain demands from theTrump administrationas part of an effort to restore $400 million in federal funding. Key stipulations include a mask ban, disciplinary actions against protesters, and admissions ref… article]",,0,0,0,,/joebrooks/status/1903234797545095637
1903234723675017508,@MrSears92,Ambivert,2025-03-21T23:58:13.000Z,Trumpain’t fucking off,Trumpain’t fucking off,😂,0,0,0,https://pbs.twimg.com/profile_images/1617634745348661249/6YmPYpNd_mini.jpg,/MrSears92/status/1903234723675017508
1903234998049612216,@TonyD11426640,Tony D.,2025-03-21T23:59:18.000Z,Maybetrumpwill hire him,Maybetrumpwill hire him,,0,1,1,https://pbs.twimg.com/profile_images/1715453481727746048/WZZkYsVu_mini.jpg,/TonyD11426640/status/1903234998049612216
1903235085383377043,@G_P_Capital,Geopolitical Capital,2025-03-21T23:59:39.000Z,"Columbia University agrees toTrump administration’s demands after funding cut.

Columbia University announced Friday that it has agreed to a set of demands from theTrump administrationin an effort to initiate negotiations to reinstate $400 million in federal funding.","Columbia University agrees toTrump administration’s demands after funding cut.

Columbia University announced Friday that it has agreed to a set of demands from theTrump administrationin an effort to initiate negotiations to reinstate $400 million in federal funding.",🚨,0,0,0,https://pbs.twimg.com/media/GmmmOHeaEAERPJ-?format=jpg&name=small,/G_P_Capital/status/1903235085383377043
1903235066798448731,@BikersFreedom,Bikers for Freedom,2025-03-21T23:59:34.000Z,This is total misinformation. PresidentTrumphas not declared war on Russia.Trumpgave the Houthis an opportunity to stop attacking American ships.Trumpgave Iran an opportunity to stop funding these Houthis attacks. The USA was justified to strike.,This is total misinformation. PresidentTrumphas not declared war on Russia.Trumpgave the Houthis an opportunity to stop attacking American ships.Trumpgave Iran an opportunity to stop funding these Houthis attacks. The USA was justified to strike.,,0,0,0,,/BikersFreedom/status/1903235066798448731
1903234611305472030,@Sarrah_USA,Sarah,2025-03-21T23:57:46.000Z,Can i get Good morning,Can i get Good morning,⚡,15,11,0,,/Sarrah_USA/status/1903234611305472030
1903234847704834247,@BarryBleunNila2,SammieSam,2025-03-21T23:58:42.000Z,"15 years ago today, Democrats passed the life-saving Patient Protection and Affordable Care Act without one Republican vote. 

Meanwhile,Trumphas ""concepts of a plan""...#ACASavesLives#SheShed","15 years ago today, Democrats passed the life-saving Patient Protection and Affordable Care Act without one Republican vote. 

Meanwhile,Trumphas ""concepts of a plan""...#ACASavesLives#SheShed",🖤 🫦 🫦 🖤,0,3,3,https://pbs.twimg.com/ext_tw_video_thumb/1903234797800976384/pu/img/8Q4izrvJ2UbAft4K.jpg,/BarryBleunNila2/status/1903234847704834247
1903234706180571634,@AndersonMo6080,Monica Anderson,2025-03-21T23:58:09.000Z,Breaking:TRUMP'S CRYPTO PROJECT HITS $550M.....,Breaking:TRUMP'S CRYPTO PROJECT HITS $550M.....,,0,1,1,https://pbs.twimg.com/ext_tw_video_thumb/1903234664879333377/pu/img/OHcOwM0X3kOv4lf1.jpg,/AndersonMo6080/status/1903234706180571634
1903234877698478297,@johnkouters,Johnkouters,2025-03-21T23:58:49.000Z,James Carville:TrumpJust Wants Your Money...Stupidhttps://youtu.be/mPwVBz1NipY?si=sSJ-dV1VIZDnLrjZ…via@YouTube,James Carville:TrumpJust Wants Your Money...Stupidhttps://youtu.be/mPwVBz1NipY?si=sSJ-dV1VIZDnLrjZ…via@YouTube,,0,0,0,,/johnkouters/status/1903234877698478297
1903234882995880414,@HealthMav,NewsToday,2025-03-21T23:58:51.000Z,"530,000 Migrants FACE DEPORTATION!Trump's SHOCKING Move!
Watch:https://youtu.be/Aeu_YUrns0A#News#BreakingNews#DonaldTrump#JoeBiden#Cubans","530,000 Migrants FACE DEPORTATION!Trump's SHOCKING Move!
Watch:https://youtu.be/Aeu_YUrns0A#News#BreakingNews#DonaldTrump#JoeBiden#Cubans",,0,0,0,,/HealthMav/status/1903234882995880414
1903235041314120170,@wdunlap,Wayne Dunlap,2025-03-21T23:59:28.000Z,"Jan6 is staged outrage from the Left about the Capitol 3-hour demonstration -ushered in by Capitol Police who opened the door & were ordered to stand down, likely incited by our FBI, &Trump’s extra security was denied by Pelosi. 2 people killed where unarmed women murdered.",Replying to@NobleOneand@AGPamBondi,,1,13,3,https://pbs.twimg.com/media/GmmmLqOaEAAozpB?format=jpg&name=small,/wdunlap/status/1903235041314120170
1903234997391331408,@Heather15814898,Heather F.C.,2025-03-21T23:59:18.000Z,"TrumpIs Just Bush In A Red Hat, by@caitoz","TrumpIs Just Bush In A Red Hat, by@caitoz",💧,0,0,1,,/Heather15814898/status/1903234997391331408
1903234647729033600,@sfexaminer,SF Examiner,2025-03-21T23:57:55.000Z,"“We fully intend to fight them, and we fully intend to win,” Pelosi said of theTrump administration.","“We fully intend to fight them, and we fully intend to win,” Pelosi said of theTrump administration.",,0,4,2,https://pbs.twimg.com/card_img/1966719902422556673/usukC0ww?format=jpg&name=small,/sfexaminer/status/1903234647729033600
1903234571426205998,@_kelly_neill_,Kelly Neill,2025-03-21T23:57:36.000Z,"Probably for the same reasons theTrump administrationtried within days to rehire NNSA, USDA, and VA employees it fired last month.

Which is to say that someone realized that taking an axe to what works and is reasonable is itself incompetence.",Replying to@rjleedesign,,1,3,0,,/_kelly_neill_/status/1903234571426205998
1903234834547298792,@AhBrightWings,AhBrightWings,2025-03-21T23:58:39.000Z,"JHC. STOP caving into this felonious bully. Those who do are creating a monster!

Columbia Concedes toTrump’s Demands After Federal Funds Are Stripped","JHC. STOP caving into this felonious bully. Those who do are creating a monster!

Columbia Concedes toTrump’s Demands After Federal Funds Are Stripped",,0,0,0,https://pbs.twimg.com/card_img/1965341751696363522/P3tZ-KWp?format=jpg&name=small,/AhBrightWings/status/1903234834547298792
1903234812367733118,@BikersFreedom,Bikers for Freedom,2025-03-21T23:58:34.000Z,"Bring down all the Rouge Judges promoting law fair.  TheTrumpagenda was voted for by the American People on November 5, 2024. A referendum should be issued giving the American People a choice of which Judges should be removed. Government by the People.https://youtu.be/t23xBu8sU-w?si=YZLyk4vKqD2PE3qg…","Bring down all the Rouge Judges promoting law fair.  TheTrumpagenda was voted for by the American People on November 5, 2024. A referendum should be issued giving the American People a choice of which Judges should be removed. Government by the People.https://youtu.be/t23xBu8sU-w?si=YZLyk4vKqD2PE3qg…",,0,0,0,,/BikersFreedom/status/1903234812367733118
1903234930999742744,@jjauthor,Janie Johnson - America is Exceptional,2025-03-21T23:59:02.000Z,Trumpsays he'll cover pay of astronauts who received no overtime after being stranded in space for 9 months: 'Out of my own pocket',Trumpsays he'll cover pay of astronauts who received no overtime after being stranded in space for 9 months: 'Out of my own pocket',,1,18,6,https://pbs.twimg.com/card_img/1967031498886049792/psL23iBW?format=jpg&name=small,/jjauthor/status/1903234930999742744
1903235006274679199,@polydyor,Poly,2025-03-21T23:59:20.000Z,"$25 FAST• Follow me 
• Notifs on 
•Addy + retweet","$25 FAST• Follow me 
• Notifs on 
•Addy + retweet",⚡,2,3,3,,/polydyor/status/1903235006274679199
1903234769757892937,@zefishguy,Fishy_DG,2025-03-21T23:58:24.000Z,Kinda crazyTrumpis gonna side with Russia and just let them get their way in Ukraine.Trumpgonna fuck around and let Putin rebuild Prussia,Kinda crazyTrumpis gonna side with Russia and just let them get their way in Ukraine.Trumpgonna fuck around and let Putin rebuild Prussia,😂 😂,0,0,0,,/zefishguy/status/1903234769757892937
1903235061010346208,@11Seferov,Murad,2025-03-21T23:59:33.000Z,"PresidentTrumpcommented on Gaza's potential on his first day: ""Gaza is fascinating, with its prime location by the sea and great weather. There are amazing possibilities for development.""","PresidentTrumpcommented on Gaza's potential on his first day: ""Gaza is fascinating, with its prime location by the sea and great weather. There are amazing possibilities for development.""",,0,2,2,https://pbs.twimg.com/media/GmmmGadaQAABuu3?format=jpg&name=small,/11Seferov/status/1903235061010346208
1903235086834610300,@chuck2942,Charlie,2025-03-21T23:59:39.000Z,"Joy Reid and her Don lemon sqeeze. Now , there’s a special duo. Feces in a toilet bowl. Those who practiceTrumpDerangement Syndrome are just plain sick individuals. Republicans will no doubt upset the 2026 midterms in their favor. Dems in total disarray!","Joy Reid and her Don lemon sqeeze. Now , there’s a special duo. Feces in a toilet bowl. Those who practiceTrumpDerangement Syndrome are just plain sick individuals. Republicans will no doubt upset the 2026 midterms in their favor. Dems in total disarray!",🖕,0,2,0,,/chuck2942/status/1903235086834610300
1903234959109689420,@toppersuncle,p,2025-03-21T23:59:09.000Z,"this isdonald trump’s america, and addison rae is our pop star. (predicting a #1 debut before May 31).","this isdonald trump’s america, and addison rae is our pop star. (predicting a #1 debut before May 31).",,0,0,0,,/toppersuncle/status/1903234959109689420
1903234657040339374,@abe031707,Lisa,2025-03-21T23:57:57.000Z,"Trumprevokes legal status for 530,000 Cubans, Haitians, Nicaraguans, and Venezuelans - BBC News.  what a selfish egomaniachttps://apple.news/AwRQ6H0GgQ6aVVTDCJEIVWg…","Trumprevokes legal status for 530,000 Cubans, Haitians, Nicaraguans, and Venezuelans - BBC News.  what a selfish egomaniachttps://apple.news/AwRQ6H0GgQ6aVVTDCJEIVWg…",,0,0,0,,/abe031707/status/1903234657040339374
1903235136487035004,@XPaymentsSoon,XXX XXX XXX XXX,2025-03-21T23:59:51.000Z,Brighter times ahead$XRP$XLM$XCN$XDC$ONDO$HBAR$ADA$LINK$BTC$ETH$DOGE$SUI$SEI$QNT$VVV$SUPER$RNDR$FET$ALGO$ACH$SWFTC$SHIB$GIGA$TOSHI$JASMY$AERO$SOL$TAO$PENGU$SPX$TRX$BNB$PI$TRUMP$XYO$FAT$PEPE$BCH$ICP$S$ALGO$ENA$OM$TRU$ATH$TNSR,Brighter times ahead$XRP$XLM$XCN$XDC$ONDO$HBAR$ADA$LINK$BTC$ETH$DOGE$SUI$SEI$QNT$VVV$SUPER$RNDR$FET$ALGO$ACH$SWFTC$SHIB$GIGA$TOSHI$JASMY$AERO$SOL$TAO$PENGU$SPX$TRX$BNB$PI$TRUMP$XYO$FAT$PEPE$BCH$ICP$S$ALGO$ENA$OM$TRU$ATH$TNSRShow more,🤍 💎,2,3,2,https://pbs.twimg.com/media/GmmmNAfawAAaGGK?format=jpg&name=small,/XPaymentsSoon/status/1903235136487035004
1903235138982646236,@Andy44013911,Andy,2025-03-21T23:59:52.000Z,"Are all these government decisions announced byTrump, Trumps idea, or has it all been raddified by congress","Are all these government decisions announced byTrump, Trumps idea, or has it all been raddified by congress",🤔,0,0,0,,/Andy44013911/status/1903235138982646236
1903235062428209192,@Medcherif,Mohamed Cherif,2025-03-21T23:59:33.000Z,One of achievements of the war criminalDonald Trumpin Gaza.@RealAlexJones@realDonaldTrump@elonmusk#GazaGenocide#gaza_starvation#WestBankGenocide,One of achievements of the war criminalDonald Trumpin Gaza.@RealAlexJones@realDonaldTrump@elonmusk#GazaGenocide#gaza_starvation#WestBankGenocide,,0,2,0,https://pbs.twimg.com/profile_images/1781706900674879488/Qa7pGpTi_mini.jpg https://pbs.twimg.com/amplify_video_thumb/1902672780237193216/img/-8w9SQb181Pip1ym.jpg,/Medcherif/status/1903235062428209192
1903234739571408929,@AndreasBoos,JustSearchin,2025-03-21T23:58:16.000Z,"Trumprevoking legal status for 530,000 Cubans, Haitians, Nicaraguans and Venezuelans - BBC Newshttps://apple.news/AwRQ6H0GgQ6aVVTDCJEIVWg…","Trumprevoking legal status for 530,000 Cubans, Haitians, Nicaraguans and Venezuelans - BBC Newshttps://apple.news/AwRQ6H0GgQ6aVVTDCJEIVWg…",,0,0,0,,/AndreasBoos/status/1903234739571408929
1903234861391024433,@SocomRaiders,Maverick,2025-03-21T23:58:46.000Z,"The ReasonTrumpis so angry about Tesla protest and doesn't want to lose Elon, is be/c Elon gave him $250 million, for that,Trumpmade him the unofficial Chief Operating Officer and Ax Man reporting only toTrump. While Elon sleeps on his cot,Trumpgets to play golf everyday.","The ReasonTrumpis so angry about Tesla protest and doesn't want to lose Elon, is be/c Elon gave him $250 million, for that,Trumpmade him the unofficial Chief Operating Officer and Ax Man reporting only toTrump. While Elon sleeps on his cot,Trumpgets to play golf everyday.",,2,1,0,,/SocomRaiders/status/1903234861391024433
1903234495509381584,Venezuela Law @VenezueLawyers LegalTech Firm,Venezuela Law @VenezueLawyers LegalTech Firm,2025-03-21T23:57:18.000Z,"TheTrump administrationplans to cancel a parole program for Cuba, Haiti, Nicaragua, and Venezuela immigrants. ... Learn more about Bloomberg Law or ...https://ift.tt/YAFurN5@raymondorta","TheTrump administrationplans to cancel a parole program for Cuba, Haiti, Nicaragua, and Venezuela immigrants. ... Learn more about Bloomberg Law or ...https://ift.tt/YAFurN5@raymondorta",,0,0,0,,/VenezueLawyers/status/1903234495509381584
1903234984959414503,@veraliberta22,vera liberta,2025-03-21T23:59:15.000Z,"Insulting:tRumpand GOP just can't stop bullshitting people & screwing the little guy. Lower income SS already aren't taxed, this benefits wealthy SS recipients.!
New Bill Promises Tax-Free Social Security Benefits Without Program Cutshttps://msn.com/en-us/money/personalfinance/new-bill-promises-tax-free-social-security-benefits-without-program-cuts/vi-AA1BoK4g?ocid=socialshare…","Insulting:tRumpand GOP just can't stop bullshitting people & screwing the little guy. Lower income SS already aren't taxed, this benefits wealthy SS recipients.!
New Bill Promises Tax-Free Social Security Benefits Without Program Cutshttps://msn.com/en-us/money/personalfinance/new-bill-promises-tax-free-social-security-benefits-without-program-cuts/vi-AA1BoK4g?ocid=socialshare…",,0,0,0,,/veraliberta22/status/1903234984959414503
1903235009223471484,@nean,neanderthal yabuki,2025-03-21T23:59:21.000Z,Federal judge questionsTrump's authority to deport migrants without due process - YouTube,Federal judge questionsTrump's authority to deport migrants without due process - YouTube,,0,0,0,,/nean/status/1903235009223471484
1903234844282503263,@PES712,Patti712,2025-03-21T23:58:41.000Z,Trumpsuggests 'terrorist thugs' destroying Teslas should go to prison in El Salvador | Just The News,Trumpsuggests 'terrorist thugs' destroying Teslas should go to prison in El Salvador | Just The News,💯 💯 💯,0,0,0,https://pbs.twimg.com/card_img/1967646266839416832/QW_9iBKN?format=jpg&name=small,/PES712/status/1903234844282503263
1903234929632108839,@seangraf,Sean Graf,2025-03-21T23:59:02.000Z,"A History of the Alien Enemies Act of 1798https://nytimes.com/2025/03/21/us/politics/trump-alien-enemies-act-history.html?smid=tw-share…Before the currentTrump administration, the law had been invoked just three times.","A History of the Alien Enemies Act of 1798https://nytimes.com/2025/03/21/us/politics/trump-alien-enemies-act-history.html?smid=tw-share…Before the currentTrump administration, the law had been invoked just three times.",,0,0,0,,/seangraf/status/1903234929632108839
1903234956953874600,@dqc1985,David Carlisle,2025-03-21T23:59:08.000Z,Trumpsays he’s excited to attend the NCAA Wrestling Championships: “We’re going to the big fight!” Expect a high-energy appearance.#Trump#NCAAWrestling#WrestlingChampionships#CollegeSports@FoxNewsMore:,Trumpsays he’s excited to attend the NCAA Wrestling Championships: “We’re going to the big fight!” Expect a high-energy appearance.#Trump#NCAAWrestling#WrestlingChampionships#CollegeSports@FoxNewsMore:,,0,0,0,https://pbs.twimg.com/card_img/1966687010216722432/IJi96s9Z?format=jpg&name=small,/dqc1985/status/1903234956953874600
1903234944211796141,@Reaproy,Phil Robertson,2025-03-21T23:59:05.000Z,"Trump Administrationseems determined to starve poor Americans at a time when food prices are going through the roof.

USDA cancels $500M in food deliveries, leaving food banks scrambling","Trump Administrationseems determined to starve poor Americans at a time when food prices are going through the roof.

USDA cancels $500M in food deliveries, leaving food banks scrambling",,1,1,0,https://pbs.twimg.com/card_img/1966828198919819265/hPi9JJyf?format=jpg&name=small,/Reaproy/status/1903234944211796141
1903234874934432134,@fla25443,Jess,2025-03-21T23:58:49.000Z,Trumpwants to kill the CHIPS Act — says chipmakers are coming to the USA to avoid tariffs,Trumpwants to kill the CHIPS Act — says chipmakers are coming to the USA to avoid tariffs,,0,2,2,https://pbs.twimg.com/card_img/1965117532744155142/rE-AnXxa?format=jpg&name=small,/fla25443/status/1903234874934432134
1903234935277625479,@Cue8baal,TheodoreHagemann,2025-03-21T23:59:03.000Z,Columbia Caves toTrumpin First Stage of $430 Million Funding Fight,Columbia Caves toTrumpin First Stage of $430 Million Funding Fight,,0,0,0,,/Cue8baal/status/1903234935277625479
1903235043088273768,@profdwb1,Dan Baggs,2025-03-21T23:59:29.000Z,TrumpAdmin Promotes Pro-Life Perspective at UN Women's Meeting,TrumpAdmin Promotes Pro-Life Perspective at UN Women's Meeting,,0,0,0,,/profdwb1/status/1903235043088273768
1903234887240634631,@jjauthor,Janie Johnson - America is Exceptional,2025-03-21T23:58:52.000Z,Speaker Johnson says GOP looking at 'all available options' to address 'activist judges' opposingTrumphttps://foxnews.com/politics/speaker-johnson-says-gop-looking-all-available-options-address-activist-judges-opposing-trump…#FoxNews,Speaker Johnson says GOP looking at 'all available options' to address 'activist judges' opposingTrumphttps://foxnews.com/politics/speaker-johnson-says-gop-looking-all-available-options-address-activist-judges-opposing-trump…#FoxNews,,0,5,0,https://pbs.twimg.com/card_img/1966980422841118722/FUvJrPoS?format=jpg&name=small,/jjauthor/status/1903234887240634631
1903234845385293836,@CELB2000,CHRISTIE BIVINGS,2025-03-21T23:58:42.000Z,"And the ones that voted forTrump, aren't going to be happy about this.","And the ones that voted forTrump, aren't going to be happy about this.",,1,1,1,https://pbs.twimg.com/profile_images/1617634745348661249/6YmPYpNd_mini.jpg,/CELB2000/status/1903234845385293836
1903234487137468826,@Place123456,Thomas Murphy,2025-03-21T23:57:16.000Z,"https://nytimes.com/2025/03/21/nyregion/columbia-response-trump-demands.html?smid=nytcore-ios-share&referringSource=articleShare…via@NYTimesThis is fascism, folks, it is.","https://nytimes.com/2025/03/21/nyregion/columbia-response-trump-demands.html?smid=nytcore-ios-share&referringSource=articleShare…via@NYTimesThis is fascism, folks, it is.",,0,0,0,https://pbs.twimg.com/card_img/1968145006822092800/pZhj3x8W?format=jpg&name=small,/Place123456/status/1903234487137468826
