tweetId,UserScreenName,UserName,Timestamp,Text,Embedded_text,Emojis,Comments,Likes,Retweets,Image link,Tweet URL
1880042176240820538,@RadioRAMPA,Radio RAMPA,2025-01-16T23:59:18.000Z,"Mayor Eric Adams@NYCMayorto meet with President Elect@realDonaldTrumpon Friday. Here is statement from@Fabien_Levy: “ 
“Mayor Adams has made quite clear his willingness to work with President-electTrumpand his incoming administration on behalf of New Yorkers — and that","Mayor Eric Adams@NYCMayorto meet with President Elect@realDonaldTrumpon Friday. Here is statement from@Fabien_Levy: “ 
“Mayor Adams has made quite clear his willingness to work with President-electTrumpand his incoming administration on behalf of New Yorkers — and thatShow more",,0,0,0,,/RadioRAMPA/status/1880042176240820538
1880042284961632294,@psalmsgood,JOE BLESSINGS,2025-01-16T23:59:44.000Z,"Mike Johnson is following orders fromDonald Trumpwho believe that Americans are not worth his empathy. He cares more about Putin's sneeze, and Kim Jong Un round of lunch than helping Americans impacted by wildfire","Mike Johnson is following orders fromDonald Trumpwho believe that Americans are not worth his empathy. He cares more about Putin's sneeze, and Kim Jong Un round of lunch than helping Americans impacted by wildfire",,0,0,0,https://pbs.twimg.com/profile_images/1766653032983367680/xFjjY0tr_mini.jpg https://pbs.twimg.com/media/Ghc-mw_XYAALojm?format=jpg&name=small,/psalmsgood/status/1880042284961632294
1880042102345855414,@cllrjjames,Jeffrey James MBE OStJ FIWA,2025-01-16T23:59:01.000Z,An excellent article advising why US is a better bet for investment than the UK,An excellent article advising why US is a better bet for investment than the UK,,0,1,0,https://pbs.twimg.com/card_img/1967924613704200193/VCCkHIvJ?format=jpg&name=small,/cllrjjames/status/1880042102345855414
1880041896313266665,@jbjk216,Trump won_1776_Jen,2025-01-16T23:58:12.000Z,TREASON hold them legally accountable,TREASON hold them legally accountable,,0,1,0,https://pbs.twimg.com/profile_images/1948589109305638912/PyhKZekb_mini.jpg,/jbjk216/status/1880041896313266665
1880041986625008083,@MustangMan_TX,Texas,2025-01-16T23:58:33.000Z,"Why can’t the sheep wake up and see thatTrumpwas never a threat to democracy???
It was all a lie. Now the media and their political leaders are taking on a totally different tone!","Why can’t the sheep wake up and see thatTrumpwas never a threat to democracy???
It was all a lie. Now the media and their political leaders are taking on a totally different tone!",,1,24,2,,/MustangMan_TX/status/1880041986625008083
1879934596391006454,@Techmeme,Techmeme,2025-01-16T16:51:49.000Z,"Sources: crypto executives have offered input to David Sacks on a possibleTrumpEO that covers several areas of crypto policy, including a Bitcoin stockpile (@yaffebellany/ New York Times)https://nytimes.com/2025/01/16/technology/trump-bitcoin-stockpile.html…http://techmeme.com/250116/p37#a250116p37…","Sources: crypto executives have offered input to David Sacks on a possibleTrumpEO that covers several areas of crypto policy, including a Bitcoin stockpile (@yaffebellany/ New York Times)https://nytimes.com/2025/01/16/technology/trump-bitcoin-stockpile.html…http://techmeme.com/250116/p37#a250116p37…",,0,2,1,https://pbs.twimg.com/profile_images/1191943129823399936/ZvfTRAlg_mini.jpg https://pbs.twimg.com/media/GdsHsdtXgAAKf04?format=jpg&name=small,/Techmeme/status/1879934596391006454
1880042251566608563,@MDNiteOwl,Maryland Nite Owl,2025-01-16T23:59:36.000Z,FBI scraps DEI office in overhaul of woke policies afterTrumpwinhttps://mol.im/a/14294029via@MailOnline,FBI scraps DEI office in overhaul of woke policies afterTrumpwinhttps://mol.im/a/14294029via@MailOnline,,0,0,0,https://pbs.twimg.com/card_img/1966143744916258817/X_V2i350?format=jpg&name=small,/MDNiteOwl/status/1880042251566608563
1880042290301006122,@FishmanLevine,Lois Levine Fishman,2025-01-16T23:59:46.000Z,From a Snoop Dogg performance to brunch with Joe Rogan: Inside DC’s insaneTrumpinauguration partieshttps://msn.com/en-us/news/politics/from-a-snoop-dogg-performance-to-brunch-with-joe-rogan-inside-dc-s-insane-trump-inauguration-parties/ar-AA1xkLNt?ocid=socialshare…,From a Snoop Dogg performance to brunch with Joe Rogan: Inside DC’s insaneTrumpinauguration partieshttps://msn.com/en-us/news/politics/from-a-snoop-dogg-performance-to-brunch-with-joe-rogan-inside-dc-s-insane-trump-inauguration-parties/ar-AA1xkLNt?ocid=socialshare…,,0,0,0,,/FishmanLevine/status/1880042290301006122
1880042248131473521,@Ihelpu2c,PRESIDENT TRUMP THE BEST IS YET TO COME,2025-01-16T23:59:36.000Z,"As the  corrupt  Demo should be…..a  day of reckoning
is  a  time when the consequences for  a  course of mistakes or misdeeds are feltWHATS  THE  SAYING…THE  HUNTER  WILL  NOW  BE  THE  HUNTED@KashPatel","As the  corrupt  Demo should be…..a  day of reckoning
is  a  time when the consequences for  a  course of mistakes or misdeeds are feltWHATS  THE  SAYING…THE  HUNTER  WILL  NOW  BE  THE  HUNTED@KashPatel",❤ ‼ ‼,0,0,0,https://pbs.twimg.com/profile_images/1312545540694069250/uFTgY5Zb_mini.jpg https://pbs.twimg.com/media/GhbqlUsX0AA_sQz?format=jpg&name=small,/Ihelpu2c/status/1880042248131473521
1879759470051434697,@Techmeme,Techmeme,2025-01-16T05:15:56.000Z,"Sources: Satya Nadella and Brad Smith had lunch withTrump, Vance, and Musk at Mar-a-Lago on January 15; Microsoft says its two execs had a ""Productive meeting"" (Semafor)https://semafor.com/article/01/15/2025/trump-musk-dined-with-microsoft-ceo-satya-nadella-at-mar-a-lago…http://techmeme.com/250116/p1#a250116p1…","Sources: Satya Nadella and Brad Smith had lunch withTrump, Vance, and Musk at Mar-a-Lago on January 15; Microsoft says its two execs had a ""Productive meeting"" (Semafor)https://semafor.com/article/01/15/2025/trump-musk-dined-with-microsoft-ceo-satya-nadella-at-mar-a-lago…http://techmeme.com/250116/p1#a250116p1…",,0,3,2,https://pbs.twimg.com/profile_images/1191943129823399936/ZvfTRAlg_mini.jpg https://pbs.twimg.com/media/GdsHsdtXgAAKf04?format=jpg&name=small,/Techmeme/status/1879759470051434697
1879998985554805041,@Techmeme,Techmeme,2025-01-16T21:07:41.000Z,Sources: Zuckerberg told Stephen Miller that he would do nothing to obstructTrump's agenda and blamed Sheryl Sandberg for an inclusivity initiative at Facebook (New York Times)https://nytimes.com/2025/01/16/us/politics/stephen-miller-trump.html?unlocked_article_code=1.pk4.bIb0.BWyB-KWYxZ6u&smid=url-share…http://techmeme.com/250116/p46#a250116p46…,Sources: Zuckerberg told Stephen Miller that he would do nothing to obstructTrump's agenda and blamed Sheryl Sandberg for an inclusivity initiative at Facebook (New York Times)https://nytimes.com/2025/01/16/us/politics/stephen-miller-trump.html?unlocked_article_code=1.pk4.bIb0.BWyB-KWYxZ6u&smid=url-share…http://techmeme.com/250116/p46#a250116p46…,,1,4,1,https://pbs.twimg.com/profile_images/1191943129823399936/ZvfTRAlg_mini.jpg https://pbs.twimg.com/media/GdsHsdtXgAAKf04?format=jpg&name=small,/Techmeme/status/1879998985554805041
1880042221048852514,@CraigABrill,Craig for Common Sense,2025-01-16T23:59:29.000Z,"Yet she sits in the senate where they sign NDA’s for this behavior and pay out millions of $$$’s and she says nothing! 

EveryTrumpnominee should register as democrats","Yet she sits in the senate where they sign NDA’s for this behavior and pay out millions of $$$’s and she says nothing! 

EveryTrumpnominee should register as democrats",,0,1,0,https://pbs.twimg.com/profile_images/1614070753221087233/QDjmvA1o_mini.jpg https://pbs.twimg.com/ext_tw_video_thumb/1879925295815196672/pu/img/9FpJWU7sXZcQCeE6.jpg,/CraigABrill/status/1880042221048852514
1880042154346922114,@emmagf,Emma G. Fitzsimmons,2025-01-16T23:59:13.000Z,Eric Adams Heads to Mar-a-Lago to Meet WithTrump:,Eric Adams Heads to Mar-a-Lago to Meet WithTrump:,,1,2,1,,/emmagf/status/1880042154346922114
1880041993524638151,@amgoth2000,amgoth2000,2025-01-16T23:58:35.000Z,"No one saw this coming. Shocking really, how could the brightest minds in the known & unknown universe not see this coming down the pike? Oh wait, people did see this, thoughttRumpwould pass them by & just hurt other people. Nope, he only cares about himself & no one else.","No one saw this coming. Shocking really, how could the brightest minds in the known & unknown universe not see this coming down the pike? Oh wait, people did see this, thoughttRumpwould pass them by & just hurt other people. Nope, he only cares about himself & no one else.",,0,0,0,https://pbs.twimg.com/profile_images/879061537423544320/99vcNM5N_mini.jpg,/amgoth2000/status/1880041993524638151
1880042268264161685,@nickitellem,,2025-01-16T23:59:40.000Z,"RedNote indirectly allowing Americans to poison Chinese culture. We getting our lick back for Tiktok propaganda. 

I love how everything is unfolding exactly how I thought it would.Trump’s presidency about to be FUNNY for idiots taking L’s. FAFO season has commenced.https://x.com/Chen_YenHan/st/Chen_YenHan/status/1879661965544751109…","RedNote indirectly allowing Americans to poison Chinese culture. We getting our lick back for Tiktok propaganda. 

I love how everything is unfolding exactly how I thought it would.Trump’s presidency about to be FUNNY for idiots taking L’s. FAFO season has commenced.https://x.com/Chen_YenHan/st/Chen_YenHan/status/1879661965544751109…",⚡ 🤭,0,1,1,,/nickitellem/status/1880042268264161685
1880042247749791992,@heldermedeiros,H3MMM,2025-01-16T23:59:36.000Z,Trump’s potential Treasury secretary pick ‘sees no reason’ for US CBDC,Trump’s potential Treasury secretary pick ‘sees no reason’ for US CBDC,🍷,0,1,1,https://pbs.twimg.com/card_img/1965773085413416960/3q2YvqAw?format=jpg&name=small,/heldermedeiros/status/1880042247749791992
1880042180544483383,@StrickerNonpro,Andrea Stricker,2025-01-16T23:59:19.000Z,"“Now thatTrump, maximum pressure, and potentially military strikes against Tehran’s nuclear sites may be back on the table, the regime is seeking to avert their consequences. It knows that the era of Western appeasement is over.” 2/",Replying to@StrickerNonpro,,0,5,3,https://pbs.twimg.com/profile_images/1931058228256739328/RLn7KASm_bigger.jpg,/StrickerNonpro/status/1880042180544483383
1880012618192003076,@Techmeme,Techmeme,2025-01-16T22:01:51.000Z,"Trumpplans to nominate Olivia Trusty, policy director for a US Senate committee, as the third Republican member of the FCC's five-person commission (@matthewkeyslive/ The Desk)https://thedesk.net/2025/01/trump-nominates-olivia-trusty-fcc-commissioner/…http://techmeme.com/250116/p48#a250116p48…","Trumpplans to nominate Olivia Trusty, policy director for a US Senate committee, as the third Republican member of the FCC's five-person commission (@matthewkeyslive/ The Desk)https://thedesk.net/2025/01/trump-nominates-olivia-trusty-fcc-commissioner/…http://techmeme.com/250116/p48#a250116p48…",,0,0,1,https://pbs.twimg.com/profile_images/1191943129823399936/ZvfTRAlg_mini.jpg https://pbs.twimg.com/media/GdsHsdtXgAAKf04?format=jpg&name=small,/Techmeme/status/1880012618192003076
1879782223886627270,@Techmeme,Techmeme,2025-01-16T06:46:21.000Z,"Sources: TikTok CEO Shou Chew plans to attendTrump's inauguration after being invited to sit on the dais, joining Mark Zuckerberg and Elon Musk at the event (New York Times)https://nytimes.com/2025/01/15/us/politics/tiktok-ceo-trump-inauguration.html?unlocked_article_code=1.pk4.1cxk.7kzd1sk3f5go&smid=nytcore-ios-share&referringSource=articleShare…http://techmeme.com/250116/p5#a250116p5…","Sources: TikTok CEO Shou Chew plans to attendTrump's inauguration after being invited to sit on the dais, joining Mark Zuckerberg and Elon Musk at the event (New York Times)https://nytimes.com/2025/01/15/us/politics/tiktok-ceo-trump-inauguration.html?unlocked_article_code=1.pk4.1cxk.7kzd1sk3f5go&smid=nytcore-ios-share&referringSource=articleShare…http://techmeme.com/250116/p5#a250116p5…",,0,5,6,https://pbs.twimg.com/profile_images/1191943129823399936/ZvfTRAlg_mini.jpg https://pbs.twimg.com/media/GdsHsdtXgAAKf04?format=jpg&name=small,/Techmeme/status/1879782223886627270
1879913678616838489,@s8n,Satan,2025-01-16T15:28:42.000Z,"oh it'strumpderangement syndrome, basically when someone's hate fortrumpoutweighs their love for anything else - seen some humans get lost in that anger, not a great look",Replying to@75millionen@elonmuskand@realDonaldTrump,,4,2,0,,/s8n/status/1879913678616838489
1880404533706387805,@TrumpPetsX,TrumpPetsXDog Cat Animal Rescuer & Lover,2025-01-17T23:59:11.000Z,"PetLovers!@TwinsBus@StellaArtoisGB
@RondaR3023@TrumpPetsX@Dodyalx@Katie10_97@KyleCastel2666@tonymc42@Atp1958Tony@cleansniper45@TrumpsAmerica88@burleson464721@X4MAGA@MAGA_MOUSE_@Gentleman_Jnr@Satan__theDevil@notmrbill069@ArmandKleinX@mkotts_nary@weedoggymum","PetLovers!@TwinsBus@StellaArtoisGB
@RondaR3023@TrumpPetsX@Dodyalx@Katie10_97@KyleCastel2666@tonymc42@Atp1958Tony@cleansniper45@TrumpsAmerica88@burleson464721@X4MAGA@MAGA_MOUSE_@Gentleman_Jnr@Satan__theDevil@notmrbill069@ArmandKleinX@mkotts_nary@weedoggymum",🐾 🐾 🐾 🐾,16,49,37,https://pbs.twimg.com/ext_tw_video_thumb/1880404402235703296/pu/img/Xwe_E5BeKsfja2gK.jpg,/TrumpPetsX/status/1880404533706387805
1880404577377481129,@StaciBryant133,Staci Bryant,2025-01-17T23:59:22.000Z,These people are not well. And when they realize but nothing can stopTrumpor the people behind him? Their heads might literally start exploding all over the country.Donald Trumpwill be inaugurated. He will be the next president of this country. And a reckoning is coming.,Replying to@ImMeme0,,1,63,22,https://pbs.twimg.com/amplify_video_thumb/1880404474730065920/img/aHEM8lPGJvGlKoot.jpg,/StaciBryant133/status/1880404577377481129
1880404482389078037,@TaraSetmayer,Tara Setmayer (meet me there!),2025-01-17T23:58:59.000Z,"Coming up at 7pm on@thereidoutto discussTrump’s plans for day one & more. 
Tune in!@senecaprojectus","Coming up at 7pm on@thereidoutto discussTrump’s plans for day one & more. 
Tune in!@senecaprojectus",🦋 🦋,5,45,11,,/TaraSetmayer/status/1880404482389078037
1880404444283826391,@reproforall,Reproductive Freedom for All,2025-01-17T23:58:50.000Z,"FromTrump’s anti-abortion cabinet picks to the GOP’s dangerous legislation, extremist Republicans are totally out of step with the American people. 

The good news is we’re ready. We’re marching in the streets tomorrow, and we won’t stop organizing .@mintimmon@DeadlineWH","FromTrump’s anti-abortion cabinet picks to the GOP’s dangerous legislation, extremist Republicans are totally out of step with the American people. 

The good news is we’re ready. We’re marching in the streets tomorrow, and we won’t stop organizing .@mintimmon@DeadlineWH",,1,21,15,https://pbs.twimg.com/ext_tw_video_thumb/1880403981970669568/pu/img/Efmjz_y4ZCOPlbmW.jpg,/reproforall/status/1880404444283826391
1880404523442905218,@16campaignbites,Chris Lamb,2025-01-17T23:59:09.000Z,"Trumpspokesman B.S. Malarkey saidDonald Trumpwill be in Los Angeles to help with the fire victims as he helped with hurricane victims in Puerto Rico when he was president. “Mr.Trumpwill throw paper towels at the fire victims,"" Malarkey said.",Replying to@morgfair,,2,5,4,,/16campaignbites/status/1880404523442905218
1880404696357290278,@Joanne60183156,Joanne,2025-01-17T23:59:50.000Z,TikTok CEO Chou  Zi Chow Thanks PresidentTrumpfor working to find a solution to keep TilTok in the US,TikTok CEO Chou  Zi Chow Thanks PresidentTrumpfor working to find a solution to keep TilTok in the US,,6,56,34,https://pbs.twimg.com/amplify_video_thumb/1880404622885396480/img/acqCmNIL65PmnJiw.jpg,/Joanne60183156/status/1880404696357290278
1880404510146805858,@TheLeadCNN,The Lead CNN,2025-01-17T23:59:06.000Z,"Sen. Gillibrand on her biggest questions forTrumpnominees
Watch the full video here:https://tinyurl.com/2utz65wx","Sen. Gillibrand on her biggest questions forTrumpnominees
Watch the full video here:https://tinyurl.com/2utz65wx",,40,42,31,https://pbs.twimg.com/amplify_video_thumb/1880400827463999488/img/JAklcuf5cMJbgcDA.jpg,/TheLeadCNN/status/1880404510146805858
1880404406308598172,@hunt1931,Hunter,2025-01-17T23:58:41.000Z,Trumpis taking the seat again and is bullish on Crypto. 2025 will be the year where real memes with meaning succeed. Why hold for a 3x when we can hold for a 100x or lots more.$COGNIS COMINGhttp://t.me/cognitivecrypt…https://t.me/cognitivecrypto/61778…,Trumpis taking the seat again and is bullish on Crypto. 2025 will be the year where real memes with meaning succeed. Why hold for a 3x when we can hold for a 100x or lots more.$COGNIS COMINGhttp://t.me/cognitivecrypt…https://t.me/cognitivecrypto/61778…,,6,6,4,https://pbs.twimg.com/media/GhiJ1fmXIAAkY1j?format=jpg&name=small,/hunt1931/status/1880404406308598172
1880404397944873015,@TheLeadCNN,The Lead CNN,2025-01-17T23:58:39.000Z,"Sen. Kim on issues where he'll work withTrump's nominees
Watch the full video here:https://tinyurl.com/3kh9p2r3","Sen. Kim on issues where he'll work withTrump's nominees
Watch the full video here:https://tinyurl.com/3kh9p2r3",,23,27,9,https://pbs.twimg.com/amplify_video_thumb/1880400827594027008/img/5p9w4tR9jOJnAMia.jpg,/TheLeadCNN/status/1880404397944873015
1880404567030133130,@NesaraGesara0,XRP NESARA-GESARA QFS 3.0,2025-01-17T23:59:19.000Z,"JUST IN:Official portrait of the 47th President of the United States,Donald Trump.","JUST IN:Official portrait of the 47th President of the United States,Donald Trump.",,4,44,16,https://pbs.twimg.com/media/GhiJ-3rXoAA3eHU?format=jpg&name=small,/NesaraGesara0/status/1880404567030133130
1880404390709981588,@aintscarylarry,Scary Larry,2025-01-17T23:58:37.000Z,"Oh now I get it.trumpmoved his inauguration inside so he won’t have to waddle around out in the cold, because he’s afraid people will see the steam rising from his totally piss-saturated and feces-encrusted diaper.","Oh now I get it.trumpmoved his inauguration inside so he won’t have to waddle around out in the cold, because he’s afraid people will see the steam rising from his totally piss-saturated and feces-encrusted diaper.",😱 😱 🗽,16,271,44,,/aintscarylarry/status/1880404390709981588
1880404717408604222,@SurvivalReport,Christopher Heaven,2025-01-17T23:59:55.000Z,TrumpInauguration | Extreme Assassination Risk EP372,TrumpInauguration | Extreme Assassination Risk EP372,,1,11,5,,/SurvivalReport/status/1880404717408604222
1880404257100419386,@TDMediaGroup,TD Media Group,2025-01-17T23:58:05.000Z,Bill Gates REVEALS DETAILS Of Meeting WithTrump!https://youtu.be/JU5dzO4chMQ,Bill Gates REVEALS DETAILS Of Meeting WithTrump!https://youtu.be/JU5dzO4chMQ,,0,6,1,https://pbs.twimg.com/media/GhiIrriXgAA9cib?format=jpg&name=small,/TDMediaGroup/status/1880404257100419386
1880404105539325963,@JaokooMoses,Royal Ambassador,2025-01-17T23:57:29.000Z,CONFIRMED: The US Federal Reserve Bank board has withdrawn from the Network of Central Banks and Supervisors for Greening the Financial System (NGFS).Trumphas called the whole climate change a HOAX and is determined to pull the US from that agenda. END***,CONFIRMED: The US Federal Reserve Bank board has withdrawn from the Network of Central Banks and Supervisors for Greening the Financial System (NGFS).Trumphas called the whole climate change a HOAX and is determined to pull the US from that agenda. END***,,2,153,39,,/JaokooMoses/status/1880404105539325963
1880404598340432317,@Daniel_Mac18,Dan MacMillan,2025-01-17T23:59:27.000Z,"Donald Trumpfaces a ‘lame duck’ second term as he's dealt major handicap, NATO warns

So essentially the US public decided to elect a lame duck according to this article. Do the voters know that?#LameDuck#USA","Donald Trumpfaces a ‘lame duck’ second term as he's dealt major handicap, NATO warns

So essentially the US public decided to elect a lame duck according to this article. Do the voters know that?#LameDuck#USA",,0,0,0,https://pbs.twimg.com/card_img/1968035280876630016/Bhirq8iz?format=jpg&name=small,/Daniel_Mac18/status/1880404598340432317
1880404725826228266,@LooseCannonNews,Loose Cannon News,2025-01-17T23:59:57.000Z,"Local Police Departments Are Refusing To Help DC SecureTrump’s Inauguration

Reasons cited include a dispute over a memorandum of understanding (MOU) with MPD, particularly related to use-of-force policies.

Over half a dozen local police departments are refusing to assist.","Local Police Departments Are Refusing To Help DC SecureTrump’s Inauguration

Reasons cited include a dispute over a memorandum of understanding (MOU) with MPD, particularly related to use-of-force policies.

Over half a dozen local police departments are refusing to assist.Show more",,0,1,1,https://pbs.twimg.com/media/GhiKGmhW4AEdyWz?format=jpg&name=small,/LooseCannonNews/status/1880404725826228266
1880404620121632886,@Pro__Trading,Pro America Politics,2025-01-17T23:59:32.000Z,Are they movingTrump's inauguration indoors because of weather or because they're worried about another Thomas Crooks situation?,Are they movingTrump's inauguration indoors because of weather or because they're worried about another Thomas Crooks situation?,,48,140,9,,/Pro__Trading/status/1880404620121632886
1880404417385504906,@Patriotmom717,KᗴᒪᒪᗴY ✰,2025-01-17T23:58:43.000Z,"The Leader of Reform UK, Nigel Farage to attend PresidentTrump’s Inauguration.","The Leader of Reform UK, Nigel Farage to attend PresidentTrump’s Inauguration.",,2,17,5,https://pbs.twimg.com/media/GhiJ2ijWAAAEE0-?format=jpg&name=small,/Patriotmom717/status/1880404417385504906
1880404395587764290,@Trumpusa1A1,Trumpusa1,2025-01-17T23:58:38.000Z,"Former Presidents Barack Obama, Bill Clinton and George W. Bush will not attend President-electDonald Trump's traditional inaugural lunch.

Folks ask me if I care?","Former Presidents Barack Obama, Bill Clinton and George W. Bush will not attend President-electDonald Trump's traditional inaugural lunch.

Folks ask me if I care?",🤣 🤣 🤣,0,0,0,https://pbs.twimg.com/media/GhiJ1NjW8AAvm6Q?format=jpg&name=small,/Trumpusa1A1/status/1880404395587764290
1880404262125265073,@kodiboy10,Kodilock,2025-01-17T23:58:06.000Z,There is something wrong with people being against what PresidentTrumphas and is doing for their country  ... there are many pedophiles in that crowd,There is something wrong with people being against what PresidentTrumphas and is doing for their country  ... there are many pedophiles in that crowd,,0,0,0,https://pbs.twimg.com/media/GhiJteFXQAAPyfE?format=jpg&name=small,/kodiboy10/status/1880404262125265073
1880404590102986992,@ETF500_SOL,ETF500,2025-01-17T23:59:25.000Z,I play to fart and release gas#ETF500,Replying to@Dior100x,💨,11,39,18,,/ETF500_SOL/status/1880404590102986992
1880404333835210983,@UROCKlive1,Khashoggi’s Ghost,2025-01-17T23:58:24.000Z,Donald Trump’s supporters were feeling a little left out in the cold Friday after the president-elect announced his inauguration ceremony was moving indoors due to predictions of severely low temperatures.,Donald Trump’s supporters were feeling a little left out in the cold Friday after the president-elect announced his inauguration ceremony was moving indoors due to predictions of severely low temperatures.,🌻,9,43,14,,/UROCKlive1/status/1880404333835210983
1880404476307361954,@QuiteFranklyTV,Frank,2025-01-17T23:58:58.000Z,"""Inauguration Eve:TrumpTime Travel Review"" 1/17/25","""Inauguration Eve:TrumpTime Travel Review"" 1/17/25",,6,66,34,https://pbs.twimg.com/card_img/1967460848915427328/yqC9S_M0?format=jpg&name=orig https://pbs.twimg.com/profile_images/1613606105170444292/vRcv-9Hc_mini.jpg,/QuiteFranklyTV/status/1880404476307361954
1880404603289891274,@AbadiTesfay,Adey Welela,2025-01-17T23:59:28.000Z,"#Trump,#China's#Xihold call on TikTok, trade,#Taiwan","#Trump,#China's#Xihold call on TikTok, trade,#Taiwan",,0,0,0,https://pbs.twimg.com/card_img/1967361641793904640/WL3sIyx8?format=jpg&name=small,/AbadiTesfay/status/1880404603289891274
1880404404236611855,@JeremyMartinus,Jeremy Martinus,2025-01-17T23:58:40.000Z,Merrick Garland leaving the Justice Department? Guess he finally found out being AG isn’t just about gavels and quiche.Next stop: writing a memoir titled 'Between aTrumpand a Hard Place.'#DOJDrama,Merrick Garland leaving the Justice Department? Guess he finally found out being AG isn’t just about gavels and quiche.Next stop: writing a memoir titled 'Between aTrumpand a Hard Place.'#DOJDrama,🍳,0,0,0,https://pbs.twimg.com/media/GhiJ0KWWkAEHfgM?format=png&name=small,/JeremyMartinus/status/1880404404236611855
1880404720251965929,@TrumpsDeal,Bitcoin Trumps Bot,2025-01-17T23:59:56.000Z,"BITCOINTRUMP2676
Sold for 0.00051871 BTC ($54.47)","BITCOINTRUMP2676
Sold for 0.00051871 BTC ($54.47)",🖼,0,8,4,https://pbs.twimg.com/media/GhiKIKJWgAAnEM8?format=png&name=360x360,/TrumpsDeal/status/1880404720251965929
1880404433231835649,@Watty2025,Brendan,2025-01-17T23:58:47.000Z,Manifesting that Elon Musk andDonald Trumpget exactly what they deserve—take it however you will. I believe in karma.,Manifesting that Elon Musk andDonald Trumpget exactly what they deserve—take it however you will. I believe in karma.,,0,0,0,,/Watty2025/status/1880404433231835649
1880404522562171273,@the_resistor,The Resistor Sister,2025-01-17T23:59:09.000Z,"How sad for the MAGA faithful to realize thatTrumpONLY CARES about HIMSELF. 

They've been played. 

AGAIN",Replying to@LukeRussertand@GaryGrumbach,® ♥,1,30,3,,/the_resistor/status/1880404522562171273
